,Date,Tags,Comments
0,2019-08-29,"['hiking', 'rocky', 'washed out']",I took the upper trail this time. A beautiful hike through the scrub oak. Very steep. Significant erosion in many places. Would be better with switchbacks instead of going straight up the mountain. Didn’t see any snakes but saw 8 lizards and countless grasshoppers. Minimal shade—take lots of water! Would have given it 5 stars if it were in better shape and not as damaging to the natural landscape. 
1,2019-08-21,"['hiking', 'over grown', 'scramble']","A very peaceful trail. All the washed out bridges are back in place. Crossed the stream several times but never got my feet wet. At some points the soil was loose and footing was sketchy. Didn’t see any snakes. Just after the 2mile point (per the MapMyRun app) the trail became pretty hard to follow. I stopped when I got to the top of a granite boulder and came back. This trail definitely needs some attention to make it more accessible and safe. Some of the bridges could be refurbished and reinforced. Overall, a lot of fun and very peaceful. "
2,2019-08-04,"['hiking', 'over grown', 'washed out']",
3,2019-08-04,"['hiking', 'over grown']",This was a very very fun trail! We were on horse back and didn’t make it all the way in due to a very steep downside with very large boulders. Thankfully we have very trusting horses that were able to get us turned around! was insane! Very good workout for the horses though! It’s not for the weak hearted for sure! 
4,2019-08-03,['hiking'],This trail you get to remember what it is like to be a kid and explore different possibilities. At some times you need to seek the right way to keep going. It’s an adventure. 
5,2019-07-22,"['hiking', 'bugs', 'off trail', 'over grown', 'rocky', 'scramble', 'washed out']",The main trail has been over grown to the point where your can give your sells off the main trail easily. there are snakes in the Rocky outcroppings look out for that. also tics are common especially if you end up off the main trail. the river is nice and refreshing but definitely has Leeches be careful. 
6,2019-07-19,"['hiking', 'muddy']","The trail was a little bit hard to follow towards the end as it got narrow and a little muddy, but we did also go after it had just rained. It was absolutely beautiful and my 4 month old puppy loved it and was able to do it just fine. The water has been too high to cross the first bridge In the spring but now its low enough to be able to get over it. Anticipate your shoes getting a little wet. "
7,2019-07-11,"['hiking', 'muddy', 'off trail', 'over grown', 'rocky', 'scramble', 'washed out']","I would like to call this trail the hike through hell but I think hell would be more scenic. Trail is overgrown, no real waterfalls, muddy and trail becomes very undefined at times. I would not recommend this trail to anyone...even Satan. "
8,2019-07-08,[''],"Have hiked this trail a few times but this was my first snow hike on this trail.  Only made it up to the big rock with moss about 2 miles and didn't dare follow the foot prints that were heading to the left and almost straight up since I was by myself.  I wore my ice spikes.  A good workout,  gets the heart rate up.  Crossing over the logs was easier becuase the snow was packed on them.   Very beautiful in the winter snow.  One day I will hopefully make it to the waterfall that everyone is talking about.  Poles or walking stick it very helpful anytime of year for crossing the creek."
9,2019-07-06,['hiking'],"Multiple rattle snakes spotted on the trail, one of which bit a dog."
10,2019-07-04,"['hiking', 'bridge out', 'scramble']",
11,2019-07-01,"['hiking', 'bridge out']","The greenery is gorgeous and shady, but there are some issues. There are a few river crossings, and the bridges are really sketchy so my friends and I decided to just walk in the water. It is definitely a hard hike. Very steep. We got too tired after a mile and turned back. There is a cool place to boulder/climb on so that was fun, but I wouldn't do the hike again."
12,2019-06-30,['hiking'],please anyone up the way of the bountiful B on any road or trail and camping be on lookout for a 13 yr old deaf blind (he has blue eyes due to his severe cataracts) and only couple teeth in back usually his tongue sticks out too. hes white/ tan; looks like a little white fox with his ears erect and has longer nails right now cause he was lost before we came back home to cut them ill post pics in the pics section hopefully alive but if deceased as well please send me pics to confirm or deny its the correct pup. me and his (osiris ) siblings are home for a day and a half then will be back up tomorrow afternoon at our camp site of FR 807 where we had been. there's pics posted and signs at our site and all along ward canyon rd 
13,2019-06-23,"['hiking', 'bridge out', 'off trail', 'over grown', 'scramble', 'washed out']","Gorgeous hike with tons of water, shade, and wildlife. We saw the cutest baby raccoon mewing in a tree. Also spotted a long fat rattle snake and a couple of deer. The “hard” rating seems a bit off. It’s moderate- similar to the Desolation Lake trail. 
One question: WHERE DOES THE TRAIL END??? We turned back about 3.5 miles in at the pipeline clearing. Never made it above the tree line and missed the elusive ridge. 
The trail is washed out and overgrown, as others have mentioned, but the water crossings added to the adventure! "
14,2019-06-12,[''],"Great hike! The water was running high. We didn't come prepared and stopped at the first bridge then turned back. Came across a baby rattlesnake which scared my 6 year old. Overall, it was a fun hike. "
15,2019-06-10,"['hiking', 'bridge out', 'muddy', 'over grown', 'rocky']","Cool trail, very shady and secluded. All the bridges were down or underwater, crossed the river 9 times in 3 miles. Most crossings were knee deep and fast but passible. 

We never found any end to the trail. Around mile 3 it started getting extremely overgrown with a lot of blowdown so we turned back a bit past the pipeline access at 3.5 miles. 

Definitely not a trail for kids until the water level drops. Plan on getting your feet wet. Wear long pants/sleeves if you want to hike more than 2.5 miles up, which is definitely worth it in my opinion. 

Saw one (maybe) rattlesnake below the trail on a large rock, watch your dogs. "
16,2019-06-05,"['hiking', 'bridge out', 'muddy']",Awesome hike. Most of the bridges we came to had been washed away. The water was moving pretty good so I had to carry or help the 2 kids and 3 dogs cross. We came to a spot the water was too crazy and had to turn around. Andddd when we made it back to the truck... someone had broke in and stole my wallet and had $1600 charged by the time I talked to my bank. 
17,2019-06-03,['hiking'],"This a great hike when it’s hot. Lots of shade and water. Not a lot of people on a Monday, I’ll be bringing my dogs back for sure."
18,2019-06-02,"['hiking', 'bridge out', 'over grown', 'washed out']",Trail gets a little narrow.  Trail stops at the first water crossing.  Bridge is under water and can only cross by crossing a slippery log and branches.
19,2019-05-27,[''],"Amazing trail that is along the river the entire way. You have to cross the  river quite a bit, so get ready to be wet."
20,2019-05-27,"['hiking', 'bridge out', 'over grown', 'washed out']","Would love to come back in the fall! We made it to the end, but no one made it with dry feet."
21,2019-05-13,"['hiking', 'bridge out', 'over grown', 'washed out']",
22,2019-05-12,['hiking'],We ran into a bridge underwater which looked pretty slippery and we decided to wait a couple more weeks for the water to subside. But this is our favorite hike and we love hiking all the way up across the rivers and trying to see how far we can get up.
23,2019-05-02,['hiking'],"May 2019. 

Due to the increase of water, there are places where the bridges are either moved or don’t extend far enough. So depending on the size of dog pooches will have to walk or swim across. Humans could probably walk on tree trunks and not ever get wet, but may have to take a few steps in the water. So worth it though!!!"
24,2019-04-25,"['trail running', 'bridge out', 'muddy', 'snow']","Good trail. There are many river crossings some with bridges, some without, or they're underwater. Trail completely socked in with snow at 2.2 miles up. This one's a calf burner, especially early in your season!"
25,2019-04-25,"['hiking', 'bridge out', 'muddy', 'snow']","Good trail. There are many river crossings some with bridges, some without or bridges underwater. Trail completely socked in with snow at 2.2 miles up. This one's a calf burner, especially early in your season!"
26,2019-02-16,['hiking'],"Fun little hike just behind the LDS Bountiful temple. 

I love the feel of the Bountiful canyons!

This was a fun one to explore. 

Need to come back with the dogs . . ."
27,2018-09-24,['hiking'],Such a nice hike up with the dogs and family!  Such a beautiful hike and love the creek for the dogs!
28,2018-09-10,['hiking'],"I hiked with my Boy Scout troop up to the pipeline, which I believe is about 2.5 miles in. According to another group of hikers we met, the trail gets very overgrown past this point. As previous reviewers have noted, the trail is shaded most of the way by scrub oak, maple, cottonwood and tall pines. Overall, it was a beautiful hike, and a good workout."
29,2018-08-25,['trail running'],"This hike is mostly shaded and great for hiking, trail running, or snowshoeing. Never too busy either!"
30,2018-08-17,[''],Incredible trail you get back in the thick of things cross the river several times and if you like to get away from things this is a great trail. A lot of up and down and steep in places but so worth it.
31,2018-08-17,[''],Great dog trail. But watch out for poison ivy.
32,2018-08-16,['hiking'],I’ve lived in N Salt Lake on the east bench for 3 years and this is the first crack at this trail. You should probably read the reviews before you set out on this one. It’s a relatively challenging hike at times but offers a lot of stream access and not too difficult for the first mile. Apparently the end (what I believe was the common end) is right around the clear cut area which is just under 3 miles in. I pressed on for another quarter mile and at that point there were several jogs that were completely overgrown. It was kinda cool to push through thick brush and also added to the challenge. It got late in the afternoon and I turned around but will return and press on because there’s got to be more of a payoff than that clear cut area.
33,2018-08-16,[''],Great dog trail
34,2018-07-21,['hiking'],This is a great trail! It was a little overgrown in places but not bad. I would recommend it!
35,2018-07-04,['hiking'],Really like this trail.   Watch for rattle snakes tho
36,2018-07-04,[''],"My husband and I completed this hike on July 1.

This hike was okay. Typical canyon hike- lovely views and mostly shaded. Frustrating  that the trail was overgrown in some areas, especially toward the end. We're not even sure we made it to the official end of the trail... we just couldn't go any farther. 

Probably would've given it 3 stars, but the stream crossings and clusters of butterflies were redeeming factors."
37,2018-07-02,[''],great hike :)
38,2018-06-24,[''],"Fun and gorgeous hike! There is poison ivy along the trail, so be aware of that, but otherwise a very nice trail."
39,2018-06-21,[''],One of my favorite hikes. love the water and the bridges.
40,2018-06-04,[''],"Great trail, beautiful scenery."
41,2018-06-02,[''],Great hike for families with young kids. Fun to play in the creek along the way.
42,2018-05-05,['hiking'],There are two trails here apparently . One that goes above the parking lot and one that goes below into the canyon. We did the latter. Great family friendly trail. You will cross a couple creeks and rivers but there are bridges over the creeks and the river is currently still calm enough to walk through. Beautiful trees everywhere and lots of shade . There are a couple steep hills.
43,2018-03-11,['hiking'],"Great trail! We have an issue finding trails where my pup can come that aren’t an hour out. So this was a great beautiful local hike for us that we’ll do many more times! It doesn’t have a super clear ending. But we joked about 6 Miles total. Going back and forth with the creek was great. We went with a little melting snow, I’d imagine spring and fall are beautiful!"
44,2017-11-19,[''],"The trailhead for Holbrook Canyon is across the street from the Bountiful Temple.  While there is no spectacular destination at the end of the trail and it is very similar to many other canyon trails along the Wasatch Front, it is a very enjoyable hike.  This trail has many stream crossings, many of which have small bridges and the rest are possible to cross without getting wet as long as you can balance on rocks or logs.  There are several sections of the trail that are wet and muddy.  The trees provide shade most of the way.  The hike does have many short steep climbs and at times there are some steep slopes that fall away from the trail and go down to the river with no railings.  Near the top of the trail bushes have grown over parts of the trail.  Pants are of benefit if you want to do the last half mile of the trail.  The trail peters out after about 3 miles.  Some of the best things about this trail is there are lots of nice places to camp.  I noticed about 4 spots with tent sites and fire pits and saw several others that would work as well.  There are also deer in the canyon.  I saw about 6 near the top of the canyon.  There are several large rock sections that would be fun to climb around on and explore.  The river is very relaxing and beautiful and only makes the camping sites even better."
45,2017-10-17,['hiking'],"Fall!  What a wonderful season to hike this Trail. Mid-hike (about the waterfall,) the canyon narrows, trail was icy making river fords (log and rock crossings) much more tricky, and I would say the most technical part of the trail. Definitely less traveled and more overgrown from ""the falls"" on up to ""pipeline path,"" but still very evident and passable, with the canyon opening back up and making travel eaiser, but still muddy in spots.  AFTER ""pipeline path,"" trail obviously continues eastward, higher up canyon on (south side of creek,) but CONSIDERABLY more overgrown, so I turned back."
46,2017-10-16,['hiking'],Great hike by the little creek. Second half of the trail is a little over grown and muddy. But still pretty awesome trail!
47,2017-10-15,[''],Very beautiful !
48,2017-10-15,[''],"loved this hike. It wasn't super hard but beautiful. It does get a little technical when there's a lot of water,  but totally worth it. not a bad hike."
49,2017-10-07,['hiking'],Tons of horse dung; I passed a group of 10 horses while hiking today. Had to stop at 3 miles due to overgrowth but the trail should continue at least one more mile to a waterfall/pool according to the Davis County Trail Map.
50,2017-09-25,[''],"This is my favorite hike in Northern Utah. I love how you're walking a long a creek the whole time. It is very hard to get lost. In the 20+ times I have hiked it, I have yet to see a snake."
51,2017-08-18,['horseback riding'],Beautiful but in need of some trail cleanup and repair
52,2017-08-13,[''],Beautiful if you want to get lost on a nice valley hike
53,2017-08-05,[''],"This is a great summer hike. I wore hiking sandals and waded in the cold stream that weaves through trail. Not really very hard, but walking sticks are helpful."
54,2017-08-03,['trail running'],Ran an out and back for a total of 5.3 miles. Trail was very pretty and enjoyable up to about 2 miles into the canyon. Trail then became obnoxiously overgrown to the point where running was no longer possible. Ended up turning around at the pipeline clearing because we couldn't find where the trail continued. Fantastic trail if you intend on keeping it under 3 or 4 miles. No rattlesnake sightings for us.
55,2017-07-26,[''],"Cloud cover was great. Nice, easy hike. Good family hike. Lots of shade"
56,2017-07-23,[''],I like the amount of shade and how much you're by the river. Ideal for our super furry dogs. Very beautiful as well and no Mountain Bikers.
57,2017-07-15,['hiking'],"My brother and I went on a 2 hour hike up Holbrook Canyon. We went for 4.8 miles and came back. There is a very steep part 2/3 of the way through where we had to climb on our hands and knees, there is also a empty mine tunnel of the trail. It was fantastic!!!!"
58,2017-07-12,['hiking'],"Great hike, very beautiful and shady.  We followed the stream.  I had my 10,7 and baby in backpack.  We only got a mile or so in and turned around.  It was their favorite hike!  Although, beware of rattlesnakes.  My son almost stepped on one.  We also saw a skunk cross the trail.  Adventure!"
59,2017-07-08,['hiking'],
60,2017-06-18,['hiking'],"Awesome hike!  Will exert a lot of energy to get to the top!

It is rated difficult so I don't understand the reviews saying the trail isn't maintained, it is steep, or they got weed whacked----and then rating it poorly---it is what it is, a fun but exerting hike!  

Best part of hike was very few people!  The views!  The creek!

Started out being careful to not get wet...by the end we were just avoiding all the bridges bc the water felt so great!

Dogs loved it!"
61,2017-06-17,['hiking'],"Beautiful natural area, with wildflowers and the pretty Holbrook Creek. But this trail is not well maintained, with several sections where you have to climb over downed trees, wade through the creek, or scrape through overgrowth. I almost stepped on a rattlesnake on the way back; be careful!"
62,2017-06-05,[''],"Just hiked this trail yesterday (May 31, 2017). Beautiful views and secluded. However, beware, we saw two large rattlesnakes on the trail. I'd avoid bush wacking. We did see a badger and a hiker we met saw moose the week before. The creek is very high and fast right now with the run off. Lots of fairly challenging creek crossings. Definitely bring a walking stick to aid your crossings and be prepared to get wet. Totally worth it, though."
63,2017-06-01,[''],Nice trail up and down lots of water. You will get wet. Went up like 12 miles. Ran out of trail and kept going. Saw elephant rock and the pipeline. I never saw a waterfall? Has anyone here seen it? Is it of the trail? The app says it does and no one on here has seen it. Any tips?! I have gone past where most people stop and saw no waterfall.
64,2017-05-29,['walking'],Pretty hike along the creek. The creek was very full on Memorial Day and overtook the trail at places. This hike has multiple creek crossings. Plan on getting wet! We went 3.2 miles up the trail. Carried a six month with the carrier and it wasn't too difficult. Not very steep. Never saw the waterfall. Did enjoy the creek though.
65,2017-05-24,['hiking'],"Water level still pretty high so most of the crossings are still underwater. Had to trudge through the creek in multiple places.  The canyon itself is beautiful but the higher up on the trail you get, it get's in really bad shape being really overgrown and covered in lots of debris and downed trees/branches from winter so I got pretty scraped up. Still a fun hike though."
66,2017-05-13,['hiking'],"The river is running high, fast, muddy and cold. Crossed it many times because all of the bridges were washed out or under water. The river was running down the trails that ran next to the river. The water was so cold even the bottom of my feet hurt. You might want to wait for the water level to goes down"
67,2017-05-10,['hiking'],"Great Trail!!! My kids and I have hiked it 3 times now, they were 3 and 7 the first time and had basically 0 difficulty until after the last Creek pass, then it goes all uphill. About a week ago the creek passings were pretty much just water, the run off makes it look like a river!! Good trail though, it's one of our favorites!!"
68,2017-05-07,['walking'],It's awesome
69,2017-05-06,[''],"Fun trail, I'm not an avid hiker, but this was really fun"
70,2017-05-04,['hiking'],"5/3/17 - The trail starts out nice. Good rolling ups and downs. The river and bridges are fun. At a couple of points higher up, it's easy to lose the trail because of overgrowth and junk that's come down the mountain from winter. A lot of rigid overgrowth scratched up my legs real good. 1/5th of the trail is a small stream this time of year from runoff. Towards the end the trail got lost completely. I trudged ahead a bit to see if it picked up again but no avail. Marked my GPS and it turns out I was about 300-400 feet from the end."
71,2017-05-01,['hiking'],"We hiked up for 30 minutes then turned around. Had a 5, 2, 7 month old and we loved the bridges!"
72,2017-04-23,[''],
73,2017-04-23,['hiking'],"This was a good trail with a good mix of challenges, and easy spots. Water crosses the trail quite often, which adds a bit of fun and beauty to this trip. My son came with me, and he's a can-do, new, and excited hiker. He had so much fun, but we both got tired about 1.7 miles up! We headed back down after that. We got to see a little snake near one of the places water crossed the trail, and a small lizard too. Bring snacks and water!"
74,2017-04-06,[''],"I'm not sure why this trail is rated ""hard"". It's a little lenghty but I found it super easy considering the distance. It seems about as flat as a canyon trail can get. Maybe it's considered hard because you have to cross the river multiple times and people don't like to get their feet wet, I don't know. I loved it and my dogs loved it. I would highly recommend this trail."
75,2017-03-10,[''],Still lots of snow after the first mile.  Sunk to my waist a couple times.  Bring snowshoes.
76,2016-10-22,['hiking'],"Hard. October, lots of moisture. Have hiking shoes. Went up like 10 miles ran out of trail. Saw elephant rock and the pipeline. No waterfall. Hard past 5 miles. Thick vegetation."
77,2016-09-08,[''],"Great hike, 6,5mies to the pipeline- you can hear the stream most of the way- mostly shaded. Four legged pooches really had fun."
78,2016-07-23,['trail running'],"A nice, calm journey. I don't think it should be considered ""hard."""
79,2016-07-14,['hiking'],This is a nice hike if you do it around 8am it's shaded all the way.
80,2016-07-10,[''],there is a stream you follow some of the way.
81,2016-07-05,['hiking'],"One of the most beautiful trails I've done. We took the lower trail so it was very shaded and followed along the creek. It was a pretty hard trail when you're carrying a 40 pound backpack occupied by a toddler. We only made it one mile in before turning around. We took our 6 and 9 year old and they loved it. But it's definitely not a trail I'd do with younger kids than that. Even though it was beautiful, it was indeed a very steep trail."
82,2016-07-05,[''],"Nice trail, you have to go across the stream often, but it was fun. We didn't reach the end of the trail, but by the time we got back to our vehicle we had gone approx. 5.27 miles so the trail is longer than the posted 5.1 miles."
83,2016-06-25,['hiking'],Great
84,2016-06-25,['hiking'],My pup and I enjoyed this hike. There was not too much traffic on the trail... actually hardly any...and crossing back and forth over the river was pretty fun.
85,2016-06-15,['hiking'],Very fun trail. We kept going for about another thirty minutes past where the All Trails map had the ending point because there was a pretty clear trail that still kept going up - so we did about 7 miles round trip but it definitely could have been longer. You'll more than likely get your feet wet and it's quite overgrown about two miles in for most of the hike. We even spotted some sport climbing rocks on the way so that was neat. Overall a great trail! We didn't run into anyone.
86,2016-06-11,['hiking'],Really fun hike. Saw only a few others and a lot fewer further up. Got rained out so we had to come back early. Not sure how much further it was. The trail can also be over grown in some areas so you have to push your way through a little.
87,2016-06-10,['hiking'],Great hike with my pup! Really saw only three people. Loved the river and having to cross it so much. Wear some shoes that can get wet (I wore Chaco's).
88,2016-05-22,['hiking'],"Nice hike.  Muddy as the stream was in full flow with the spring rains.  It is a elevation climb from the beginning with numerous creek crossings.  Plan for shoes that can get wet.  We used walking sticks which was a great idea due to the mud. We went nearly 3 miles in and never hit the trail end. This is closer to a 6 or 6,5 round trip hike.  Enjoy."
89,2016-05-03,[''],This was a really nice hike. Only ran into a few hikers. I would not suggest taking little kids on this trail.
90,2016-04-08,['hiking'],"It was a great! Narrow trail, no traffic. I ran into only 2 other hikers. I won't recommend hiking with kids unless u r carrying them."
91,2016-02-27,[''],"Always beautiful, trail follows a flowing stream.  My dog and I love this trail."
92,2015-11-08,['hiking'],Great trail! Some parts were muddy and icy but nothing unbearable. Most of the leave were gone but it was still gorgeous.
93,2015-10-18,[''],Gorgeous trail- even at this time of year! The trail is covered by canopy except for a couple of spots. Took a dog and he had a blast! Definitely will be back to this trail.
