,Date,Tags,Comments
505,2016-05-11,['hiking'],"Beautiful hike in the late afternoon and early evening. Water level was high with the spring runoff. Hike is easy to moderate depending on what kind of shape you are in. On our way out there were are a lot of people on the trail, youth groups, scouts, but everyone was very courteous. Definitely worth the time."
506,2016-05-08,['hiking'],"Great hike! I would definitely make sure to bring an extra pair of socks and shoes, as the only way to really see the waterfall is to cross the flow of water. Beautiful scenery. There is a little bit of climbing on rocks to get there, depending on which trail you take, but it was an incredible hike, and I'd definitely go again!"
507,2016-05-08,['hiking'],It is a great fun family hike. We went 2 weeks ago in early spring.  The waterfall was beautiful and full.
508,2016-05-08,[''],Fun trail that is well cared for.
509,2016-05-05,[''],Amazing!!
510,2016-05-05,[''],I liked it a lot and the waterfall was awesome at the end. It took my dog and I an hour and 15 round trip.
511,2016-05-04,['hiking'],Loved all the nature and the friendly people on the trail as well!
512,2016-04-30,[''],Nice little hike. 30 min to the falls.
513,2016-04-28,['hiking'],Good view of pretty much the entire salt lake. You can also head back into the mountain a little bit. Going to check it out again for sure.
514,2016-04-26,['hiking'],great hike
515,2016-04-25,['hiking'],"wow, thought id take the fam (me wife 13 boy 8 boy 6 boy) on quick, short, hike. started late, 530. was going to return by 7 not at 9. the area just kept getting more and more awesome. ended up doing the whole hike. glad we did. waterfall was very cool. well worth it. so proud of boys. youngest had hard time up, but said he wanted to do it again. will do, just start early a.m."
516,2016-04-24,['hiking'],decent short hike for an afternoon.  I'd rate it more to the easy side.  good early hike to stretch the legs.
517,2016-04-22,['hiking'],"It was a great hike. Taking a ""shower"" is really refreshing once you get there."
518,2016-04-19,['camping'],This trail was fun.  we camped over night.  saw the waterfall during the day.
519,2016-04-19,['hiking'],"Favorite hike in northern Utah in the 2-4 hour range. Not to challenging but you should have some good endurance, the worst part is absolutely the first set of switchbacks in sand."
520,2016-04-18,['hiking'],An easy hike in the warm months. Quite tricky before all the snow melts. Very busy on the weekends. Beautiful canyon views the whole way up.
521,2016-04-17,['hiking'],Excellent weather! Very beautiful with very little foot traffic. Completed this hike in ~2 hours roundtrip. Minor snow but didn't pose any obstacles. The waterfall was amazing and the view of the valley at the beginning is incredible!
522,2016-04-17,['hiking'],Beautiful. The beginning is a little rough if you are out of shape like myself 
523,2016-04-12,[''],Beautiful!!! Keep going to the very top! Cross the river on the left side and you can see the most beautiful sites!
524,2016-04-10,[''],"accidently put my review on waterfall canyon, but they are the same. fun hikes, not for little kids!"
525,2016-04-10,['hiking'],Extremely fun hike with great scenery.  Love this trail and will definitely hike it again. Waterfall at the top was well worth it.
526,2016-04-10,[''],This was a fabulous way to spend a Saturday morn with my boy! Absolutely loved seeing all the different breeds of dogs along the way too! All good fun ... and beautiful!
527,2016-04-03,[''],Both lower & upper falls were beautiful. Fun hike.
528,2016-03-28,['hiking'],Excellent hike. We went in late March and there was still snow near the top. It got pretty slick and dicey in some areas but it was a lot of fun. Go all the way to the top! It's worth it.
529,2016-03-28,[''],"Fun, good little hike, but the waterfall isn't that impressive."
530,2016-03-27,[''],Wore running shoes. Not prepared for slick snowy parts. Still worth the bumps and bruises.
531,2016-03-21,[''],"First time doing this trail, I like the trail but there are way to many people on it. Think I will stick with the less traveled trails."
532,2016-03-14,['hiking'],"I've been going up every week for the last month and it's a really a fun hike. There is still some snow on the upper half that running shoes, without extra grip, will be challenged. I used hiking boots and trail poles and it makes it easier. I was able to go up and down in about 2 hrs., but I was pushing it."
533,2016-02-18,['hiking'],The waterfall is gorgeous in the winter but uses your snowshoes or crampons! Otherwise the hike can be exhausting and dangerous.
534,2016-01-10,['hiking'],"This is a beautiful trail, you can go there year round, we have been there in the summer and in the winter and it took us like 2 hours to go up all the way to the fall and about 1.5 hours to come back, we just went back for the second time now in January 2016 and it is beautiful with all the snow, specially the waterfall with all the ice."
535,2015-11-15,['hiking'],Went November 14 2015 and super iced over in some spots. But very fun and cool temp.
536,2015-11-10,['hiking'],Beautiful hike with a few different beautiful waterfalls!
537,2015-09-24,['hiking'],"This was my first time in Utah. I'm only in town for Comic Con this weekend and a local recommended this spot from ""Vapor Affliction"" (Rex). The hike was very enjoyable and the waterfall was a good reward. I had lunch at ""Tosh's Ramen"", (Tonkotsu w/Shiitake mushrooms), then I stopped by ""Tulie Bakery"" (banana tart and slow drip coffee) and ended the night with a Cold Cut Banh Mi from ""No Mai""(as seen on Diners, Drive-ins and Dives)."
538,2015-09-10,[''],"This is one of my favorite hikes. I've done it about 15 times now. The beginning has sandy switchbacks that are a bit tiring but once you get past that and into the trees it's pretty much smooth sailing. The trail is pretty nice and shady from that point on as well. The last stretch of the hike is a bit more of an incline but The waterfall at the end is certainly a reward. You can even climb up the crevice by the waterfall all the way to the top of the mountain if you're up for it, although it's not part of the hike and it's pretty steep."
539,2015-09-09,[''],First trail that I have finished. Just started getting into hiking. Great trail and a great reward at the end loved the water fall!
540,2015-09-07,['hiking'],"It was an enjoyable hike, but the trail is, in my opinion, difficult.  Labor Day is not the best day to hike it.  I am sure there were at least 500 people on the trail.  Most were friendly and understood trail rules.  The falls are nice.  We decided we much prefer consistent trails like Mueller Park, even with all the bike riders.  You won't see any bikes on Adams, but you will see every kind of dog known to man.  Nice way to spend the morning."
541,2015-09-06,['hiking'],Great hike.  Definitely not an easy hike.  I was surprised as we passed 3 families with children younger than 6.  Very dog friendly as well.  People were patient and friendly.  I took my 14 and 10 year old and it was not too challenging for them.
542,2015-08-31,['hiking'],"Fun, quick hike! When we got to the falls we scrambled up the dry rock side and had a great view!!!
We started late afternoon so we could catch sunset on the way out. Excellent trail for running!"
543,2015-08-24,['hiking'],"This is a great hike, and the waterfall at the end is amazing!! This is NOT an easy hike. For about 3/4 of the way it is easy, but the last 1/4 becomes quite steep with several rock scrambles, so be prepared. Also, I think that this is a hike that is best done in the summer/fall. You follow the river very closely at some points and I am sure when there is snow melt the river become quite high."
544,2015-08-20,['hiking'],Great time-- even with 5 little ones in tow-- we all enjoyed it!  The Falls were beautiful!!!
545,2015-08-17,[''],My kids and I really enjoyed this trail.
546,2015-08-11,['hiking'],Good afternoon hike!
547,2015-08-10,[''],"Beautiful, rugged, but lots of people."
548,2015-08-08,['bird watching'],"Muddy.  Hard, rocky and uneven terrain in most parts.  The waterfall is pretty, but not the hike.  This trail is NOT EASY."
549,2015-08-07,[''],Nice!!!
550,2015-08-06,['hiking'],"This trail is very dog friendly - there's water almost the whole way - but can be pretty crowded, especially on weekends. I would not call it difficult, more moderate, but the waterfall at the end is definitely worth the trip at least once! I haven't done it in over a year but it's generally one we try to do every summer or fall."
551,2015-08-04,[''],It's tiiiiiight
552,2015-08-02,['hiking'],This was a good hike I recommend early in the morning if you have a dog. The sand is pretty rough on their paws we had to carry our 65 pound dog down the bottom part of the trail because how hot it was in the afternoon!
553,2015-08-02,['hiking'],"It was a great hike! We started the trail at 9 and the sandy part was almost all in the shade. Once you hit the canyon it cools off from the breeze over the water and is almost all in the shade. There are parts that are pretty steep and rocky. It was easier to go up than down! 

It is definitely worth making it to the top! The falls are amazing. The water is super chilly even in August. But it was extremely refreshing after the uphill climb."
554,2015-08-02,['hiking'],"Adam's Canyon is great hike to a beautiful waterfall. It's hard to believe that a trail that starts so close to a busy road can take you to a waterfall deep in a canyon only 1.8 miles later. It involves a little more elevation gain that most of the waterfalls in Utah, but it's totally worth it. Adam's Canyon is a popular hike that only takes a couple of hours to do.

For pictures and more information on this hike, visit http://www.yourhikeguide.com/adams-canyon/"
555,2015-08-01,['hiking'],Excellent
556,2015-07-29,['hiking'],"This hike may be a little too difficult for beginners or little kids. the parking lot is small. we're just lucky that we got the last spot available when we arrived.  the entrance of the trail is in a residential area. I almost thought that we were at the wrong place. 

The first half mile or so of the hike is not shaded. So make sure you put a lot of sunscreen before you do this hike. We've seen a couple of snakes on the trail. the first one we was is a small snake on the side of the trail. the second on is a bigger one - probably 4 feet long. so be cautious. once you pass the the hill, most of the parts of will be shaded. it's a little difficult i would say since there are narrow and rocky paths. we stopped halfway to rest and take pictures of course. we saw a fallen log and walked through it to cross the beautiful stream. took beautiful pictures there. after 10 -15 mins, we continued our hike. it was a rocky hike. before hitting the end of the trail, we had to go through a steep rocky trail to get the falls. then we crossed the stream to get to a good resting place close to the falls. be prepared to get your shoes/feet wet. We always bring flip-flops on our hike to soak our tired feet into the water and take pictures of course closer to the falls. Gotta warn you though...the water is ICE cold. 

Overall, it was a beautiful hike. the waterfalls is a great reward after the tiring hike."
557,2015-07-20,[''],Awesome!!
558,2015-07-14,['hiking'],"I completed this trail on a Sunday afternoon with my brother and my dog.  It took about three or so hours round-trip.  The trail is mostly uphill and shaded with a few flat areas to rest or cool down, if needed.  The last part of the hike is more challenging as you will need to climb rocks.  Having shoes with decent traction will be helpful, especially when coming down.  There were mostly twenty-somethings and families, but it didn't feel overly-crowded.  It was dog-friendly and everybody we encountered was friendly and courteous."
559,2015-07-13,[''],Wonderful trail. My dog and kids loved it.
560,2015-07-12,['bird watching'],"My dad and I hiked Adam's Canyon this morning and I would rate this trail as moderately difficult, not easy. The incline of the trail doesn't stop but once in a while you have a few flat areas. Once you reach the canyon it's gorgeous with a nice breeze. We hiked near the stream and climbed up and up. There was one treacherous area where I was afraid of climbing down. Thankfully my dad found us an alternative way to get down by the stream. Whew! We hiked about 3.5 miles or more total and definitely burned some serious calories. Can't wait to do it again and make it to the waterfall!"
561,2015-07-12,[''],Beautiful waterfall! I took my dog and she loved it.  This is a great hike for families.
562,2015-07-10,[''],"It was great! I went a couple weeks ago and I loved it. I made it up the trail in a little less than an hour, but my friend and I were booking it. We went very fast on the way up. It took us about a half an hour to get down. 

Some tips:
-Bring sunscreen. That's a no brainier. 
-If you bring a dog, make sure it's people friendly. There are usually other people on the trail. 
-The very first part of the trail is very hot, and there is sand. I wore white running shoes....I would t recommend doing that because they were brown by the end. But, my running shoes also were very fast drying. That was nice because there is a waterfall at the top that you have to cross some water to get to; my shoes were dry by the time I got done with the entire hike. 
-Going under the waterfall is well worth it if you're hiking in the summer! It cools you down for the entire way down. 
-Bring water and a snack!"
563,2015-07-08,[''],Nice trail with some challenging points.  Love the waterfall
564,2015-07-02,[''],"Not too hard. If you are taking kids, make sure you have plenty of water on hand."
565,2015-07-01,[''],Awesome! Cool canyon hike even in the 100 degree temps.
566,2015-06-27,[''],Great hike. We'll do it again.
567,2015-06-22,['hiking'],"Hiked this Saturday! My dog and I loved it!  BUT- the sand on the first .75 miles is REALLY hot.  Make sure you go early in the day or bring doggy booties (like I did) so your dog doesnt burn their paws!  A little bit of rock scrambling in some parts but a great workout with water for my dog to drink, and the falls were gorgeous.  And the shade was great!  Just need to get past the .75 miles of hot sand and switch backs. 

Great pictures and details on my blog! 
http://www.katiewanders.com/2015/06/adams-canyon-trail-waterfall-hike-dog.html"
568,2015-06-20,[''],"Another great trail in the awesome state of Utah! The 'chairs' up at the top are so cool! I also hiked up to the very top of the ridge, which provided an even more astonishing view of the valley! I found it a little difficult at the beginning, just because there are so many trails, but it wasn't that big of a deal."
569,2015-06-18,['hiking'],"One of my favorite trails,  Don't be scared off by the first part with all the switch backs, because once you get past that, the trail is amazing. Makes for some beautiful water pictures."
570,2015-06-17,['hiking'],"This hike is fantastic! The hike is pretty easy going, until the last 1/4 of a mile or so where you get to climb over rocks. It's not too bad, though! The waterfall is gorgeous!!! Also, this was my first time using this app and I was pleased that it led me straight there!"
571,2015-06-15,['hiking'],It's beautiful!
572,2015-06-13,[''],great hike. my brother and I try to do it once a year.
573,2015-06-09,[''],"Great hike for almost all ages.  There are a few spots near the top where you should watch kids closely, but nothing too major.  Don't let the first section of switchbacks scare you away, because it could be the worst part.  On a hot day this part is pretty uncomfortable.  After that it's a steady climb in the trees with a great pay off at the falls.  Good trail if you haven't hiked in a while and want to get back into it."
574,2015-06-05,['hiking'],"Took my three kids up here on an overcast Friday morning. I heard the worst part was the sandy switchbacks at the beginning, but we made it through that all right. The hardest part for my kids was the last quarter mile, with numerous scrambling and hopping sections. I think an adult with a decent sense of balance would have no problem (although many adults were huffing and puffing, so be prepared for that), but the trail can be quite difficult for small kids due to scrambling and their shorter legs.
That being said, I loved the trail. My first time up here despite having lived in Utah for the past twenty years - I've avoided this one due to the crowds, but hiking it on Friday morning meant it had no more traffic than most other popular trails in the area. It was absolutely gorgeous - not only the waterfall, but the views and sections of the river when the trail got close by. Definitely worth the trip, but I would try to schedule for it an off day so you can enjoy the trip without too many crowds around."
575,2015-06-05,['walking'],First part is a little sandy seems like the trail is washing away but it's beautiful loved it went with husband mother in law and my little chihuahua everyone enjoyed it
576,2015-06-03,['walking'],"This is a difficult trail, but doable. The waterfall is definitely worth the hike. The only thing I wish was different was that the path was clearly marked."
577,2015-05-30,[''],This was a beautiful hike!!! I will definitely do it again!!! The waterfall was amazing! It was a moderate difficulty level but my 6 year old did just fine!
578,2015-05-24,[''],"Not sure I agree with the easy rating all trails has this at, but a great hike none the less. The beginning is pretty steep as you make your way up the switch backs, levels out for awhile and the some climbing up rocks towards the end. Wear quality shoes and take your time and you'll be fine."
579,2015-05-14,['hiking'],"I like hiking in all forms, but to have a nice hike to a great spot , to sit and enjoy and then come back from  is like complete satisfaction to me. 
I took 4 of my kids ranging from 12 down to 4.  All loved it, as did our dog. I have taken many cub scout groups on it as well. You can take it slow and easy, look at snakes, bugs and play in the water along the way, or take off up the rocks if looking for more challenging exercise.
  It is just a perfect hike."
580,2015-04-26,['hiking'],Done this with my husband and our 7 year old. Really great trail!!! My son done excellent on this too.
581,2015-04-06,['hiking'],"This was a fun morning hike. It was SUPER busy when I got there, but everyone was so spread out, it never felt crowded. I got there at 10:30am and there were about 25 cars and when I left, there was at least 50. It took about an hour and twenty minutes to water =fall and 50 minutes to get back down. You have to do a bit of rock climbing at the end, but the waterfall is worth the extra effort. Also watch out for snakes - there was a nice big one in the sandy area at the beginning of the trail."
582,2015-03-24,['hiking'],Such an amazing hike!! My dog loved it.
583,2015-03-21,[''],"This is a difficult hike but well worth it. I took my dog and 2 kids, 10 years old, and we made it all the way up in about 2 hours. The last half is more rock climbing but it's still fun. There were plenty of people on the trail and I saw plenty of little ones too but I don't think my 6 year old daughter would have even made it half way. If you take your time it's a good challenging trail."
584,2015-03-19,[''],"Wow, one of the most beautiful hikes I've done in the northern Wasatch front (lived here less than a year!)
The upper end of the canyon can be chilly as it is deep and shaded. Even on a Tuesday there were around 12 cars at the trailhead - don't expect solitude!"
585,2015-03-14,[''],Great time of year for this hike as it was in the 60s and only enough snow and ice to make it interesting.
586,2015-02-17,['hiking'],Completed this hike in the summer.  Adams Canyon Trail can get crowded so you may want to save this one for a weekday.  The trail can get rocky and at small sections require some easy rock scrambling.  Watch for snakes.
587,2015-02-15,[''],Love this hike.  Did it yesterday and today ....couldn't make it to the waterfall (almost) because I had my 7month old strapped to me in a Carrier and towards the end it was icy and dangerous (with an infant ). But I heard the waterfall was spectacular....was busy...but people are very friendly !
588,2015-02-14,['hiking'],"On a 60 degree day in mid winter we trekked through the mayhem of hundreds if not 1000s of hikers, families and dogs. It was so busy you needed traffic controllers. Apart from poor timing the hike itself was great. A little tougher than the blue rating I thought because of the constant inclines. Better when you break off the main trail for finding the less traveled road :)"
589,2015-02-11,['hiking'],"Awesome Hike!  No snow at all until the very end, and even then there really wasn't much at all."
590,2015-01-29,['hiking'],"I just did this around 11A, and there were 3 others that I ran into within a period of three hours. This was nice, however; the ice for the latter part of the trail was pretty shady. Slipped a few times on the way up and down. Totally worth it to sit alone in the canyon, in the presence of the waterfall and eat some lunch. Little difficult for a beginning hiker, but totally worth it at your own pace. Can't wait to do this one in the summer!"
591,2015-01-04,[''],We hiked this trail on a Sunday morning in January and only saw 1 other person. It is beautiful in the winter. Very peaceful.
592,2014-09-14,['hiking'],"This was an amazing hike. It was a bit difficult on the way up - be careful of the rocks - so I'd suggest an early start and plenty of water. But you weave back/forth across the river before ending up at the waterfall. There are lots of great places to stop and rest if you need to. I saw a lot of people on the trail who didn't make it to the waterfall - some only a few minutes away from it. Such a shame as this is a gorgeous little fall and the water was so refreshing. I saw lots of families too, but I don't know if my kids on all the rocks. Some kids we're having an easier time than others. All in all - a great day hike."
593,2014-08-25,['hiking'],"It was overall a good hike. Harder with little ones, but workable if you have help."
594,2014-08-23,['hiking'],"Decided to take this hike on my last afternoon in town, and was so glad I did. Not as strenuous as some of the others I did recently while in SLC, but the falls and the canyon scenery once clear of the shoreline trail were really very beautiful, especially considering the high amount of traffic on this trail.

There's a nice bouldering/ready free climb opportunity around the falls, and the view from up top is great. Thanks to the nice folks who left a sturdy fixed rope along the cleft that goes to the top of the falls!

Picked up a lot of small trail trash on this route (a full doggie poo bag, really?)...except for the dog bag, not a gripe (little kids need to hike, too!); just be ready to help keep it clean if you're not busy with tots of your own."
595,2014-08-10,['hiking'],"I've hiked dozens of trails in the valley by myself and this is the first one I got genuinely lost on.  There are a myriad of trails to choose from over the decades of usage. The waterfall was lovely, but it was the descent I went astray.  Sure it's lovely but just left a bad taste in my mouth getting lost.  And a Subaru was broken into in the parking lot. Only one car but FYI."
596,2014-08-06,['hiking'],loved this hike!
597,2014-08-03,['hiking'],Very Beautiful hike...Worth the work to get to the waterfall!!!!
598,2014-07-26,['hiking'],"Super great! I TOTALLY recommend it!
It's not a real tough hike, though it does have up hill parts. But if you get tired there are plenty of places that you can stop to take a break. I recommend going in the morning so it's cooler and less crowded and remember to bring lots of water and a camera to take pictures of the BEAUTIFUL waterfall at the end!"
599,2014-07-09,['hiking'],"This is a great canyon to hike.  There are a few difficult parts, but overall it's not too hard if you take your time.  We usually hike it rather quickly with kids and it takes us about 2 hours up and back.  If it's your first time, take your time and enjoy the river, steep canyon walls, and great waterfall at the top.  Bring some snacks and have a little lunch at one of the campsites along the way up."
600,2014-06-15,['hiking'],"A nice trail. We did it on a Sunday, and although it was crowded we had fun. We took our dog off-leash and came across many other dogs along the way. It's definitely a great hike if you have a dog. It runs along a creek for most of the way, and ours loved playing in the water as we hiked. There's a waterfall at the top which was a nice place to stop, relax for a bit, and have a snack. The trail was fairly well-defined for the whole way. There is a small ""trail"" from the base of the waterfall to the top, but unless you're experienced it's quote dangerous, and I wouldn't recommend taking it even if you are, just in case someone takes a tumble and brings you down with them. We saw so many people attempt it who clearly had no idea what they were doing. But anyhow, lovely light afternoon hike. It took us about 3 hours round trip, and we were going at a pretty leisurely pace. "
601,2014-06-11,['hiking'],This has to be my favorite day hike in Utah to date. The hike itself is relatively easy and there are plenty of stops along the way worthy of photographs and lasting memories.
602,2014-06-08,[''],I LOVED this hike. Gorgeous! Following the creek was amazing. Pretty waterfall at the end!
