,Date,Tags,Comments
0,2019-09-07,['hiking'],"Love Adams , love the waterfall, initial switchbacks are brutal but a great hike for all . "
1,2019-09-06,['hiking'],Hiked this today with our 4 and 6 year old. A couple tricky spots but overall not to bad with the kids and the waterfall was so worth it 
2,2019-09-04,"['trail running', 'closed']",Currently closed because of the Snoqualmie fire.
3,2019-09-03,"['hiking', 'bugs', 'scramble']","I did this trail on August 15th, 2019. It was described to be much more difficult than it actually was for me. I hit the trail at 0730 with a temperature of 59 degree F. I made my way up the few switchbacks, which are entirely exposed. Leaving early, I was never in direct sunlight for the ascent. Once you get to the top of the switchbacks, veer to the right to get to the falls. As I entered the brush into the canyon it was cool. Although every stop for photo ops meant getting attacked by mosquitoes, so do bring bug spray. A creek runs adjacent to the trail the whole way, so bringing a dog would be ok. As you get closer to the falls, a bit of scrambling is necessary, but not very difficult. Good boots are helpful, but I honestly could have done this trail in Chaco’s. I got to the falls right at 0830, took a few photos and cooled off. Once I got out of the canyon, the sun was up and direct. I was glad I brought water. Returned to my vehicle at 0930 with a temperature of 72 degrees F. Overall, this is a great and convenient hike. The falls are worth the work and a great place to cool off, although they are surrounded by rock walls, so go early when not many people are there yet. Had the falls to myself."
4,2019-09-02,['hiking'],The Sandy switch backs kinda kicks your butt in the beginning and right before the waterfall you are hugging the rocks and that’s a little bit sketchy for a newbie. It’s all about foot placement. If I can do it anyone can do it! 
5,2019-09-02,"['hiking', 'rocky']",Was a good trail!  Took our dog and made it up and back in about 2 and a half hours.  There’s some spots with some bees over the water that are a little intimidating but made it by them without a problem :).  I would recommend coming around 5 to make it down by 8 at latest for the best weather.  We came at 12 and it was hot for the first part of the trail but there was acid shade throughout the rest.  Our dog loved it :)
6,2019-09-01,"['hiking', 'bugs', 'rocky', 'scramble']",
7,2019-08-29,"['hiking', 'rocky']",Little hard for beginners but nice hike for a nature lovers 
8,2019-08-28,"['hiking', 'rocky']",The trail is not well marked and difficult to follow in some places.. especially at the top. The trail also becomes fairly technical and rocky. I wouldn’t recommend hiking it by yourself.. too many risks for injury with the rocks and in veering off trail. 
9,2019-08-27,['hiking'],I’ve hiked this more times than I can count and it never gets easier. Shout out to the dude who cut his leg up on the way up
10,2019-08-26,"['hiking', 'washed out']",My
11,2019-08-25,"['hiking', 'bugs', 'muddy', 'rocky']",
12,2019-08-21,['hiking'],This is a great hike although very populated. I would suggest going very early on a weekday. 
13,2019-08-20,['hiking'],"Great trail!  It was way too hot when we started, so I would say start about 5:30 pm giving yourself plenty of time to come back down during daylight."
14,2019-08-20,['hiking'],"Nice trail, steep from the start. Or at least I thought it was, but I am a novice hiker. Wasn’t able to finish because there was a swarm in wasp along the path that I didn’t feel comfortable passing. Overall nice waterfall and hike."
15,2019-08-18,['hiking'],What an amazing hike.
16,2019-08-18,['hiking'],"love this trail. I lost my keys though, so if anyone finds a key ring on a purple carabiner, please contact me at 310-867-0808. thanks!"
17,2019-08-15,"['hiking', 'rocky']",
18,2019-08-13,['hiking'],"this trail was a beautiful, short hike. the first part up the hill on the initial trailhead is quite the leg workout, but once you get up there is an easy hike with great views all around. I highly recommend making it a sunset hike if you can :)"
19,2019-08-13,['hiking'],"My first hike with this app! The hike was not nearly as easy as I thought it would be, but I enjoyed it. There was climbing of rocks and even a little bit of getting your feet wet in order to get to the final waterfall. It was nice though. Only complaint is that I wish it was marked better... I was by myself and kept getting “lost” (nothing serious... but I veered off the path a few times). "
20,2019-08-10,"['hiking', 'rocky']",
21,2019-08-10,['hiking'],This is a great little trail! The first .5 miles are dusty switchbacks but after that it’s a shaded hike in the trees next to a cooling stream. The bridge over the stream is at 1.5 and then it’s a good climb to the to waterfall at 1.9 miles. I prefer to do this hike in the evening where you can watch an amazing sunset on your way down. Great hike!
22,2019-08-06,"['hiking', 'no shade']",Love doing this hike with my dog. The beginning is definitely the hardest part because of switch backs worth minimal shade. Once that part is over the rest is fun and basically all shaded. There is one more part that is rocky at the end to reach the waterfall but overall gorgeous trail.
23,2019-08-05,['hiking'],"The waterfall at the end is the BEST. I hiked this trail in 100 degree weather. TAKE WATER. The switchbacks during the first part of the trail are not shaded at all. But... think this is my favorite trail so far. It’s not easy at all, but well worth it."
24,2019-08-05,"['hiking', 'no shade', 'rocky']","The end result... beautiful!!! Switchbacks with no shade in the beginning... and moderate my ass lol this had us climbing rocks, using tree roots and luckily people could show us where the trail was because it is not easily marked.... but the end, BEAUTIFUL!!"
25,2019-08-05,['hiking'],Biked not hiked. Had a blast
26,2019-08-03,"['hiking', 'rocky']","It is a beautiful hike. The waterfall at the end is definitely worth seeing! of note I would not classify this hike as just moderate. The first half of the hike is moderate, but the last half is at least moderate-hard."
27,2019-08-02,"['hiking', 'bugs']","Dogs poop everywhere, bugs... not for beginners."
28,2019-07-29,['hiking'],Love the waterfall
29,2019-07-28,"['hiking', 'bugs', 'no shade', 'rocky']",
30,2019-07-28,"['hiking', 'rocky']",
31,2019-07-28,['hiking'],Pretty hike once you get past the switch backs and into the trees. It feels like the hard side of moderate. There is a lot of scrambling over rocks and the trail is washed out in some spots. This hike would be so much better if people picked up after their dog's! 
32,2019-07-28,['hiking'],Such a great hike..
33,2019-07-27,['hiking'],Definitely one of the best hikes in Utah. Lots of shade after about the first half mile. I did hike with 3 year old daughter and for the most part it wasn't to bad. it rained and made all the rocks super slippery and I had to carry my daughter the last part before the waterfall.  There is like 3 or 4 really steep parts that make it scary if it's wet. 
34,2019-07-24,['hiking'],"Crowded and lots of people with dogs. Climbed the first several switchbacks with my young kids. I hear further up would have been difficult for young kids. Beautiful view, just short on time. "
35,2019-07-24,"['hiking', 'bugs', 'no shade', 'scramble']","I was a bit skeptical at first - went about 3pm (which I'd never do again). Not really for beginners! I loved how the river wound to keep you motivated to see the source! The trail would drift away and just when you think you somehow ended up on the wrong trail a gorgeous spot of water pops into the picture to give you a little boost! It is mostly uphill and not much flat relief - bring lots of water!! Go slow if needed!
Downfall - Really other than the heat which was an error on my part, the only downfall was the amount of wasps near the standing/slower moving water! I am actually shocked I didn't get stung! Otherwise keep going to the end it was well worth it!"
36,2019-07-24,"['hiking', 'rocky', 'scramble']",Went about 7 am on Pioneer Day.  Not too busy when we got there.  Getting busy when we headed back down.  Shaded after you enter the canyon.  Beginning switchbacks and approach are exposed.  I liked the fact that there were some pretty steep parts followed by relatively flat grade sections that seemed to alternate occasionally.  Gave the legs a needed break a couple of times.  Waterfall is awesome. Different than most waterfalls in the area  in that it's kinda wide and doesn't just flow out of a narrow crevice like most around here.  Good change of pace.  There are a few sections where you choose between rock hopping in the creek or scrambling a steep bank.  Maybe I just didn't look around enough for other options?  Personally I prefer it to Waterfall Canyon in Ogden. I will definitely do it again. I think it was about 1 hour 30 minutes round trip with about 10 minutes spent at the waterfall.
37,2019-07-22,"['hiking', 'bugs', 'rocky']",Great trail but not easy for beginners or out of shape people. Switchbacks don't have shade and are Sandy and sometimes washed out. At the trailhead with two arrows go to the right to head toward the falls. Walking sticks would also come in handy as it gets steep. Coming down can sometimes be more difficult than going up but the reward was worth it. 
38,2019-07-22,"['hiking', 'bugs', 'rocky']",If you’re tip top shape hiker junkie this hike is moderate but if you’re an average joe just wanting to see a waterfall the hike is pretty hard. Lots of steep rocky parts that get you out of breathe but very shaded and lovely on a hot day. Waterfall is beautiful and a nice refreshment after the tiring hike. Also there and back is 5 miles so just be aware of that. But 10/10 would recommend. 
39,2019-07-21,"['hiking', 'bugs']","Great hike. Try to go early, the switchbacks don’t have shade. Once in the canyon and under the bushes and trees it’s really nice.  Lots of wasps near the standing water along the trail.  Coming down the switchbacks the sand was too hot for my dogs feet. Ended up having to run down to get him in shade.  "
40,2019-07-20,['hiking'],"My sister and I hiked this trail this past Saturday. We started around 8:00 a.m., and completed it at approximately 10:30 a.m. The weather was absolutely perfect. We did encounter plenty of people and dogs on the trail, but everyone was very friendly. The scenery is utterly amazing from start-to-finish. Thankfully we did not encounter hordes of bugs or dog crap on the trail. Overall, a terrific experience. "
41,2019-07-15,"['hiking', 'bugs', 'no shade']",
42,2019-07-13,['hiking'],"The perfect moderate trail, just get through those first few switch backs and you’ll be in the nature you know and love. I did this in the afternoon, so after making it to the waterfall the mist and breeze were a nice treat Ü"
43,2019-07-13,['hiking'],Decent trail. Lots of traffic though. Lots of families with little kids and dogs. I usually have to add at least 30 minutes to my time because of all the traffic. Early in the morning (6am) or later evening is best. Encounter several snakes about two days ago so keep an eye and ear out for them. Also be careful with all the horse and dog poop. 
44,2019-07-12,"['hiking', 'bugs', 'rocky', 'scramble']",first part is exposed switchbacks.  but then it's covered and follows river
45,2019-07-11,['hiking'],"Great trail, unfortunately there is dog crap all over the first part with the switchbacks and it stinks horribly.  
The upper and lower falls are both great, but people leave trash EVERYWHERE.  My wife and I always take a bag and pick up everyone else's trash because we live close and like to hike here!  Please always pack it out!  If you take children, watch them and pick up after them, this is here to be enjoyed by everyone."
46,2019-07-09,['hiking'],Beautiful hike.  We went on a Monday night and there was very little traffic.  
47,2019-07-08,['hiking'],"The switchbacks are dusty and can be hot in the afternoon. 

Bring water shoes during the runoff. This will  get you across the water at the end. 

Don't try to wear water shoes the whole way unless you can run through a Japanese game show with them. the sporadic bouldering and sidehilling on this hike is no joke at times.

My Daughter (17) did it with a  broken collar bone no splint fell and tweaked her into bawling only once.

Also as stated previous, bring a trash bag and pack out more than you bring. The ""entitled lot"" have been here in force."
48,2019-07-08,['hiking'],"The first portion is sandy trails which are more recently washed out.  I have passed many people going up and back who inquire if it lasts the whole way.  It doesn't.  Once past the steep sandy first portion the trail grows more and more enjoyable with icy water to play in further up, and shade.  Love this trail.  The trail has gotten more and more crowded on weekends, and recently there are vendors setting up and selling snowcones/food at the entrance so more commercial, but it is still really enjoyable.  "
49,2019-07-08,"['hiking', 'over grown', 'rocky', 'scramble', 'washed out']","The waterfall was beautiful. BUT Seriously people, CLEAN up your dog sh*t. It was honestly disgusting this whole hike smelled nasty... Clean it up and take out or put a ban on the dogs in my opinion. "
50,2019-07-06,['hiking'],"Unbelievable in so many ways -

The trail is really cool after the initial sandy switchbacks. 

The falls are unbelievably beautiful.  

So is the amount of dog sh** on the trail and the hikers who can’t pick it up. 

And the people who blast their music on the trail.  Most of us get out and hike to get away from that.  

And the people who have their headphones in and can’t hear you when asking permission to pass.  

And all the garbage at the falls - the apples tucked in the bushes, the gummy bears all over the trail, the crackers and the sandwich bags - WTH????  How hard is it to pick up after yourself?

Mother Nature would be ashamed of y’all. 

Glad I did it but won’t be back.  Good luck to the rest of you who choose to hike here.  If it’s serenity and escape from the daily grind, look elsewhere. 

"
51,2019-07-04,"['hiking', 'rocky']",Nice trail with a little scrambling. Great falls. 
52,2019-07-04,['hiking'],A lot of traffic. Go early or late evening to avoid the traffic.
53,2019-07-03,['hiking'],We loved this trail!! It was beautiful and very fun to hike!
54,2019-07-03,['hiking'],Did this hike Sunday with friends and two 6 year old boys. The boys did great and loved the rock climbing. Some steeper areas and had to walk through the river at the top as the water level is high. Waterfall at the end is totally worth it. Was crowded at the top but to be expected on a nice Sunday afternoon. Took us nearly 3 hours total. 
55,2019-06-30,['hiking'],Awesome for kids. A couple of steep areas
56,2019-06-30,['hiking'],Definitely a favorite.
57,2019-06-30,"['hiking', 'rocky', 'scramble', 'washed out']",
58,2019-06-30,[''],"Shady and gorgeous views, love the stream that runs along the trail"
59,2019-06-29,['hiking'],Pretty stern test.  If you have real small children or are not in pretty good physical condition I would not recommend.  Some dicey spots that require your undivided attention.  I would take a minimum of 32 oz of water.  
60,2019-06-29,['hiking'],Great trail... had some difficult parts but the waterfall at the end made it worth it...
61,2019-06-27,['hiking'],Did a family day trip up with 5 kids (9-15) and made it to the falls.  Nice easy hike with beautiful view at the falls. The bottom has really been groomed up from years back.
62,2019-06-26,"['hiking', 'rocky']",super fun trail
63,2019-06-25,"['hiking', 'muddy', 'no shade', 'scramble', 'washed out']",This was my very first hike in Utah so I was still acclimating to the elevation and getting in shape. The first part of the trail was brutal because it consists of very steep switchbacks and no shade. It gets much better once you reach the shaded forest. I took off one star for the dangerous scrambling over the eroded steep bank towards the end to get to the falls because the water was raging and you can't climb up the river bed (you could probably do so during a dry year). I honestly did not feel safe doing it and my partner had to talk me through a couple scary spots. Be prepared to get your feet wet since you need to do the river crossing to actually see the falls. 
64,2019-06-25,"['hiking', 'scramble', 'washed out']","Beautiful hike, went at 5:30pm, took our time then hiked back out watching the sun set over Salt Lake. Stunning all around. However if you’re planning to get to the top, this should be considered a “hard” hike currently with how washed out it is. In a couple areas you have to go through the water and in a couple cases you have to climb over an eroded steep bank. Once at the top you have to cross a powerful current of at least a foot deep to get to the other side to see the waterfall. This trail made me realize how worn the tread is on my boots and how they are no longer waterproof!"
65,2019-06-24,['hiking'],Adventurous hike!  The trail starts out on soft sandy ground as you do several switchbacks with a continual incline to the top.  The trail is really rocky with some fun gnarly  sections.  Unfortunately the falls can't be seen right now unless you're prepared to cross the river.  If we had  known we would have brought water shoes.  There are still other awesome things to see along the way though!
66,2019-06-24,['hiking'],"This trail was awesome!! It was about 4.25 miles and was washed out in multiple spots, so the terrain was rather rocky! I took my dog along with me, and he loved it! At the mouth of the waterfall, there are strong currents. If you bring small children, or dogs, make sure you’re able to carry them through said currents where you can view the falls (many people were seen doing this, as well as myself), so bring water shoes!!! "
67,2019-06-23,['hiking'],"Great trail! Mostly shady with a large stream for a majority of the hike. Beautiful waterfall at the end. Very crowded though, but worth it. Will definitely go again."
68,2019-06-22,"['hiking', 'rocky', 'scramble', 'washed out']","A gorgeous hike, but not currently safe for toddlers and little kids. the trail is so washed out in places that you have to go through the water or scramble over eroded banks--not something you want to do with a three year old. And it's too popular."
69,2019-06-22,"['hiking', 'scramble', 'washed out']",Very crowded. Lots of kids and dogs. Too much scrambling for young kids. Can’t see the falls without getting wet. 
70,2019-06-19,"['hiking', 'rocky', 'scramble']",Always an enjoyable hike. Above the bridge crossing the hill side has washed out in couple of places and eliminated the trail. Still accessible with scrambling across rocks. 
71,2019-06-18,"['hiking', 'rocky', 'scramble', 'washed out']",The beginning and ending of the trail are the steepest. there are several washed out spots which require travelling the stream. 
72,2019-06-18,['hiking'],"One of my favorite hikes. Unfortunately, it has become extremely popular and weekends and holidays are a joke.  "
73,2019-06-17,['hiking'],"I absolutely love this trail. Been on it a few times. The waterfall at the end is gorgeous! But ..... when we hiked this a few days ago, we did encounter an angry rattlesnake. So that wasnt very fun (actually pretty freaky). But still a great hike."
74,2019-06-17,['hiking'],The hike was good! I wouldn’t say it’s moderate. Especially how the trail is washed out. There is quite a lot of dog poop in the beginning during the steep switchbacks. But other than that. The hike has such beautiful views! You do have to cross the freezing cold water in order to see the waterfall!
75,2019-06-17,"['hiking', 'rocky', 'scramble', 'snow']","Lots of traffic, especially on weekends and holidays.  Some of it is in the sun, so start early. I’m a little surprised this is ‘moderate’. This is pretty steep with some scrambles and rocky climbs; and you cross a wide, rocky stream at the top to view the waterfall. late fall through early spring you should have yaktrax or spikes because it gets icy. The waterfall is pretty nice! Also, as of early June 2019 the stream is running high and fast and there are Point where it is very difficult to avoid walking in the water."
76,2019-06-16,"['hiking', 'scramble']",The trail is washed out some but that made if fun for us! I would recommend bringing water shoes or a change of shoes or walk to the falls themselves barefoot. 
77,2019-06-15,['hiking'],After the switchbacks everything is just beautiful. Great hike for a beginning hiker who wants a challenge.
78,2019-06-15,"['hiking', 'washed out']",
79,2019-06-14,"['hiking', 'muddy', 'off trail', 'rocky', 'scramble', 'snow']","May 27, 2019.  Snow still on trail the last 1/4 of the trail to the waterfall but worth it. "
80,2019-06-14,['hiking'],"fun, good workout. didnt make it all the way to the waterfall. little ones got tired. dog owners, please clean after your dogs. there is a lot of dog poop along the trail. we saw a baby rattlesnake. "
81,2019-06-14,[''],"only bad part is crossing the freezing river at the end but the view was worth it
"
82,2019-06-12,['hiking'],"Overall a good trail, but it is heavily trafficked. Went on a weekday night and the trail was especially crowded on the way down. There are some sketchy areas with slick rock and also near the top where, if you're not in the water, you're holding onto the side of the mountain. Bring water shoes if you don't want to soak your shoes to see the actual falls. "
83,2019-06-11,[''],"Great trail, just like everyone has said it's very popular so some parts of the trail can get backed up and a bottleneck happens. We hiked this trail last year in May and it was definitely washed out in places this year. (typically where the bottlenecks where happening.) I'd say it's pretty safe for kids but definitely due to the washed out areas might not be appropriate for younger kids. There is a lot more water running down and over the trail than last year. The falls though is about the same from last year. Overall I'd say that this is a moderate to hard trail depending on fitness level. It's pretty shaded too once you get back into the canyon and passed the switch backs. "
84,2019-06-08,"['hiking', 'scramble', 'washed out']","beautiful trail, some parts are washed out this year. very heavily trafficked, with people causing bottlenecks where the trail is washed out. our 6 year old did okay, it was too much for the 3 year old. I did love the part through the woods next to the creek."
85,2019-06-06,['hiking'],I think it’s actually closer to 5 miles round trip.  The water was too fast to get to the final waterfall.  Still a fun and hard trail!
86,2019-06-06,"['hiking', 'off trail', 'rocky', 'scramble']",
87,2019-06-06,[''],"Fun trail! 
"
88,2019-06-05,['hiking'],"I’ve hiked this several times but today there was no way to hike it without getting wet. The trail is washed out in several places with the creek running right over where the regular trail is. This makes for more rock scrambling than usually. And to see the waterfall at the top, I waded through icy cold water up to my knees. (Usually you can just walk across rocks without getting wet.)  Just be prepared if you hike it in a high water spring. I wished I had brought poles to steady myself on the wet rocks too. On a side note, I love this hike in the winter when the waterfall is frozen. Just be sure to wear spikes. "
89,2019-06-04,['hiking'],This trail is a favorite of mine only for the fact that it is close. The switch backs are rough but once you get through that part it is absolutely beautiful. 
90,2019-06-04,"['hiking', 'rocky', 'washed out']","beautiful trail the entire way. i just hiked to the falls today and there were quite a few spots where the trail was washed out. the falls itself right now is crazy, not like pictured here. there's a lot of water flowing right now. the bridge was partially under water on the way back but still passable. "
91,2019-06-03,[''],"Fun hike. Beautiful trail!  Very crowded though!  Due to some creek crossings - one was pretty deep in swift water, as well at the sloping and slick terrain, it's probably not the best hike for small children. "
92,2019-06-03,[''],"Beautiful hike. Because I'm a novice it took me two hours to get to the big waterfall and 1.5 hrs back down but well worth it. You will get wet since you have to go in the river a couple of times and at the top you have to completely cross the river to get to see the waterfall. Temperature just right with lots of shade. There are a lot of rocky hills, slippery in some spots.  At the Y in the path before you get to trees keep to the left to continue to the big waterfall. 
"
93,2019-06-02,['hiking'],We only went to the lower falls. We had it all to ourselves for 20 minutes. Kids loved walking through the cold water. It’s and easy 1 mile each way to the lower fall
94,2019-06-02,['rocky'],"was way fun, took us about 2 1/2 hours, prepare to get wet feet"
95,2019-06-01,['hiking'],As beautiful as ever! With it being such a wet spring the river is really high right now making the current pretty strong and you do have to cross it at the very end of the hike to see the waterfall so that’s something to remember before you start out. I wouldn’t have younger children cross this time of year. Such a fun hike!
96,2019-06-01,['hiking'],"I really enjoyed this hike, there are a lot of flat spots between the incline so it’s definitely not steep all the way up. Make sure to check out the lower Falls too. "
97,2019-05-31,['hiking'],"Water is high in spring, but still manageable if you don't mind getting wet.  "
