,Date,Tags,Comments
718,2015-07-29,['hiking'],"Most part of this hike in unshaded. Sunscreen sunscreen sunscreen please. 

Parking lot is small. Could probably just accommodate 10-12 cars (not sure. maybe more). There are signs that says no parking on the side of the dirt road but people still park there anyway.  But you don't just copy whatever knowing its not right, be patient to wait for somebody leaving to get a spot at the designated parking. it's a short hike so people come and go.

This is very good for a family hike so you can bring our little ones along -- that is if you do not have any plans on going to the top to witness the beautiful donut falls. the first part of the hike is very easy. you will see a lot of little kids hiking and enjoying it. its not steep nor rock. you'll have to cross the stream to get to a good resting place at the bottom of the falls. so again, prepared to get your feet wet. My friends and I make sure that we have our flip flops in our hiking bags so we can soak our tired feet on the ice cold water. 

When you get to the bottom of the falls you'd be wondering where the donut falls is like what you see on pictures! Well, this is where the hard part of the hike comes. you will have to hike through the rocks to get to the top of the falls then you will see the majestic donut falls. this is not just a rocky hike okay...rocks could be sharp and slippery since water from the top is streaming down. if you do not want your shoes/feet to get wet, you can opt to go up through the rocks on the side of the falls but i figured its more difficult if you are not an experienced hiker. after a few slips and bumps, i got to the very top and i was in awe. it was all worth the slips and bumps. 

Most people would not take the risk of going at the top. but you have to. what's the sense of going to donut falls if you won't see the donut right?  But again, going to the top is not a hike for little kids. it could be dangerous.

Travel. Hike. Enjoy."
719,2015-07-27,['hiking'],"There is a fork in the trail early on that isn't marked, so we ended up taking the wrong way and hiked double what we should have, which was kind of unpleasant. Also, this is a popular hike so there are often lines to get through the trail and to the falls. But the waterfall is really beautiful."
720,2015-07-25,[''],"Easy hike. We hiked it with a 3 month old in a front carrier. It's worth getting wet to make it into the cave to see the falls. 
Parking on the weekends is a challenge. It'll be tempting to park on the road where it says ""no parking"" but don't do it. I saw many cars get ticketed."
721,2015-07-21,[''],Fast and easy.  Good trail for young ones
722,2015-07-21,[''],"So fun!! Took my four little kids, and it was the perfect length and level for us all to enjoy!"
723,2015-07-19,['hiking'],"Not challenging, but the falls are awesome!"
724,2015-07-18,['hiking'],Go during a weekday morning or else it's packed. Super short hike
725,2015-07-18,['hiking'],"First time there last week and tried climbing above the water fall and the wall came apart. Fell 8ft into the river and nearly went into the donut hole. 
Tore my hand open so I ruined our family trip there by 
leaving early to get 16 stitches. Plan to return tomorrow tho. 
Ruined my phone in the river so I lost my pics while at the fall. 
Needless to say, don't try to climb above that water fall lol. 

Regardless it was awesome and loved it there. Pics of my cool injury uploaded :)"
726,2015-07-16,[''],We have done this hike twice and love it. Easy enough to take the kids along with us!
727,2015-07-16,[''],"Short hike, beautiful. Nice trails, but not well marked and very crowded."
728,2015-07-15,[''],
729,2015-07-14,[''],"Nice trail path until you get to the stream that leads to the falls. Unless youre ok with getting wet feet, you'll be hugging the wall for a bit.  Tough climb to get up to the actual Donut Falls site if your inexperienced. Worth it though. Cool looking falls."
730,2015-07-13,[''],Donut Falls is worth the scramble up the boulder field to stand in the cave as the water pours in around you. To share the moment with my seven year old daughter was one I won't soon forget!  Her effort and courage were commendable!
731,2015-07-13,[''],Good
732,2015-07-13,[''],"Super easy, super crowded, it's a good quick hike"
733,2015-07-12,[''],Very easy. Excellent for kids. A lot of people tho..
734,2015-07-12,['hiking'],"Very easy hike.  The kids took every single side trail they could come up with, just to break a sweat.  A bit crowded on weekends, but at least more and more people are outdoors!  If you are going all the way up, there is a very good chance your feet will get wet."
735,2015-07-12,[''],Nice little hike with lots of people on the trail.
736,2015-07-09,[''],"Gorgeous, family fun for all ages and levels."
737,2015-07-09,['hiking'],One of my favorite hikes in the Salt Lake area. Super easy and not too long. And the waterfall at the end is rad!
738,2015-07-07,[''],Pretty easy trail for the most part. If you go right at the fork it will take to some upper trails (not always marked) but if you stick close to the sound of the creek you'll soon find yourself up above the falls looking down.
739,2015-07-03,[''],"Very fun! Great hike for all ages!!!
The fall was beautiful. Short technical hike to get to the donut but worth every step!"
740,2015-07-01,[''],"Great! Went with my 5 kids ages 8-9 months and I only carried the 9 month old. Not too busy when we got there at 9:40am, but REALLY busy when we left at 11:45 (we went much slower than normal people because of the three year old and all of the breaks for watching prairie dogs). Great family hike!"
741,2015-06-30,['hiking'],"Fun, but pretty crowded. It is a totally family-friendly hike. One little part of climbing down to rock before you get to the falls it's just challenging enough for little kids to have fun. Those who are saying it's not family-friendly when you climb the falls, well you're not supposed to climb the falls. It's a dangerous thing to do as climbing waterfalls always is a dangerous thing to do. There are signs warning against it. So enjoy the view of the falls and the fun wading at the bottom."
742,2015-06-28,[''],"They really need to put up signs directing you to the falls. The trail splits off two different ways, twice. It's kid friendly only to the bottom of the falls. It was way over crowded, and going any further seemed too risky."
743,2015-06-28,[''],Good kid friendly hike. Plenty to see.
744,2015-06-28,[''],"Very nice, easy hike (until the waterfall). Great climb if you're up for it. Nice picture spots. We would do it again."
745,2015-06-26,[''],Great
746,2015-06-23,['hiking'],"We did this trail last Saturday. It was absolutely beautiful and I loved it, although really crowded. It was a very easy hike until we got to the falls part. I wouldn't call this part of the hike family friendly. Maybe it was the time of year, but there was still lots of water coming down, and the hike up the waterfall is steep and rocky. You have to wade through water to get there. I saw at least 3 children crying over scuffed up knees, and that evening on the news we saw that someone had fallen and gotten stuck on the rocks, and had to wait there overnight to be life flighted out the next morning. Last year a woman died by falling 100 feet down the falls. So pretty, yes; family friendly, maybe not."
747,2015-06-22,['hiking'],"Like others have said, short and easy 30-40 minute round trip! Towards the beginning, there is a split on the trail. The trail going left leads to donut falls and the trail to the right is more uphill and takes about an hour n a half to get up there to some pretty cool mines and stuff"
748,2015-06-20,[''],"This was a fun, easy hike. I was sad when it was over so we hiked a few more miles beyond the falls. Beautiful!"
749,2015-06-19,[''],Fun simple trail. If you want to climb the falls you have to wait until later in the year. At this point the water is running pretty hard and seems pretty dangerous. Still pretty to look at and only about 35 minutes round trip.
750,2015-06-19,[''],"The donut part is broken. It collapsed a few years ago.
Other then that it was a great hike for kids and families. I have a 5 & 4 year old who did really well. 
We went on Saturday at about 11:30 ish. It was busy but not like standing in line. We were always moving and had lots of fun. 
We also parked down off the main road. It was a little bit of a walk to get to the trailhead. 
The top go the hike you are very likely to get your feet wet."
751,2015-06-18,[''],Pretty trail but over crowded with people. Good for beginners
752,2015-06-17,[''],It is busy but fun trail. If you are just getting use to altitude start with an easy trail like this one. The falls are wonderful.
753,2015-06-16,[''],"It's a really easy, fun trail in a beautiful setting. Great for kids, dates, or a quick morning run."
754,2015-06-16,['hiking'],Amazing!! I want to go back
755,2015-06-15,[''],Great hike.
756,2015-06-14,[''],Freezing water but the whole family made it.
757,2015-06-14,[''],Good first hike for kids.
758,2015-06-14,['bird watching'],"This hike was a nice afternoon hike. Easy and beautiful views. Very family friendly. Seemed like a busy and popular spot so we were happy that we parked on the highway instead of driving to the trailhead, where parking was limited."
759,2015-06-14,[''],Nice and easy good for beginners
760,2015-06-13,[''],quick easy and short. great for the little ones.
761,2015-06-12,['hiking'],"Hiked to Donut Falls Wednesday evening just after a rain storm.  The pine and aspen forests were wet and fresh and green.  Water over the falls was running heavy and made for a spectacular sight.  I think the trail descibed here starts from the main Millcreek Canyon road.  However, you can now drive to the trailhead parking lot, which makes the hike to the falls a 1.8 mile round trip.  The hike is very, very popular and the evening that I did it, parking was scarse and there were too many folks on the trail for my liking.  Otherwise it is a pleasant outing for all abilities."
762,2015-06-10,[''],"Loved this hike even though I didn't climb down the rocks just before the falls, i was wearing my son in a new frame backpack. Once I'm more comfortable with it, we'll try again!"
763,2015-06-09,['hiking'],"I would consider this a walk, not really a hike, unless you scramble up the falls.  The falls were nice and the upper parts were not very crowded, since people were afraid of getting their feet wet.  The water was definitely cold, but was a small price to pay for a better view.  The parking is very limited and they were handing out tickets like candy.  There are other falls that are almost as impressive without the huge crowds."
764,2015-06-09,['hiking'],"Even on a Monday evening, it was like Grand Central Station.  Totally packed at the trailhead and it seemed like every car had at least 4 people in it.  Large groups and some of them not all that courteous in terms of trail etiquette.

You can't get to the Donut yet, without getting your feet wet.  Maybe in a few weeks, but I'd skip this trail for now, unless you plan on getting there early in the morning or don't mind crowds."
765,2015-06-08,['hiking'],A short but really fun hike!
766,2015-06-08,['hiking'],Beautiful and easy hike. Good for little children.
767,2015-06-05,['hiking'],"Easy, short hike. I did it while 7 months pregnant, and had no problem. Wear shoes that can get wet, as crossing the water and climbing the waterfall is worth it."
768,2015-06-04,['hiking'],ME & my 8 month Pregnant wife went up and loved it super easy
769,2015-06-02,['hiking'],"An easy, short hike with a fun reward at the end.  Hikers can explore the river and climb up near the waterfall if you've got the right shoes on!  Would recommend for anyone!"
770,2015-06-02,['hiking'],"Made the mistake of Going on a
Saturday. It was like a super hwy!  Nice and easy Til the last but which requires crossing water cross covered rocks."
771,2015-05-30,[''],"Decent hike. A little busy. Rude hikers. Cool view of the ""donut"""
772,2015-05-27,['hiking'],LOVE this hike. Gorgeous hike & totally worth it. Gourgeous cave too! Definitely one of my favorites.
773,2015-05-25,['hiking'],"Quick easy trail, it can get pretty muddy and slippery when it's rained recently. I recommend wearing shoes or sandals that can get wet if you want to climb the up to the waterfall."
774,2015-05-25,[''],Fun hike. Bring some water resistant shoes to cross the streams.
775,2015-05-23,[''],"Fun & easy, it's a great hike if you're just looking for a short hike for the day."
776,2015-05-23,['hiking'],"Great hike, can get busy but still worth it, also a fun hike in the winter the trail gets packed down enough to the point you don't need snowshoes. And don't forget to actual check out the waterfall in the cave I missed it the first time because I didn't hike up the rocks."
777,2015-05-12,['hiking'],"Went up in March. There was tons of snow, but it was packed tight and our group with running shoes did just find with minimal slippage. It was a bit hazardous but a complete blast! The falls has way less water than when we went again in May. You have to walk a bit on a residential road through some cabins till you get to the actual trail but its not a problem. (Not sure when they actually open that gate).
This trail is very busy. Even at 10:00am on a random Tuesday we saw 20+ people. While everyone is generally courteous I prefer other trails where I can hear less talking from random highschoolers sluffing school."
778,2015-05-06,['hiking'],Lots of tight packed snow on the ground in March. Pleasant trail.
779,2015-05-04,['hiking'],"First time to hike this area.  It was my Birthday and I had heard a lot about it.  A very bust trail compared to what am use to, but a great one all the same."
780,2015-05-02,[''],Very fun short little hike. A decent rock scramble mixed w snow around the rocks this time  of year (early May)
781,2015-04-25,['hiking'],"Short, simple hike. Great for kids. The hike has a pretty view of Mt. Kessler, ends at the bottom of the rather small Donut Falls."
782,2015-04-19,['hiking'],"Ok. NO ONE told us that to see the actual ""Donut Falls"" of this hike, you have to scramble up a steep stream. Gah! Most of the families just had to sit at the bottom and enjoy the pretty view from there (you can't see the donut fall from there though). This is why we started a hiking site for families called Wanderookie. We test the trails ourselves then write posts with pics, trail details (parking, difficulty, crowds etc.) that will minimize surprises for families or rookie adventurers. The falls on this hike are truly unique and beautiful, but be prepared to scramble up the stream! We will be doing this hike with our alltrails hiking group (also on Facebook under Utah Hiking Group - Wanderookie) this summer! Find us and join! It will be a blast!"
783,2014-12-27,['hiking'],A short easy hike. Usually crowded. Much prefer the trail on the right that takes you further up the canyon.
784,2014-12-07,['hiking'],Nice easy hike and a beautiful waterfall at the end.  Too short and too easy to do again but enjoyed the scenery.
785,2014-10-06,['hiking'],"Beautiful trail to hike in October. The trail was not too busy as I started around 6:30pm, but there were a few people I crossed at different points. I went up and over where the falls are and was able to enjoy the sounds of the creek and falls alone. There is one split in the trail that is not well marked. Keep to the left to reach the falls."
786,2014-10-05,['hiking'],"This is a great simple Family hike. Although, as has been mentioned by many others it is extremely busy, we have completed a couple times (all on the weekend) and has always been very busy. We've found if you go up the backside coming out of the parking lot, it is prettier going along side the river and that section much less traveled."
787,2014-09-16,['hiking'],"This is a fun hike, but very crowded, especially on the weekends.  It kind of feels like you're in Disneyland instead of enjoying the quiet of nature."
788,2014-09-12,[''],Nice short easy hike for Adult but not for children.
789,2014-09-07,['hiking'],Not my favorite hike but it is an easy hike for adults. I wouldn't recommend taking any kids along esp right after winter because of the water run and how dangerous it can get with the rocks. Enjoyed climbing all the way up to the donut hole. It is a little crowded if you go during the noon hours but usually very quiet and serene when your the first ones there in the AM! I'd go again just for the fun of it.
790,2014-09-07,['hiking'],"definitely not recommended for children but as sisters going up to the top of the falls, was so beautiful! went inside and actually stood under the waterfall coming thru the hole, (donut falls) pretty freakin awesome! hiked this trail about 15 times this summer. EASY and WORTH IT!"
791,2014-09-01,[''],"Just went there on August 31st and with it being Labor Day, the trail up to donut falls was super busy. It was pretty though. At some point in the hike, there's different paths you can take, but they don't lead up to the falls. In my opinion though, taking the path(s) less traveled by(literally) was the best part. Definitely a lot longer of a hike as well as a steeper incline. There's pretty meadows along the way and if you walk further(if you take the right paths that is) you'll eventually end up in this really nice area to picnic as well as take pictures. Explore the different paths if you're looking for serenity and/or a longer, little bit more challenging hike because these other paths don't have a ton of people. Keep in mind though, again, these alternative paths won't lead up to the falls. At least, not that I know of."
792,2014-08-30,['hiking'],Excellent for taking small kids on a small adventure.  If you park up the road about a mile then the hike is less than 2 miles round-trip (this road is closed in the winter).  Parking at the upper trail head is very limited so some choose to park at the lower trail head.
793,2014-08-17,[''],Don't take your dog!  Got a nice ticket after the rangers chased us up.
794,2014-08-16,[''],"Extremely easy hike, but the falls are beautiful! Fun to do if you aren't looking for a serious workout."
795,2014-08-10,['hiking'],"We loved this hike(25 and 32 yr old women in shape with an awesome 9 yr old boy) There were tons of chipmunks on the trail and a moose was spotted off the trail not but 25 yards!! There were more people than I was hoping for on the trail but it's very popular and it was the weekend so I can't fault it for that... Just try to go on a weekday if possible. Hike was a breeze! Even if your not in shape, take your time and enjoy the scenery!"
796,2014-08-07,[''],"NO DOGS ALLOWED! We did not enjoy this hike. We drove all the way from Provo to do this hike not realizing that dogs are not allowed on this trail or anywhere in Big Cottonwood Canyon. The view of the falls was disappointing, hidden by an outcropping of rock that you had to climb to see around. Not possible with little kids. The walk was nice but also too crowded."
797,2014-08-03,['hiking'],"Short, fun hike to a pretty cool waterfall. The trail is pretty easy, but the last little bit is a challenge. In order to get to the doughnut portion of the falls you have to climb up some rocks. It is a little tricky and can get quite slick depending on the amount of water coming through the falls, but it was worth the climb. I wouldn't recommend that young kids try and make the climb."
798,2014-07-30,[''],"Fun trail.  I have done this many times, in winter and in summer.  Trail is fairly easy to follow, however, please use extreme caution when scrambling up the last bit to the cave itself.  This can be difficult for adults and ill advised for young children.  People get hurt here every year, some have been killed.  Use good judgement and have fun!

Pros:  Accessible, fun for kids (8 and up is OK, 7 and below, use caution) Interesting feature, north facing (not as hot) 
Cons: Incredibly popular, can be dangerous."
799,2014-07-28,['hiking'],"Great hike for the kids - relatively easy, not too long. Gets slippery at the falls but with care the kiddos made it across."
800,2014-07-26,[''],Love this hike. Generally see a moose. Not today but we will be back!
801,2014-07-26,[''],Completed Yesterday the 25th of July. Did not see a moose but the trail is beautiful. I hiked this trail a while back and saw a large bull. A great short easy trail.
802,2014-07-17,[''],"Super easy, short hike with a pretty waterfall at the end!"
803,2014-07-04,[''],"Fun and easy hike. Super kid friendly, wide and well marked trail, plenty of other hikers, and easy to finish in a couple hours. My son and I make it our inaugural hike every spring."
804,2014-06-28,['hiking'],"Love this easy hike. The falls are beautiful. Only downside is it can be a bit crowded. Have to get your feet wet to get near the falls. Can be slippery, be careful."
805,2014-06-23,['hiking'],"Enjoyable first hike of the season for me.  I have never been before, but have had it on my to do list for a while.  Finally went on 6/22 and found it a nice easy hike with very wide trails.  Very heavy traffic, and the miles zipped by quickly.  We did have to park down by the main road as parking can be limited at the trail head at times.  It adds a bit more to the hike but not bad.  I saw lots of toddlers and small children.  Seemed like a good family destination.  A word of caution when you are crossing the river near the top.  footing can be slipper in the water so watch the little ones, I was a little surprised to see babies and toddlers up past the river.  I managed to get across the river dry, my hiking partner not so well.  Fun, but expect to get wet especially if you go to the very top. Enjoy!"
806,2014-06-17,['hiking'],Super easy hike for any and all ages and activity levels. It's beautiful but there are always lots of people and the trail is not pet friendly.
807,2014-06-12,['hiking'],"Nice little hike.  Nothing terribly difficult.  The thing is, people feel compelled to climb the falls, which are very slippery.  Someone just died in a fall there a week ago.  It might seem harmless but beware.   Good for kids and adults alike, hardly any elevation gain.

There is a way to Cardiff Mines from this trail.  It's a few miles longer but well worth it.   Refer to your maps."
808,2014-06-12,[''],"Went yesterday. It wasn't packed but there was road construction driving up big cottonwood, so it took us about 40 extra minutes either direction. Also, my pedometer said it was about 1.7mi round trip. Easy and gorgeous, but not as long as I expected!"
809,2014-06-08,['hiking'],"Granted we did it on Memorial Day weekend, it was way too crowded for my taste-from the parking lot all the way to the falls, which we had to view from above because of the log-jam of people trying to get to the bottom of the falls. 

Also, the trail to the falls is not marked very well.  We ended up overshooting the falls and having to back-track to get back onto the trail.  While it was fun for my 6-year old daughter, having allTrails rate this as the best hike in Utah is not even close to accurate."
810,2014-06-04,['hiking'],Nice hike and beautiful scenery.  The water is a little too high right now.  I will go again in a couple weeks to hike up to the top.
811,2014-05-30,[''],My first hiking place nice went you get to the end and see water fall could not go up were the cave was but is okay I like the water fall
812,2014-05-27,[''],"Awesome waterfall, always packed with people and their kids."
813,2014-05-20,[''],I couldn't find it?
814,2014-05-04,['hiking'],There is still lots of snow in the first week of May though most of it was packed well enough to hike on. I went on a Friday around noon and the trail was fairly crowded.
815,2014-05-02,[''],"Just went today. I would describe it as more than a little bit of snow, but still a good hike. Definitely want to go back after the snow melts. Better in the summer."
816,2014-04-17,['hiking'],Still had a little snow on the ground but not to bad for hiking was fun little trail...
817,2014-04-17,['hiking'],My family and I have hiked here twice. It's a very pretty trail but it was crowded both times. People are usually polite on the trail but maybe hike it during the week if you want to take pics w/out strangers in them.
818,2014-03-30,['hiking'],"Hiked this trail today, still had snow on the ground, but it was not too slippery. Wonderful hike."
819,2013-12-02,['hiking'],"Fun hike. It's an easy hike, although me & my friend took a detour from the orginal trial (that's the adventurers in us I guess.) Lots of people travel this trail so if your looking to get away into the wood for peace and quite this wouldn't be the place. Fun overall the the trial has a waterfall &  cave both cool features to this easy hike."
820,2013-10-17,['hiking'],"Lots of fun, went with a church group to hike this trail. I would recommend it although it was a very crowded trail."
821,2013-10-06,['hiking'],Easy hike with little kids (all under 5).  Very crowded and not relaxing with all of the people on the trail- hence the 4/5.
822,2013-09-05,['hiking'],Did this again but climbed up rocks to Donut waterfall cave this time. Was really cool & worth the effort!!
823,2013-08-31,['hiking'],Super easy my kids all loved it. Ages 8-15 VERY pretty and peaceful we were on the trail by 8:00 In The morning so we had it pretty much to our selves. Coming back it was a different story tons of people ! Will do this one again for sure ! 
