,Date,Tags,Comments
466,2017-05-30,[''],"Great hike for families with kids slightly on the older side. 6 and up maybe, unless of course you plan on carrying your little ones. Water shoes highly recommend because the last 50 yards is literally in the creek. You'll also want to boulder up the cascades and enter the actual donut shaped cave where the water fall has carved a hole in the rock. Really cool. Obviously use caution during high water season."
467,2017-05-30,[''],Awesome trail for the family
468,2017-05-29,['hiking'],"Easy 30 minute walk to the river, then some snow and mud.   Need to walk through the ice cold water to get to see the falls up close."
469,2017-05-28,['hiking'],crowded trail with some snow at the top (May)
470,2017-05-28,['hiking'],"Although there were lots of people and the trail was slippery muddy from some of the snowpack melt off, this trail was super fun! We were able to take my 7 year old brother along with us."
471,2017-05-27,[''],Get to the trailhead by 8 and you can beat the crowds! A little muddy but the falls are pretty with some snow still on the them.
472,2017-05-24,['hiking'],"Absolutely wonderful!! Easy hike, some mud and slush but nothing too bad. Once you reach the water, it's a slippery climb to the top. Be prepared to get your feet wet! So worth it!"
473,2017-05-20,['hiking'],"Super fun and exciting hike if you plan on hiking up the waterfall. It was well worth it as long as you be careful hike climbing up. Bring an extra set of clothes if you don't want to freeze. Make sure you are looking  at the map though, I accidentally hiked the wrong route and hiked an extra 2 miles up from the waterfall."
474,2017-05-19,['hiking'],"From the recent snow melt, the river and falls were flowing rapidly (according to locals). Still some snow patches along trail, but not impassable.  Sat at the base of Falls and soaked in the sounds and sights.  Be careful if attempting to climb up to Falls, snow is getting undermined from water.  You'll get wet, but enjoy the experience!! Also, as of 5-15-2017 the paved road up to trailhead was still closed."
475,2017-05-18,['hiking'],Avoid going on a Saturday on a beautiful summer day. There was soooo many people that we had to stop and wait 5 minutes at a time here and there because there was a bottle neck of people. Yeesh.
476,2017-05-14,['hiking'],may 12. road closed .can't get to it due to snow
477,2017-05-14,['hiking'],"There was still a decent amount of snow on the trail today, but definitely worth it. Got some gorgeous pics with the snow in the background."
478,2017-05-14,[''],Didn't quite make it to the falls because there was still quite a bit of snow but always a beautiful hike!
479,2017-05-13,[''],"Super easy hike with a good payoff at the end. I went 5/12/17 and there was a decent amount of snow, but it was paved down. The flow of water right near the falls was fairly high, so don't expect to make it without walking in the steam a portion of the way. Also, within the falls the water was hitting around knee height. A easy, must-do hike here in the valley"
480,2017-05-10,['hiking'],lots of snow but over all was a great hike :)
481,2017-05-08,[''],"This is a very easy trail, and nice if you're looking for a short one! The donut is beautiful, and has a little bit of climbing you can do once you get to the end. They're very serious about having no dogs on this trail, basically in the entire canyon. So be cautious!"
482,2017-05-07,[''],"This was a fun hike,  lots of snow and so fun using the rope to make it to the falls."
483,2017-05-05,[''],"nice little hike for exercise, hiked it in May and there was snow from the second parking lot to the falls. looking forward to going back in summer"
484,2017-05-03,['hiking'],"Trail was still completely snow packed, but path was easy to see and follow, just be prepared to slip and slide a bit and get wet because of it. Made the trail harder than I expected, but boy that payoff was amazing! Be sure to head up and into the cave of the falls, otherwise you miss that payoff"
485,2017-05-03,['hiking'],"Still lots of snow, poles are a great idea, hike over the top of the falls back to service road slippery and treacherous, through snow up to the knees! Not recommended until snow is gone! Gorgeous hike, moderate difficulty in the snow."
486,2017-04-28,['hiking'],"This trail is gorgeous and super easy! You can't bring dogs anywhere up big cottonwood though so be forewarned before you make the mistake of trying!

It's nice for summer because it is pretty cool with the water and most of the shade. A nice hike you could do anytime of the day."
487,2017-04-22,[''],Tip: keep left.
488,2017-04-21,[''],"Short and easy hike but very pretty! Some fresh snow today so bring your hiking boots or snowshoes. You have to cross a small stream but nothing major. You do have the option to hike to the top at the end although advised against my crew
Couldn't resist. It was worth the view and you can climb inside a cave surrounding the waterfall."
489,2017-04-21,[''],even with a few feet of snow this trail was enjoyable
490,2017-04-18,[''],"before you go... don't follow the gps. based on the footprints most people do and we ended up passing it by a couple miles. fun hike still But when you see the bathrooms half way up, stay left.  it's a flatter more direct path to the falls.  super slick right now as the snow is melting wish I would have worn picks. beautiful hike though!"
491,2017-04-17,[''],"Followed the trail according to the apps GPS and never found the Falls. Two other groups of hikers ran into the same issue. Snow made it difficult to follow trail signs exactly, but ended up being fun regardless."
492,2017-04-15,['hiking'],"Went a little too early in the season, lots of snow and wasn't able to make it to the actual falls due to the snow but it was a fun and adventurous hike none the less. People were climbing the canyon wall to the falls and using the snow packed canyon wall to slide the entire way back down. We decided to head back in the summer when it wasn't so snow packed!"
493,2017-04-15,['hiking'],"A destination hike, so you should surely get in and behind the cave of the falls. Snow is melting everywhere and it can be slippery at places. Wear good boots to enjoy this trail before April."
494,2017-04-09,[''],"I took off before the crowds and at a great time to see moose in the area of the houses on the right as you start up. The last part up to and in my case into the cave where the falls enter is a rock or boulder scramble and it's easy to allow the excitement to propel you up the rocks at a faster pace than is safe so take your time and enjoy picking your route up. Once at the entrance you'll see it's a must to get inside and enjoy the falls up close. I brought along sandals for the water section and anyone wanting to fully enjoy it should also wear a pair of pants with either zip off Legs or plan on rollin the legs up, you won't want to miss going inside."
495,2017-04-02,[''],"Great trail to go on anytime of the day. My brother and I went mid afternoon and even with the snow on the ground, it wasn't difficult to get to the top of the falls."
496,2017-03-26,['hiking'],"Very icy and slippery this time of year and chilly in the canyon, prepare for a snowy hike!"
497,2017-03-26,[''],love it during winter.
498,2017-03-24,['snowshoeing'],Perfect winter night hike. 
499,2017-03-19,[''],Still really snowy up there! Very slippery!
500,2017-03-19,[''],Me and my 12 year old daughter had fun on this hike yesterday. With the snow it made it the perfect workout- not too easy and not too hard. We hiked to the very top of the falls and used the rope they had there to slide down with our jackets!
501,2017-03-08,['hiking'],Beautiful snowy morning. Nice view all along
502,2017-03-06,['hiking'],Great for winter hiking. A bit intense near the top but it's worth it! Overall it's a pretty easy trail with some great views.
503,2017-03-05,[''],"We used snowshoes and it was more intense than an ""easy"" rating!! If there is snow, prepare to walk on a slick trail and a very difficult ascent to the Donut cave!"
504,2017-02-18,[''],Great winter hike but in the summer its over crowded with little kids running around screaming everywhere.
505,2017-02-01,['hiking'],Donut Falls Trail was packed but well worth the crowd!  I happened to go up on a Sunday that also happened to be father's day. I was lucky to have found parking.  The trail was an easy one shared with a lot of families and you have the option once you reach the falls to stay at its base and enjoy the view or you can climb the rocks all the way up to the donut and even past the ledge where you will find a beautiful stream running over more rock and fallen trees.
506,2017-01-30,['snowshoeing'],"Loved this hike. We used snowshoes, but most hikers were just in boots or had crampons. The falls are awesome in the winter. There is so much snow up there right now...had a great time tromping off in the deep snow."
507,2017-01-29,['hiking'],"I hiked this today in regular snow boots! The trail is so packed down now that I was okay not wearing snowshoes! Of course, the majority of people do use snowshoes though. It was beautiful and fairly well-marked for being so snowy. You do have to walk about a mile up the road from the parking lot to get to the actual trial because the gate to drive up is closed for winter. It was a great hike- not too hard, not too easy (because of the added difficulty added by snow). I will definitely come back to this hike during the spring."
508,2017-01-28,['hiking'],Great Hike!  Trail is so packed you don't even really need snowshoes.
509,2017-01-07,[''],"Really nice hike. The last bit climbing up next to the waterfall to the ""donut"" is a bit dangerous, but it's beautiful, once you get there."
510,2017-01-04,['hiking'],Beautiful. One of my favorite hikes. Very easy. I like to go up in the summer because you can drive to the bottom of the trail vs. before or after when you have to walk there. Very fun. I enjoyed climbing to the falls.
511,2016-11-14,[''],"Water level near the falls is pretty low, which makes crossing the creek and, for the ambitious thrill seekers, climbing to the top waterfall much easier. The trail is pretty muddy past the official trailhead, so be careful of slipping.

Upper trail head parking is closed for the season, so you'll be adding an extra bit of time and distance to your hike. Keep left at the forks, and be weary of slippery rocks."
512,2016-11-13,[''],"Is the trail closed? November 13 today, but I see people tracked their hike this month. App says it's closed October"
513,2016-10-27,[''],Great hike for my family including 3 year old. The app does not take you to the trailhead. It says to park on the left. You actually have to drive up a road to the right a bit to get to the parking lot/bathroom. We hiked about 1000 feet up the trail to the left. It actually goes to a lake but we turned around and drove across the street.
514,2016-10-26,[''],Easy trail and GREAT for kids. Bring extra socks 
515,2016-10-23,[''],"This trail is super easy until you get to the falls at the end. You have to climb up a rock wall to get to the cave at the top where the ""donut"" is. It's very slippery and cold, but if you manage to get all the way to the top it is really awesome. I wouldn't recommend this for small children. It would be to dangerous for them to climb the rocks."
516,2016-10-22,[''],Turn right onto Cardiff fork road to get to the trail head!
517,2016-10-09,['hiking'],Took a two year old and four year old on this hike. Was a little long for the two year old. Very muddy and slick from snow patches. Beautiful colors though. Read a review that said the trail was on the opposite side of where the app takes you but that wasn't the case. We just got to cross the street twice. Trail head was on the south side by a large parking lot and restrooms.
518,2016-10-07,[''],Super fun
519,2016-10-03,[''],Nice easy hike with beautiful colors!
520,2016-09-30,[''],"Great little trail, i ran it but would recommend it for anyone (including families with kids). One note, the trailhead is on the opposite side of the road than what the app says (it's on the south side)."
521,2016-09-28,['hiking'],"Nice falls, but the trail was not very well marked.  With the assistance of fellow hikers I managed to find the falls.  Saw 5 deer and two moose during the hike.  Would like to go back and find the cave when I have more time."
522,2016-09-27,['hiking'],"We opted not to finish when we ran into a moose and his girlfriend. Beautiful creatures, beautiful hike. Will go back to reach the end!"
523,2016-09-26,['hiking'],Did this hike today.  It was a beautiful hike.  There is (limited) parking at the trail head up the road.
524,2016-09-26,['hiking'],"This was a great trail to hike. Be aware though, if you have small children with you, or if you don't climb too well, there is one spot where you have to climb down about a 10 foot rock wall. There is also a small stream to cross, though it's not deep at all. Once you reach the falls you can stay at the bottom and enjoy the scenery from there, or you can  climb up some moderately difficult rocks to get to the cave. Keep on climbing to get to the top. What a view!"
525,2016-09-26,['hiking'],Most overrated hike in the Wasatch.
526,2016-09-26,['hiking'],"My kids and I did this one on Sunday night just to stretch the weekend out a little longer. It's an easy walk, good for having silly conversations with the family. And of course we couldn't resist climbing the rocks at the end. It's great!"
527,2016-09-25,[''],Nice hike. Not difficult at all. The falls was more of a trickle but still pretty nice. My 10 year old was able to do this hike no problem. Not overly crowded but a fair amount of people hiking. Recommend this hike for sure.
528,2016-09-21,['hiking'],"Donut Falls is more like a walk to me, great for kids but wish I could bring my dog. Hiked up over the falls and back into the mountain a ways, it was beautiful."
529,2016-09-20,['hiking'],This trail hike was wonderfully exciting with views into the valley below. Lots of traffic on a Saturday and Sunday.
530,2016-09-18,['hiking'],"We really enjoyed this trail. It would be a 5 star worthy if there would have been less people. There was literally people everywhere. I have been on less busy city sidewalks. 

That being said it was a beautiful trail and the leaves were changing. It was really fun!"
531,2016-09-17,[''],"love! great, short, gorgeous hike. the water is very cold. awesome after work trail, easy to run"
532,2016-09-15,[''],I completed this hike with my 2 yr old and 3 yr old. The entire hike was doable with young ones with the exception of climbing to the top of Donut falls. The scramble was a little too much for the babies. Still a fantastic hike
533,2016-09-12,[''],Nice for kids pretty view at the end
534,2016-09-11,[''],"The hike was easy, but beware of slippery boulders near the end of the hike. Donut falls isn't much to look at from below where the trail takes you. I had my young children, so we didn't dare scale the rocks to the top, although I bet it's beautiful from up there. Overall it was just okay. Nice little hike, but not all that great unless you're willing to risk your life at the end!"
535,2016-09-09,[''],"The waterfall at the end is the coolest part. We climbed up, regardless of the signage telling us not to. Rebels."
536,2016-09-06,[''],Have snowshoed this trail and love it for that. Too crowded of a hike. All the ppl ruin the experience.
537,2016-09-06,['hiking'],Simply amazing day.
538,2016-09-06,[''],The hike was great. Only issue I had with this is all the trash left along the trail and near the falls.. People need to pick up after themselves.
539,2016-09-05,['hiking'],We came with several friends. It was a lot of fun. The only drawback was there were so many people! Way too many. Great hike anyways.
540,2016-09-05,[''],"easy hike, lots of people"
541,2016-09-02,[''],We saw moose and walking inside the donut hole and walking over a log to get closer was fun. Gf wouldn't let me get too close to see on top but would of been fun to look directly over. Short hike but was good prep for lake Blanche
542,2016-08-29,['hiking'],The best time to go is around 9 am. It's nice and cool and it's not crowded. The trail was clean and it was beautiful. You do have to climb up some rock at the very end to see it well. But the trail to get up there is really easy. Your feet will most likely get wet so expect that.
543,2016-08-28,[''],The water is so clear and beautiful. I went in the falls and it was freezing cold. I loved the trail and playing in the water❤️
544,2016-08-28,[''],The waterfall is so fun to climb!
545,2016-08-27,['hiking'],Short hike with a great payoff. The falls are gorgeous. The hike has a challenging incline for novice hikers but I saw plenty of grandmas and children completing the whole trail. Be careful of trail forks because the correct path is not always marked but there are usually enough people hiking that you can just follow the flow. You will have to cross the stream at the end and your shoes might get wet.
546,2016-08-25,['hiking'],Great afternoon hike. Saw a young bull moose on the way back down. Not from an area with mountains so I thought it was a little more difficult than an easy but not too overpowering.
547,2016-08-23,['hiking'],"I loved this hike years ago, but the trail has washed out sometime since the last time I've done it. Now you have to cross the river and scramble up the rocks to get to the falls. It's still nice, but not as nice as it once was."
548,2016-08-22,['hiking'],"Easy hike up to the falls. Your feet will get wet. Be prepared! Moderate/hard rock scramble up the top of the falls is optional, but to get in the ""donut"" you'll have to do it! Lots of slick rock. Packed with families. Beautiful views at the top. Overall, I'd do it again."
549,2016-08-21,['hiking'],"if you're going to come here early don't come before 7am unless you don't mind walking in from the main road to the trailhead. the gates to the road up to the trailhead does not open til 7am. we came early and parked in the lot just off the main road and walked approximately half mile up the road, past the private homes to the trail head. Super easy hike and judging from the trash along the trail it's popular. majority of the trail is covered and great for kids."
550,2016-08-20,[''],Easy for kids I really loved it
551,2016-08-20,['hiking'],Beautiful and worth the trail and the end with a refreshing splash!
552,2016-08-18,['backpacking'],Easy for young children. Lots of fun
553,2016-08-17,['hiking'],Loved it!
554,2016-08-15,[''],First part of the hike was the paved road to the trailhead. Beware of cars if you hike from the bottom.
555,2016-08-10,['hiking'],
556,2016-08-05,['hiking'],"This was a great hike with mostly easy terrain.  We took the left fork and did encounter some boulders that we had to climb down in order to get to the creek.  Poles could come in handy crossing the creek at the end.  I didn't track the distance but it seemed shorter than 2 miles in.  Then again, the trail was so easy that it didn't require rest stops.
""Heavily Trafficked"" is an understatement.  If you wait too long in the day, you will find yourself waiting in line to climb up/down boulders and obstacles.  Parking at the trail head is very limited."
557,2016-08-04,['hiking'],Great short hike fit for the whole family. Climbing the rocks up to the cave are a bit tricky but well worth it.
558,2016-08-03,['walking'],"Great hike for my 6 year old and me! He loved rock climbing at the end to see the donut! Not nearly as busy as I was expecting, but we went on a Tuesday afternoon."
559,2016-08-02,['hiking'],"We arrived around 9am in a Tuesday, easily found parking in the lot and headed up. Never being here before I wasn't sure what to expect! The trail to the falls was easy for my seven year old, but once we got to the falls we were unable to see the donut feature. In order to get to the cave we were told we had to climb up the wet rocks. We made it half way but my little got scared and we went back down. Very cool none the less and I want to return without kids!

Be prepared for wet feet! As we were leaving some girls were trying to walk on rocks worried about their shoes... Parking lot was full when we left as was the rode leading to the trailhead (around 11am). 

Best part: we saw a deer!"
560,2016-07-31,[''],We went at 8:00 am and there was just a handful of people up and back. We even enjoyed the falls by ourselves. As we were leaving the parking lot people were starting to flood in. We know from experience that this hike is something you do early in the morning because of the amount of people (especially kids).
561,2016-07-29,[''],It was very pretty and easy...but far too crowded for us
562,2016-07-29,[''],One of my all time favorites!
563,2016-07-29,[''],"Beautiful hike. Lots of squirrels, Aspen and people. Went on a Wednesday night and probably saw 100 other people."
564,2016-07-28,['hiking'],"Easy, quite crowded.  Worth the effort.  We hiked from Spruces campground."
565,2016-07-28,[''],"Easy trail, just plan on wet feet. lots of people."
566,2016-07-27,[''],Easy trail but we took the wrong one and had to walk back down to the creek and walk about 5 minutes into it and climbed up donut falls it was so worth it
567,2016-07-26,['hiking'],easy easy but wear wet shoes at the end
568,2016-07-25,['hiking'],Love this hike a bit crowded but love to climb up into the cave. That makes it all worth it.
569,2016-07-24,['hiking'],"This was a really easy and quick hike - maybe a 30 minute hike to the falls. Once you get there you have to walk through a freezing cold creek for about 10 minutes to actually get to the ""donut falls"" section, but once you get to the falls/cave area it's absolutely fantastic. There's a hole at the top of a cave with water gushing through it, hence donut falls. You can actually go inside the cave, if you're man enough, and view everything up close. I highly recommend this hike to anyone! Great time. Oh and I know I mentioned this, but your feet will get wet."
570,2016-07-22,['hiking'],We love this hike and try to go every year.  Avoid the weekend crowds - it gets nuts up there.  We like to bring a box of donuts to enjoy.  Water shoes would be a good idea to more easily cross the water at the top.
571,2016-07-21,[''],"Great family hike with lots of shade. The falls are really pretty,  but the wet rocks can be slick. Our adventurous  teenage son climbed to the top and actually fell through the donut. Fortunately, he wasn't hurt, but he certainly could have been!"
572,2016-07-20,['hiking'],Nice early morning hike.
573,2016-07-20,['hiking'],Very busy.  Parking lot off main road is 1/2 mile from the trail head.  If you have little kids it's worth driving to the trail head to see if you can find a closer spot.  Easy hike for all ages.
574,2016-07-18,['hiking'],Great family hike
575,2016-07-17,[''],"One of my favorite ""beginner"" trails, it started my love affair with hiking."
576,2016-07-16,[''],"The perfect hike for a family with kids. Even on a hot summer day, the temperature is comfortable. Water, a snack and bug spray are recommended. There are plenty of places for some great photos. I'd recommend parking just off the road and walking in as opposed to trying to get a parking spot right at the trailhead."
577,2016-07-14,[''],"Family loved it.  Easy hike until you get to the end.  A little bit challenging with toddler.  Be ready to get your feet wet, and bring extra shoes to change into after.  It's worth it going all the way to the top to see the water falls and the hole.  Watch out for slippery rocks.  Have fun :)"
578,2016-07-13,[''],"pretty easy hike. it can be crazy crowded on weekends and i have never been on it without seeing other people. the falls are beautiful, but there can be quite a bit of garbage in places."
579,2016-07-11,['hiking'],Great short hike to a really interesting watetfall. I would recommend arriving early. This trail can get rather busy. We started at 0800 and it was perfect. Not real busy. On the way up to the waterfall we ended up seeing a moose. On the way back down the trail it started to get real busy and once we got back to the trailhead the parking lot was full and people were parking along the road.
580,2016-07-11,[''],"It's a fun little hike, but insanely crowded, we didn't spend too much time at the falls since there were so many people. But way easy hike."
581,2016-07-11,[''],nice
582,2016-07-08,['hiking'],Pretty easy trail that is great for kids/non-hikers. My only complaint about Donut Falls is that it is often really busy.
583,2016-07-04,[''],Great quick hike in the area when water fall is flowing
584,2016-07-04,['hiking'],"Pretty easy, some places it's difficult to figure out which trail you use, and it would've been nice if the park ranger would've told us about the easier side! All in all, really cool trail, lots of little wildlife running around and the falls are really cool!!"
585,2016-07-04,['hiking'],"Perfect evening hike but expect to see lots of people due to its popularity. I suggest wearing sandals so that you can walk on rocks in the cold water. When you get to the falls, it's best you just admire the scenery at the bottom if you're inexperienced. If not, it's a fun scramble to a cool view of the falls! Perfect way to cool off, too."
586,2016-07-03,[''],"nice hike. 4 kids did great. didn't make it all the way to the top as the rock climbing for my 8 and 9 year old so
was too steep. I recommend driving the mile farther to the trail head... especially for someone with small children. Having to park in the lot just makes it that much more walking for kids in the heat. water was cold and rocks were slippery, but it was beautiful.  Busy trail for sure."
