,Date,Tags,Comments
0,2019-09-07,['hiking'],Loved this trail!  It's short but I went early and had the falls to myself and I just loved how the water cascaded over the rocks and it's definitely a unique waterfall worth seeing.  I agree that this is a friendly hike for all ages so long as little ones aren't climbing up the rock scramble at the end.
1,2019-09-07,['hiking'],Popular trail with lots of people. Great short and easy hike for kids and beginning hikers.
2,2019-09-05,['hiking'],"Very Easy hike, even if you have to park on the main road instead of the smaller lot by the bathrooms. Because of this it is always a really busy hike. Some think the waterfall is a let down, and even though it’s smaller I’ve never seen another like it. Great hike with even small kids."
3,2019-09-05,['hiking'],"You can either park by the highway or take the road all the way up to the trail, but the parking by the trail fills up quick! We liked the extra walk to the trailhead, even if it's all on a gradual incline. The trail itself starts out a bit steep, but eventually levels out. The trail is very pretty, mostly shaded, and you cross at least one stream before you end at the stream by the falls. There is a sign that warns to not climb the rocks of the waterfall, but there were a lot of people that ignored it despite the slippery rocks. Overall, very easy trail, nice views of forest and nearby mountains, and plenty of signage and obvious pathways to make sure you don't accidentally veer off course. The water of the stream was low enough by the waterfall that we could cross over and get closer without getting our shoes wet! The rocks are slippery though, so be careful, especially on the small climb down to the stream itself. "
4,2019-09-03,['hiking'],The trail itself was very easy and well shaded so you can go any time of the day and be fine. The parking lot fills really fast and if you have to park out on the street it could add about 1 mile total to the trail. When we got there the river was pretty full you can walk across it but you should bring some water shoes or your feet will get soaked!
5,2019-09-02,['hiking'],Too many people and the waterfall itself wasn’t much to speak of. Would recommend picking a different trail.
6,2019-09-02,['hiking'],"We started a little after 7am and it was not too crowded yet. Nice and cool the entire time and the sun was still not in the canyon. 

Nice short hike for nearly any skill level. 

If you want to see the waterfall going into the donut hole you have to climb down a little 5-10 foot rock face and then hike up the river/waterfall. You will need to step on stones and logs to not get your shoes wet. You also will have to climb up the waterfall that is pretty slippery and might not be for everyone. You can kinda see it from the bottom but not as good as the top. I took my sons 8 and 6 and went to the top. I had to help the 6 year old a few times with the climbing and river crossings. 

I’ll be back with more family members next time for sure. We loved it. "
7,2019-09-02,['hiking'],"It was okay! There was a lot of people though! To hike to the falls part, we all had to take turns climbing up there and seeing the waterfall up close. It was a quick easy hike though "
8,2019-09-02,['hiking'],"Easy hike that is perfect for families or for something quick when there isn’t much time. Minimal incline for the first half the loop, then flat the rest of the way. Definitely recommend parking at Mill D rather than the trailhead lot to get a bit more distance. Plus, the views are awesome walking to the trailhead"
9,2019-09-01,['hiking'],Super fun trail. But way way crowded on a Sunday! In the summer wear hiking sandals. In the winter time wear crampons
10,2019-09-01,"['hiking', 'scramble']",
11,2019-09-01,"['hiking', 'scramble']","Great easy hike, worth especially if you are staying in SLC, only about 20 minutes from Sugar House.  Waterfalls are gorgeous!!!  "
12,2019-08-29,"['hiking', 'rocky']",1.0 mile each way out and back. Easy trail filled with pines. Saw a female moose. Kid friendly.
13,2019-08-28,['hiking'],Saw three big moose on the trail today!
14,2019-08-28,['hiking'],"Love this trail! It’s a short, super easy hike to the falls, which are beautiful. You can choose to hike up the rocks that make up the falls to see the actual “donut” which is highly suggest. It gets packed, but worth it. They give out parking tickets, so don’t park where you shouldn’t!"
15,2019-08-26,['hiking'],"Really cool waterfall, although very crowded once you get closer to the waterfall. A bit of a scramble to get to the top of the falls. Unfortunately there is a lot of trash on the trail, stop littering people!"
16,2019-08-25,['hiking'],"Fun family hike. Easily accessible, so it's often very busy.
Sad to see so much graffiti along the trail right now. Many signs, benches, and trees have been defaced. Ugh. "
17,2019-08-24,"['hiking', 'rocky']",
18,2019-08-23,"['hiking', 'private property', 'rocky']",This was a beautiful easy hike and nice waterfall! 
19,2019-08-23,['hiking'],"Donut Falls Trail was a pleasant hike! I was anticipating it being quite a bit longer (I doubt it was 3 miles), but wonder if it’s taking into account the distance from the further parking lot. We got there a little before 8am and there was plenty of parking by the trailhead but it filled up not long after. We were very cold. I think it would have been more enjoyable when the sun was over the mountains, but can see how high volumes of traffic would be a deterrent. The rocks leading up to the waterfall were very slick (as evidenced by the sign telling you not to go up them). I would not recommend doing it alone or bringing young children. We saw more than one person slip and fall into the freezing water. "
20,2019-08-23,['hiking'],"This is a very popular trail with a lot of families, so if you're looking for solitude, this isn't the hike for you. There are two parking areas, the larger being off the canyon road with a .50 mile walk on pavement to the trailhead and second parking area which is typically full. At the trailhead sign there are are two trails, the one to left is a more difficult terrain but they both lead to the falls. There is A LOT of traffic at the falls and to reach the top requires scaling slippery steep rock. Plan on getting wet feet if you want to get close to the falls. "
21,2019-08-23,"['hiking', 'bugs', 'muddy', 'off trail']",Nice family friendly trail. There is a lot of foot traffic however. Bring shoes that you don’t mind getting wet and muddy. You will have to climb up/down some rocks and walk through the water. 
22,2019-08-20,"['hiking', 'muddy', 'rocky']",
23,2019-08-20,"['hiking', 'off trail', 'rocky', 'scramble']",
24,2019-08-17,['hiking'],"Really easy hike with very rewarding views. My friends and I climbed to the top of the waterfall and went into the donut. I ran through the waterfall and it was so fun!! It took us about 2 hours, but we spent a lot of time at the waterfall. I will definitely do this one again. "
25,2019-08-17,['hiking'],Awesome hike today!! Lots of chipmunks on the trail!
26,2019-08-12,"['hiking', 'rocky']","really pretty hike, we went to the bottom and then the top! I didn't realize theres a rope to use to climb into the donut. not sure I would've anyway! :) pretty and good workout but not hard at all. easy hike! "
27,2019-08-12,['hiking'],This is a great family trail! The waterfall is awesome and our kids loved it! I would for sure take them back and do it again. You will get wet so have water shoes. 
28,2019-08-11,['hiking'],"This trail is great! It is beautiful the whole way there and ends in a beautiful waterfall. It is a little sad that many people that are on this trail don't respect the wildlife or the rules. When you arrive there is parking right at the trailhead after driving through a dirt road, but if the parking lot is full you can park by the main road. There is a bathroom at the beginning of the trail. There isn't any swimming or wading because it is a watershed, but sadly a lot of people don't follow this rule. When you are almost to the falls there is a point where the trail forks. The left trail goes to the bottom of the falls and the right goes up above past some private property signs and above the donut part of the waterfall. Our 9 and 7 year olds were fine the whole way up. Be careful! The rocks can be slippery."
29,2019-08-11,"['hiking', 'rocky', 'scramble']",If you are the type of person who likes solitude this is not hike for you. It was very crowded. We were lucky to be able to park near the parking lot and not out on the main road. Most of the hike is easy - our four-year-old twins did it without any problems. We made it to the base of the falls but the final scramble up the rocks was far too crowded and slippery to take young kids. So we are unable to see the donut part of Donut Falls. I would definitely recommend trying this hike early in the morning midweek but not during peak weekend hours. Also if you have little kids and want to go up to the donut you probably need an adult for each child. There are many other awesome hikes in the area that I would choose before this one.
30,2019-08-10,"['hiking', 'rocky']","I had high hopes for this trail. I'm not a hiker, and quite out of shape... but this app rates trails like Silver Lake Loop easy... and this trail in the same 'easy' category. This trail is quite an inclined, rocks and roots cover much of the trail. This trail should be rated hard if for no other reason that to complete the hike, and get the picture pay off, you've got to climb straight up huge SLIPPERY boulders. "
31,2019-08-10,['hiking'],We drove up to the parking at the base of the hike so we didn’t have to hike the road. The trail was beautiful and we loved the falls. There is high traffic but not on the second side of the loop.
32,2019-08-10,['hiking'],So much fun! Didn’t realize there was parking near the trail head. Got a little muddy but worth it! 
33,2019-08-07,"['hiking', 'rocky']",8/7/19 Definitely an easy hike to get to the falls. But I would say to actually climb to the donut part you need to have an adult with a kid younger than 8. My boy who is 10 made it up super easy without help. Today however we went when it was a bit rainy. Water is freezing!  But the view was amazing. Definitely worth the numb feet! :) 
34,2019-08-07,['hiking'],"8/7/2019 You’re not going to believe this, but we had Donut Falls to ourselves!  We went this morning and got a great parking spot at the trailhead around 8:30am.  We saw hikers coming down, but during our actual time in the Donut cave  and climbing down the falls, we had the place entirely to ourselves—not a soul in sight until we were away from the falls.  Such a beautiful hike on an overcast morning.  My 11 year old son with autism made the climb to the donut hole and back down (which is really the tricky part) and is so proud of himself.  My 9 year old guy has done it 4 times now easy peasy.  Gotta know the trail and your kids’ abilities though.  Being inside the cave where the water comes through is a thrill, and the water is still super high this year.  Love this hike!"
35,2019-08-05,['hiking'],"Busy trail, but still a nice trail "
36,2019-08-04,['hiking'],Quick hike that’s mainly kid friendly. Need water shoes to get to the waterfall but a pretty hike even without the water shoes
37,2019-08-04,['hiking'],Very easy trail
38,2019-08-04,['hiking'],"Very beautiful hike. Trail is well maintained and signs to help with direction of the trail. We saw a deer while on the hike as well. At the waterfall we decided to hike up the rocks of the waterfall to get up to the actual donut fall. Would definitely not recommend that section for kids. Get there before 9am if you’d like to try and beat the crowd. We parked at the bottom near the main road, but there is a parking areas farther up that fills fast."
39,2019-08-03,['hiking'],"Really easy hike, good for kids, they loved climbing up the falls."
40,2019-08-03,"['hiking', 'rocky']",
41,2019-08-02,"['hiking', 'scramble']","Super short hike, but the kids loved treading through the water and scrabbling up the rocks to the falls. BE SURE TO BRING WATER SHOES! There is no way to get up to the falls without getting your feet wet. And honestly that’s the best part of the whole trail. "
42,2019-08-01,['hiking'],short and sweet! Took my 12 and 9 yr old no problems. Very pretty
43,2019-07-31,['hiking'],"Beautiful, completely kid- family friendly but maybe a little too much so.  Pretty large groups of families and camp groups making the hiking not as relaxing."
44,2019-07-29,['hiking'],"Very busy, but the short hike to the falls is quick and easy! "
45,2019-07-29,['hiking'],super trial...
46,2019-07-29,['hiking'],"Great trail, hikers with poor attitude and etiquete. I saw people littering and walking dogs when it explicitly says “no dogs allowed” definitely don’t recommend it if you like quiet, peaceful hikes. "
47,2019-07-29,['hiking'],"The hike was easy and not bad at all. I’m a little bummed because all the photos I saw online made it seem like it was this big waterfall and cave you could stand under but it’s pretty small. You do have to like rock climb a little and walk through the river to see the fall. I would do again, and it’s easy, just online was misleading a little bit. "
48,2019-07-29,['hiking'],great quick trail. Super busy but worth it. 
49,2019-07-29,['hiking'],Short easy hike with big rewards.
50,2019-07-28,['hiking'],"Definitely an easy, but rewarding hike! Your feet will get wet if you decide to hike to the top of the waterfall, but it was worth it!! Only gave it 4 stars because of the amount of other people on the trail, heavily trafficked."
51,2019-07-27,['hiking'],beautiful wildflowers and grasses. truly gorgeous hike. took 50 minutes from the first parking lot by the Hwy up past the waterfall. only thing I didn't live was the masses of somewhat unfriendly hikers....
52,2019-07-26,['hiking'],"Easy hike, well covered, with high payoff. Make sure you hike into the grotto where the falls enter the rock."
53,2019-07-25,['hiking'],A little bit harder than we anticipated for our grandparents hiking with us but a fun trail! Up at the top you have to hike across some slippery rocks and down a tricky part. Wear water shoes.
54,2019-07-23,['hiking'],More of a stroll than a hike I’d say but fun nonetheless! 
55,2019-07-23,['hiking'],"Beautiful trail and easy for kids, I took ages 9,7,5 and carried the toddler in a pack. Highly recommended."
56,2019-07-22,['hiking'],Love this trail for snowshoeing. Take some micro spikes for a scramble to the falls- so cool to see when everything is frozen over! 
58,2019-07-20,['hiking'],"We definitely took the wrong way. Got a nice view of the falls from above, though. There isn’t a real end destination for the trail, the waterfall is just kind of there. We brought donuts but there was no room to sit and eat, though."
59,2019-07-20,['hiking'],It was pretty but waaay too crowded.
60,2019-07-18,['hiking'],Took my 4 year old and 2 year old. It was beautiful!
61,2019-07-18,[''],"A nice, easy hike meandering through a pine forest. The falls are picturesque but even on a Monday it’s quite crowded. "
62,2019-07-17,[''],Nice easy fun hike. Heavily trafficked. Good for kids. 
63,2019-07-15,['hiking'],Absolutely beautiful
64,2019-07-14,['hiking'],"so very crowded,  too busy! beautiful and lots of shade.  "
65,2019-07-14,['hiking'],simple hike with kids but overloaded with people. Still a very beautiful hike.
66,2019-07-13,['hiking'],"The snow has melted and you can all the way to the donut. If you wear good shoes and be mindful of the water. It is moving fast and gets deep in some parts. Kids can go most of the way, but I would only take teenagers all the way to the donut. Love this hike! "
67,2019-07-08,['hiking'],Hiked this trail over the 4th of July weekend. It was super crowded. Surprised we found a parking at the trailhead.  Beautiful easy hike. To get to the actual donut falls you’ll have to scramble over & through big wet rocks at the end. Be prepared to get your feet wet. I kept my younger kids behind as the water flow was pretty heavy . It was nerve wrecking watching  the rest of our party climb up the rocks to the donut. 
69,2019-07-02,['hiking'],Nice easy hike for the kids.
70,2019-07-02,['hiking'],"did the trail June 29th 2019.
I have done the trail many times and on Saturday water was the highest I have ever seen.  good hike but be careful"
71,2019-07-01,['hiking'],Love this hike. But even though it's Monday afternoon it's still pretty busy and we ended up having to hike in from the highway cuz I've seen cars being ticketed in the past that have parked off the side of the road near the parking lot. The water is still pretty cold and I didn't feel like it was safe enough for my 11 and 9 year olds to hike to the top of the falls cuz the river is still moving pretty quick but it was still awesome and worth the hike 
72,2019-07-01,['hiking'],"The map says to start from the main highway for the 3 mile loop. We walked up a paved road for about .5 mile and realized you can just drive all the way up to the actual trail head by the bathroom and park for free. We didn’t mind the extra exercise as the trail to the falls is pretty easy but would have been nice to know. The falls were flowing high. The  main trail leads down to the river bed. You can hardly see the actual donut and to see it closer you’d have to scramble pretty much up the face of the waterfall. We found some side trails that led up the mountain a ways. The trail was small and strap but doable but even at the very top, we were still too far away to get a very good look at the donut. A fun hike with different difficulty levels depending on what your goal is for the day. We would come back probably later in the season when the water is lower to get a bit closer to the falls without being swept away. Overall a fun hike just up the canyons with beautiful scenery and quiet environment. "
73,2019-07-01,['hiking'],Hiked on 5-22. The main trail is pretty easy and scenic. Getting next to the Donut is a little tricky due to the heavy water flow. We climbed the side of the mountain to try to get to the donut (more difficult). There are several very steep descent paths we tried (be careful).  We found the right one and were able to get to the donut. The water was flowing too hard to go underneath the donut. 
74,2019-06-30,"['hiking', 'rocky']",
75,2019-06-28,['hiking'],One of my favorite hikes! The river levels were high so you couldn't easily get to right under the falls.
76,2019-06-27,['hiking'],"LOVE this trail!! I have done this hike twice in the last 2 weeks with my baby in my pack. It is easy enough for the whole family to enjoy. There is a tiny scramble over some rocks in order to get to the falls, but it's fairly easy."
77,2019-06-25,['hiking'],"Falls is raging! Read some reviews before going so I was prepared with my water shoes and it’s a good thing I did! Was able to climb up and get in the cave but water was above my knees and freezing, but very worth getting in. Love this hike!"
78,2019-06-25,['hiking'],"Just did this today, it’s one of my favorite spots to hike to. You’ve gotta get your feet in the river if you want to climb up to the donut cave, and the water is super cold but it’s totally worth it. The water is moving pretty quick, but it’s doable if you watch your step. Saw some patches of snow up past the cave, but not much at all, should be gone within the next week or two. "
79,2019-06-23,['hiking'],"Good hike! The trail gets rather treacherous high up - muddy, snow patches, steep and rocky. I took the shady route up but on the way down I stayed along the creek instead of crossing back over the little bridge, it was nice! The falls are flowing really strong still so there's no getting as close to the ""donut"" as you usually would be able to this time of year."
80,2019-06-21,"['hiking', 'muddy']",This trail is a great and easy! Perfect for a simple day hike. The water is running pretty high so you can’t quite make it to the sign but still a pretty view of the river and falls. We even saw a moose on our last time up! 
81,2019-06-19,[''],"some snow and muddy spots. wet feet and so much fun. cool temperatures and great views. water moving fast, so be smart.
took my 3 and 5 year old grandsons. they hiked it all the way and back. 
exceptional family hike. "
82,2019-06-18,[''],"Currently the trail has some muddy spots but passable.  

Easy 2 mile round trip hike to the falls (from bathrooms at the dirt trailhead).  4 miles round trip from the major road if you walk all the way in.  Great place for photos.  Not good for people who may have a hard time climbing or steep hills.  "
83,2019-06-15,['hiking'],"First hike with my 6 & 8 year old and we loved it! Pretty easy hike with a great payoff at the end. There's a pretty steep part right before the falls, but it's not too bad. It was early June and the water was running fast so we couldn't get all the way up. We'll be back later in the year when the water isn't running as fast."
84,2019-06-15,['hiking'],Fun little hike. It is still a little muddy and slick. Crazy busy!!!! 
85,2019-06-15,['hiking'],Easy hike lots of traffic 
86,2019-06-13,[''],"great, pretty, shady "
87,2019-06-12,"['hiking', 'off trail', 'rocky']","This is a great hike and totally worth the waterfall!! I would rate this trail moderate, though, because there are some pretty technical spots."
88,2019-06-12,[''],"a bit slippery, but the perfect hike to start the season. "
89,2019-06-10,"['hiking', 'muddy']",
90,2019-06-10,['hiking'],"Short trail, lots of people & the waterfall at the end that you can climb"
91,2019-06-08,"['hiking', 'muddy', 'rocky', 'snow']","6/7/19–3:32pm: I’ve attempted this hike twice and just can’t seem to  make it to the falls! Today, the weather was beautiful. Temperature was moderate and there was a small breeze, perfect for this hike. The trail was muddy almost from the start and there was quite a bit of snow up the entire trail. Saw a small garden snake at the trail head. The first bridge is covered by small fallen trees and water so we had to walk around on the snow. When we finally got to the fork that goes down to the river, we discovered that the water was WAY to high to take that path. It’s flowing really fast right now and the lower trail next to the River is completely covered. We tried the alternative route above and we decided that there was too much snow to trek through. We ended up turning around, and decided to try again a bit later in the season! Always a good hike though. Beautiful sights to see!"
92,2019-06-06,[''],one of my favorite hikes. its suoer pretty in the winter.
93,2019-06-04,"['hiking', 'muddy', 'rocky', 'snow']","Great easy hike, very muddy. "
94,2019-06-03,[''],"Super easy hike that can be done in an hour with kids.  Getting to the falls requires climbing on some rocks toward the end, but it's an easy climb.  If you're an experienced hiker looking for a challenge you'll be disappointed.  if you're a very casual hiker looking for a quick morning or afternoon trip you'll have a great time.  "
95,2019-06-02,"['muddy', 'snow']",Hiked this so many times I could probs do it blindfolded. The river is roaring this time of year so be careful!!
96,2019-06-02,"['hiking', 'muddy', 'snow']",Great trail leading to a waterfall. It's muddy and there is quite a bit of snow still out. Wear shoes with good grip or you'll be sliding all over the place. You have to climb some rocks and get into the water to get to the donut hole. 
97,2019-06-02,"['hiking', 'muddy']",
98,2019-06-02,"['hiking', 'muddy', 'snow']",
99,2019-06-01,['hiking'],"We brought a dry pair of shoes and socks for afterwards 
My 14 year old son got his feet wet at the falls but I stayed safe and dry 
Even though there’s snow and some mud here and there -it’s packed down and you just avoid the mud no big deal!
I thought I’d be cold and wasn’t at all"
100,2019-06-01,"['muddy', 'snow']",Prepare to get your feet wet and muddy. Beautiful hike. 
101,2019-06-01,"['muddy', 'snow']","We did this trail yesterday. It's easy to find, and marked well. My four year old made it to the point where you can see the falls but getting right up to them is a bit too tricky for the young ones. Bring extra socks and shoes for when you get done if you plan on getting very close. It's beautiful though, and worth the wet feet!"
102,2019-05-31,"['hiking', 'muddy', 'snow']","Friday 5/31/19 1.30-3pm 60's & sunny. First 0.75 miles is up road (paved then dirt) thru a few private residences. Then left branch of trail goes thru mud, packed snow, and stream. At the end you are walking in stream to base of falls with snow all around.  gorgeous. lots of people of all ages, footwear (flip-flops!), and clothing (swimsuits!).  Great bang for the buck. After doing Grandeur Peak in the AM this was a good ending for the day.  "
103,2019-05-31,"['hiking', 'muddy', 'snow']",A good bit of snow still on the path but it's pretty packed down so walking on it wasn't hard. Wear ok shoes and you should be fine. Beautiful hike with an awesome ending. 
104,2019-05-26,"['hiking', 'muddy', 'snow']","Trail is in decent condition. Expect slick spots, slushy areas and depending on shoes the potential for wet feet. We made it all the way to the donut hole.  "
105,2019-05-26,"['hiking', 'muddy', 'rocky', 'snow']",This is an absolutely beautiful trail. There is lots of snow still the farther in you get so be prepared. Poles aren’t necessary unless you want to climb up the waterfall. Climbing up the waterfall is a little dangerous at times and slippery. Poles would be useful but it can be done without. Beautiful at the top!
106,2019-05-26,"['hiking', 'scramble', 'snow']",
