,Date,Tags,Comments
86,2018-10-31,[''],"Wouldn’t be the first or fifth trail I’d hike in the area, but bonus of it not being watershed. The people who live there that hate the trail access should have moved, oh, I don’t know, maybe not directly next to the Wasatch?"
87,2018-10-07,"['hiking', 'private property']",
88,2018-09-15,[''],This was a fun hike. Steep in some places especially at the end. I personally would not put this hike in the hard catigory. Waterfall is barely a trickle.
89,2018-09-03,[''],Great quick burner 4.4 miles up and back. Falls were a trickle this time of year but still beautiful. Trail mostly shaded for a good part of the day. Directions to trailhead took us a min so thought I’d share the real directions: Walk up Canyon cove drive . Left on Canyons wind lane. Right on Oak canyons drive.
90,2018-08-08,[''],It is a great trail
91,2018-08-07,['hiking'],"I live in the last house before the trail and let me tell you, we love that hikers use it! Some neighbors down the street are real strict about parking and we have been fighting to prevent a gate at the bottom of the street. there are lots of wasps on the trail (especially by the 2 water spots near the beginning of the hike) and occasionally a snake in the bushes. i take my small dog up there nearly every day and would say the bees are the only pests. It has some steep parts near the top with loose rock so be careful and go straight then right to see the waterfall when you reach the rock slide. Please pick up after your dogs and throw it in the bucket at the bottom of the trail and don't be shy, say hi if we're outside!"
92,2018-08-04,[''],"!!GETTING TO THE TRAILHEAD!!
you'll have to park on the east side of Wasatch Blvd. Then walk up canyon cove road, take your first left, then your first right up wind canyon rd, I believe. THEN you get to the teailhead. enjoy!"
93,2018-08-02,['trail running'],"Great burner trail run when you’re short on time. Be on the lookout for rattlesnakes tho, one at the top today right before the waterfall."
94,2018-07-26,[''],Pretty steep on the way up! Luckily didn’t see any rattle snakes. Loose rocks at the top so be careful where you step. I almost slipped and fell pretty far. But the views were well worth it! Got done in about and hour and fifteen
95,2018-07-17,[''],Good workout w/ rewarding view @ the end.
96,2018-06-26,['hiking'],"Trailhead is kind of hard to find. It is buried deep within a privileged McMansion neighborhood. Seemed like people built their fancy abodes directly around the trail, then got mad that hikers were trying to use the trail. Weird negative vibe. Description says “part of Oak Canyon Drive” is no parking. Hard to miss the 100+ no parking signs aligning the street. So I parked beneath them. Place was pretty empty. Started up the street with my old dog, when some kid called out to me.  Told me to move my car “no parking”. Even though I was below the signs and totally out of the way. Just weird to walk through a residential neighborhood and someone’s driveway to get to a trail. Anyhow, I get it fancy kid. Just trying to take a quick hike on a mellow evening. The place just had a weird negative vibe, then to be so rudely talked to. Yeah, I don’t need it."
97,2018-06-15,['hiking'],"I like this trail but it is quite overgrown at all times of the year. Two young rattlesnakes on the trail today, but it’s hard to watch your step in a lot of places. Keep your eyes open because you can hardly hear the young ones."
98,2018-06-15,[''],Great trail didn’t see a single hiker nice a and shaded most of the way with a little stream up the whole way my dog loved it! There is lots of bugs.
99,2018-06-14,[''],Very beautiful trail but the map/mileage needs to be updated since the trailhead is on Wasatch Blvd now.  We didn’t run into any snakes thank heavens but hiked it early before the sun was on the trail.  When you get to the boulder field go RIGHT- not up.  There was a cairn up high that led us to keep going up and it got extremely steep and we missed the falls.  We found it on the way down after some searching.  The trail end on this map is not where the falls are!  My Strava said 4 miles with 1400 ft elevation gain. Great hike though!
100,2018-06-11,['hiking'],"Rattlesnakes! About 100 yards up from where you leave the pavement my wife ahead of me got rattled at. I spotted it 14 inches above the trail so had to detour down below the trail to get around it. It was slightly bigger than a golf ball so a pretty good sized one. In informing others where it was two different groups alerted us to where they had encountered one and showed us pictures. One was just before the 2nd stream crossing, and one was on a log sunning its self. BE CAREFUL!

Lots of poison ivy this year also."
101,2018-06-11,['hiking'],"I wish I had read this before I went! I saw one of the rattlesnakes as I came back from the waterfall before I got back on the boulders. I grabbed my dog and got out as fast as I could. Otherwise, I loved the hike. I wouldn’t recommend for small dogs though as I had to hold my dog as we went across the boulders."
102,2018-06-10,['hiking'],"This had to be one of the best hikes I’ve been on in my long career of trail hunting. From the beautiful growth and vegetation leading up the trail, to the treacherous quest over boulders scaling up the Mtn to the tiny waterfall in the pocket of the canyon. Definitely a sight to see!"
103,2018-05-29,[''],Beautiful scenery and great hike. Bit of an incline but worth the hike and a rewarding beautiful waterfall.
104,2018-05-28,[''],Steep but great waterfall!
105,2018-05-26,['hiking'],"A bit tough, steep elevation gains but worth the views. Plus the water fall at the end is pretty cool"
106,2018-05-24,['hiking'],"Beautiful hike next to the mountain stream, awesome views of the valley, canyon, and the waterfall. It’s pretty steep! I found the rattlesnake in the first part of the rock fall between some boulders."
107,2018-05-21,['hiking'],"The City of Holladay, because of safety problems on Oak Canyon Drive, has moved the trailhead parking to Wasatch Boulevard and part of Oak Canyon Drive has been closed to parking. I've uploaded two photos showing the trailhead parking sign and no parking signs."
108,2018-05-21,['hiking'],Gradual steady incline all the way to the end of the hike. The view of the waterfall is very rewarding at the end.
109,2018-05-19,[''],"nice hike, well shaded  2 ft rattlesnake likes to hang out on the trail 20 steps past the foot bridge just before rock slide."
110,2018-05-17,['hiking'],"5/16/2018 Strenuous and rewarding, not forgiving at all. Being just a short distance into a neighborhood, it’s so secluded sheer minutes into the hike. Not many people on the trail, which is amazing. Will do again."
111,2018-05-17,['hiking'],Pretty strenuous hike due to the elevation gain in certain areas and towards the end you're scrambling on large rocks. The views are definitely beautiful though.
112,2018-05-10,['hiking'],"Beautilful hike, but steep for most of it. The views at the top are great though, and worth it if you are in decent shape. Once you cross the extremely rocky part of the trail, hike up until it levels out and that's the best view of the canyon.

The last 0.3 mile of the trail wasn't well trodden, and one of the steepest parts of the hike with no majestic views resulting at the end.  The rocky part was hard for my dogs to cross."
113,2018-05-09,['hiking'],"First rattlesnake of the season was spotted May 5th. Fortunately the lady who was ahead of me about 50 yards had her dog on a leash (a rare event), but boy did she scream! It eventually moved off the trail. The homeowners at the top of the private drive are providing a ""poop pail"". Sadly, not getting much usage."
114,2018-05-08,[''],"beautiful hike that wasn't crowded at all on a warm spring Saturday. very steep area towards the end before you reach the waterfall. if you decide to continue past the waterfall, the hike is very steep and rocky. there is a beautiful view just past the boulders and a fun mini waterfall to hang out and eat lunch by, but much further doesn't really lead to any destination point."
115,2018-05-07,['hiking'],"It was beautiful! There aren't many signs in the neighborhood below to figure out where to start. But it's pretty self explanatory.

It was amazingly green everywhere in the canyon. The trail is very steep the whole way there. It's only about 1.6 miles up but it took us almost an hour because of the elevation gain. The trail is skinny, and you can't see much with the trees, but once you get the the rock slide and waterfall it has an amazing view!

I would highly recommend it!"
116,2018-05-07,['hiking'],"Fun! Wear shoes you can get wet, lots of run off water. Gets steep at times but the waterfall is worth it. Boulders were kinda sketchy with the dogs but they seem to get the hang of it."
117,2018-05-07,['hiking'],"It was beautiful today! I would rate this hike as moderate, it only took us a little over an hour to get to the top but there were a few steep spots. You walk by the stream almost the whole way which was perfect for the pups! We did see one snake though ☹️ waterfall at the top is absolutely beautiful!"
118,2018-05-04,[''],"Great trail! I didn’t like having to go through a neighborhood and up someone’s drive way, but what can you do right?

The waterfall was spectacular, views were amazing, and as a reminder for everyone, LEASH YOUR DOGS!!!!!"
119,2018-04-30,['hiking'],"It's true there is no Bergdhalde Ln.  but it's easy to google the two connecting streets.  There is no parking any longer within the neighborhood along the streets closest to the trailhead.  Trail parking spaces have been created at the entrance of Canyon Cove  neighborhood along Wasatch, with a small sign stating this.  It's a steep but short two block walk to the trail head, which involves cutting along a private driveway right before the trail start. 

As far as the ""rock scramble"" mentioned in the comments, we headed straight across it (mostly half foot to foot tall flat surfaced rock from an ancient avalanche) which connected to the rest of the trail.  Just look for all the cairns.   This way does't take you down close to the largest waterfall in the stream, but you can also cut straight down the rock fall if you want.  Another large waterfall is encountered a short distance on the other side of the rocks, with many wildflowers in the rock wall crevasses above the stream and falls.  Really pretty this time of year.  We saw at least 6 kinds of wild flowers but missed out on all the snake action.  There was one small patch of snow in the shade, but the trail was mostly dry, otherwise.  The next day it rained and snow flurried, so I'm sure that has changed.   

Half the dogs were not leashed and of course, a bit of bagged and unbagged poop was found on the trail.  Not cool."
120,2018-04-29,['hiking'],Great hike. When to get the rock scramble at the end make your way sharply to the right where the waterfall is located. Just follow your ears.
121,2018-04-28,[''],"Trail itself is maybe 5 stars but one star off because you have to cut through a residential neighborhood to get there. 

Lots of neat terrain and views. A great stream the whole way. When you get to the boulders you have to find a path across because the trail goes another quarter mile or so beyond and it’s worth the trip."
122,2018-04-23,[''],"Nice trail, very few people.  Rocky in places but worth the trip for sure"
123,2018-04-20,['hiking'],"Fun short hike. The boulder field at the end is confusing, but stick to the low part of it to reach the falls, though the middle/upper portion makes for an incredible view!"
124,2018-04-01,['hiking'],"This hike is very steep, and there’s some scrambling at the end, but it’s worth it. It’s along a stream the whole way, and the waterfall at the top is gorgeous. Loved it!"
125,2017-11-01,['hiking'],"This trail isn’t bad but its more of a warm up hike for another hike , its a good trail until you get to the wooden bridge, then its a steep climb for 200 yards or so then the trail sorta ends"
126,2017-10-30,[''],"Great Trail! Beautiful all year long, and never ceases to leave you winded on the uphill!!
One thing to note, the trail head is no longer at the base of Berghalde Ln. It has been developed, and Berghadle Ln no longer exists. You must park and the bottom of Canyon Winds Lane and walk up the road in order to access the trail head."
127,2017-10-16,[''],gorgeous
128,2017-10-06,[''],Amazing trail!
129,2017-08-19,[''],Not as scenic as I thought. Usually see at least 1 rattlesnakes when I hike the trail.
130,2017-08-07,[''],"Awesome summer hike to a hidden waterfall! My GPS clocked the distance at only 2.7 miles RT, but it's a nice little hike for after work or a quick weekend getaway. The waterfall is lovely, and cold. Just what you need when it's oppressively hot in the valley. I did see two Rattlers on this trail --both were quote big."
131,2017-07-31,['hiking'],Such a beautiful hike! We went early in the morning and didn't see any rattle snakes however we were extra cautious on the boulders. Its fairly steep here and there but overall not a strenuous hike. One of my new favorites!
132,2017-07-22,[''],waterfall is a nice treat on a hot day
133,2017-07-13,['hiking'],Need to finish this one!
134,2017-07-12,['hiking'],Awesome hike! it starts out pretty moderate and gets tougher the further you go up. Watch your step though I had to avoid a small Rattler this morning.
135,2017-07-07,['hiking'],"Too bad their isn't an option to have 6 stars because this hike definitely deserves it. This is my all time favorite hike in the Wasatch Mountains, it is so incredibly beautiful it cannot be described. It's only steep in a few spots but for the most part pretty easy. I have done hiked it about 10 times and don't get bored of it. There's a cave and a water fall and plenty of gorgeous views!"
136,2017-07-01,['hiking'],"Really great hike. was beautiful in the morning,  lots of shaded trail. Just a bit of mild rock scrambling just before you can get to the waterfall. Steep enough to get your heart rate up a little but also pretty enough to take slow if you need or want too. Loved it. plan on doing it again soon!"
137,2017-06-30,['hiking'],I enjoyed this trail tremendously. Three of us went about 6:00 am and it was very pleasant. You can take dogs but near the waterfall it is a bit of scrambling rock to rock. A dog may or may not have a little trouble there. we did see a dead snake as well they are in the area but don't seem to be a deterrent but merely something of which to be cognizant.
138,2017-06-07,[''],"Great follow the carn dog trail, gets steep after the waterfall. It's mostly shaded with a nice stream at least in early summer."
139,2017-06-05,['hiking'],"Beautiful and diverse. Trail is easy to follow, even past the rock field for a ways if you can follow the cairns. As you keep going after the rock field the trail seems to taper off, at least for what AllTrails marks as where the trails goes. Saw a rattlesnake directly on the trail as I was coming down, me and another guy had to coax it off, be very careful on this trail!"
140,2017-06-02,[''],"It was beautiful, but a rattlesnake was waiting for us at the top!"
141,2017-05-27,[''],
142,2017-05-25,['hiking'],Cairns mark the way.  Except near end.  Not sure if we made it or not.  Either way it was cool.
143,2017-05-22,['hiking'],The end was a little sketchy with the scrambling on the boulders but it was a great hike.  My 8 year old daughter loved it.  It took us 3 hours.
144,2017-05-17,['walking'],Good spot.
145,2017-05-14,[''],Wild flowers are plentiful right now. Mostly shaded. Some water on trail but not much mud.
146,2017-05-14,['hiking'],Just did this trail yesterday and loved it. Flowers are starting to pop up and the entire trail is covered in green. The trails is a little slippery on the way down.
147,2017-05-03,['hiking'],great hike for dogs. Lots of really diverse terrain. Different spots to explore.
148,2017-04-30,['backpacking'],Also great for dogs
149,2017-04-19,[''],Attempted to do this hike with my dog but it is not clearly marked so I turned around due to time. Might be a nice hike all the way up but I am an inexperienced hiker and did not want to go off trail
150,2017-04-12,[''],"This was my first time hiking this trail. You have to park at the bottom of the neighborhood and walk to the hike, which is along someone's house, and the trail begins. It was a super nice day, about 70 degrees, beginning of April, but the hike was a little rough since the trees were still dead, it got pretty hot. I wouldn't rate this as hard, more moderate (just because of the heat, there is an incline but it's doable) 

 My dogs loved it, especially since there was a creek they got to play in the whole way up. Once you reach the top you have to climb across some boulders to get too the waterfall. I brought along rain boots so I could walk closer to the waterfall and enjoy it with out the freezing cold water. I would recommend this hike!"
151,2017-03-27,[''],Barely any snow left! Check out the cool cave about a mile up on the left of the trail. Visible from the trail. Steady incline the entire trail - pace yourself.
152,2016-09-22,['hiking'],"Did this hike September 20th. The trail was easy to follow all the way. Steady incline all the way up with awesome boulders to cross at one point. A couple areas have loose rocks & dirt so hiking shoes are much better than tennis shoes. Beautiful fall colors & views of the valley. The stream was just a trickle, will be nice to try next year earlier in the season to see the water. Really enjoyed the hike!"
153,2016-08-20,[''],"Sara Gibson was right! This hike was a nice, short, challenging hike."
154,2016-07-26,['hiking'],"Another steep canyon hike. We tackled this hike in Mid June, as the plants grow it can get a little overgrown. It is shaded! Follows a small stream. Dogs are allowed. It is difficult going up and down with areas of gravel and lose dirt. It is tricky to find the start point as the trail head begins between two homes. A great after work hike during the summer."
155,2016-07-20,['hiking'],"Nice hike.  Strenuous for 11, 9 and 6 yo but they enjoyed it."
156,2016-07-17,['hiking'],The trail has a nice steady incline but gets very overgrown in places which wasnt very pleasant.  Might be better in the Fall when the vegetation gets less.  The stream alongside was great.
157,2016-07-06,['hiking'],Nice trail relatively Steepwith lots of vegetation and a beautiful waterfall near the top
158,2016-07-02,['hiking'],"Today, July 2, we saw a lot of butterflies and pill bugs. Luckily we didn't see any snakes and there were plenty wild raspberries, birds and squirrels, but not many flowers.
I recommend wearing long pants and long sleeves. This trial is a bit over grown and if you don't recognize poison oak or poison ivy, it might behoove you to take this precaution. 
The trail is a steady incline, I'm a little overweight but it's doable. I also saw some older ladies 50-60s. It's kid friendly for 7+ and up.
Note, leave no trace. If you or your dog make a potty stop, pick up, clean up, carry out....including tissue paper ladies!!
Happy hiking!!!"
159,2016-07-01,['hiking'],Beautiful. Steady incline on the way in but nothing too intimidating. Some bouldering  over rocks and you're suprised by a really incredible view.
160,2016-06-16,[''],"The hike was beautiful and following the brook the whole time was great! A bit steep but doable. We got lost and didn't see the waterfall destination on the way up because the trail continues, so I wanted to write this to make sure no one else does this (we weren't the only ones on the trail that kept going thinking there was more). You will cross the stream in 2 places, and the 2nd crossing has a little bridge. Shortly after this you will come to a boulder field, and the waterfall is on your right! Stay low on the boulder field until you run into a rock wall, and shimmy across that rock wall along the stream to get to the base of the waterfall! If you keep going you can climb all the way up to mount Olympus on this trail, although this is the difficult way up!"
161,2016-06-15,['backpacking'],Chill hike and beautiful scenery
162,2016-06-12,['hiking'],"Great hike: shade most of the way, aromatic wildflowers, a brook running along whole trail, very few people, beautiful waterfall at end."
163,2016-06-06,['hiking'],This hike was so beautiful. It was a bit hard at the beginning but once you get going it's fine. There was plenty of shade which was nice because we went during the day. There are some beautiful waterfalls.
164,2016-06-04,['hiking'],"This hike is beautiful. Mostly shaded the entire way. It is however steep the whole way and super steep in spots. To get to the actual waterfall there's a scramble over boulders to see it. You'll want to stay low on the boulders for easiest access.  The fall itself is beautiful!

All in all, the end result is an amazing reward to this hike!"
165,2016-06-04,[''],Good Hike. Not many people in it either. It is a steep hike for most of it.
166,2016-05-31,['hiking'],"At first when I read it's ""hard"" I kind of laughed, oh boy was I wrong! Even though it's not that long it's has incline the minute you get on the trail. I'm not the most active person though, maybe this will be moderate to some. I just kept wishing after one hill, after thee other it would get easier and flat for me to catch my breath. So do prep for this hike! It's nice, and shaded for the most part. Nice creek along the side.

It does get a little confusing when you get to the boulders, there is a path for you to actually see the waterfall up close. you have to get close to the bottom and when you hit into the biggest rock next to the waterfall there's a small pathway to walk through and see the waterfall. I hope that makes sense."
167,2016-05-30,[''],"This is a very kid friendly hike and it is quite lush and green this time of year. some pretty flowers, a couple of stream crossings and little waterfalls. We came across a rattlesnake who was very quick to let us know we were near."
168,2016-05-30,[''],"Nice short, but gets you sweating, hike! The waterfall at the end is worth it!"
169,2016-05-24,['hiking'],Love this hike.
170,2016-05-20,['hiking'],Steep and shaded with a waterfall at the end. Dogs allowed and fun things to see along the way.
171,2016-05-16,[''],Loved this trail! Absolutely breathtaking.
172,2016-05-12,['hiking'],"Great Hike! We had kids as young as 7 up there and it went great. Push through the Bolder Field to see the waterfall, it's worth it!"
173,2016-04-28,['hiking'],Love the waterfall!
174,2016-04-20,['hiking'],Where is parking if you want to do this trail?
175,2016-04-17,['trail running'],"Cute little trail with a good mix of sun and shade.  The 3.2 miles is round trip so just over 1.5 miles upwards climb.  The first half of the upwards follows the stream which is pretty and nice to listen to. You cross over twice, once on some logs, again on a small bridge.  You cross two rock slide areas.  The first is large rocks and the trail continues just a little higher up from where you entered.  The second is smaller rocks and dodgier.  Just pass the second rock slide is a small grassy opening / overlook.  I kept going and do not recommend it.  I'm sure its possible but the only ""trail"" options I saw were steep strong brush with loose dirt or steep small unstable rocks in the slide.  And yes, do not let the ""private drive"", ""no unauthorized vehicles"", ""no parking"" signs or the car purposely parked to block you, discourage you from checking it out."
176,2016-04-11,['hiking'],"Nice trail with plenty of things to see along the way like caves, huts and wild flowers. Moderately steep climb so bring hydration and proper footwear."
177,2016-03-20,[''],"It was beautiful out today! Went in the afternoon, not too many people. You can go past all the rocks at what seems like the end and check out more trail, see the waterfall, take in the views! It was a fun outing!"
178,2015-11-07,['hiking'],As mention previously the trail starts up a driveway. Its a very good trail for most of the 2 miles up. There are a couple of rock slides where finding the trail on the other side takes a few extra minutes. 2 miles in the trail climbs steeply and becomes difficult to follow. We ran out of time so we were not able to determine it the trail continued any further. Started at first light so we watched the sun hit the Oquirrh Mountains and creep  across the valley
179,2015-05-04,['hiking'],"Trailhead access does feel dodgy, as you're walking over that driveway to get to it. 
In recent years, poison ivy has taken over almost the entire trail. Two years ago, there were little patches of it, but last year in September, it was thick! I'd never been susceptible to urushiol before, but it got me that time. I like this hike a lot, but won't do it again because of the poison ivy.

It's pretty consistently steep and shaded, with great views of the rocks and valley once you get higher up. Above the talus field is a lovely resting spot with a waterfall, fire spot, and lots of flat ground to sprawl out on. Higher up, the trail peters out, but you can bushwhack and get a lot higher if you want to.
It's generally very sparsely populated with people, which is a good thing."
180,2015-04-30,[''],"Amazing variety of landscape! A couple of springs (but very muddy water so I wouldn't try drinking it), a cave, a waterfall, wild flowers, good views all the way up. It's an awesome afternoon hike. My dad was the architect for the house at the trailhead so he was the one that suggested it to me. #barosdesign lol. Amazing hike"
