,Date,Tags,Comments
0,2019-09-07,['hiking'],finding the trailhead was a pain.  had to walk up a driveway to get to the trail.  otherwise the trail was nice.  pretty crowded. 
1,2019-09-05,"['hiking', 'rocky']",Trail was in excellent condition although a bit tricky to find trail head as you first need to walk through a neighbor. You’ve got cross a steep hill covered on boulders towards the end too. Doable but just be aware. 
2,2019-08-25,"['hiking', 'bugs', 'rocky']","I hiked this trail today (8/25/2019) with my dog. I was a bit hesitant to go because of all the recent snake sightings, but I've hiked this trail a handful of times and never once saw a snake.
We started at 7:40am and got back to the car by 10:30am (we hiked at a slow pace and relaxed at the top for quite some time), no snakes in sight!
I'd recommend bringing bug spray, especially if you plan on taking breaks on the way up to the waterfall. The waterfall was weak compared to a few months ago, but the hike overall was very nice!
"
3,2019-08-25,['hiking'],look out for rattlesnakes and thirsty yellow jackets
4,2019-08-25,['hiking'],"I’d definitely recommend only doing it when there’s still snow runoff, if your goal is to see the waterfall. "
5,2019-08-24,['hiking'],"Saw three snakes yesterday on our hike. Started the hike around 5 pm. One rather large snake (likely a bull snake) hidden in the rock field towards the end and two rattle snakes on the trail that rattled at us and one wouldn’t let us pass so we ended up turning around. With this level of snake sighting directly on the trail, probably won’t be back."
6,2019-08-23,['hiking'],"We parked at the parking lot by the main road. Not clear where the trailhead starts. You have to walk through a neighborhood before starting the trail. Enjoyed the hike, however, it has some steep parts. We also ran into a coiled rattlesnake. It was decently big. Met a couple of other hikers who also encountered a rattlesnake. Be aware, especially if you bring dogs. "
7,2019-08-17,['hiking'],"It was a great hike, except for the snake on the trail. I will do it again,  but be more aware of snakes.  
"
8,2019-08-02,"['hiking', 'bugs', 'scramble']","Went up in the morning with my kelpie and we heard a bigger animal, totally freaked my dog out, and me!! Full mohawk, barking and whimpering. I slowly backed away going back down. Stay safe y'all carry bear spray it protects against all mammals. I think it might have been a mountain lion."
9,2019-08-01,['hiking'],"Definitely better in the spring. The waterfall is only a trickle now. Lots of wasps by the water. Raspberry bushes are big. Still very green above the waterfall. No one on the trail today but me. Watch out for snakes: most people mistake the gopher snake for a rattlesnake which isn’t a bad thing but all the reviews make it sound like there are rattlesnakes around every corner. I’ve done this trail dozens of times and never seen a rattlesnake, not to say they aren’t there but I think most people assume it’s a rattlesnake. I’ve seen them in the grass and they always scurry off when I go by. GPS seems to have trouble with accuracy in this canyon but the trail is easy to follow."
10,2019-07-29,['hiking'],Great trail for dogs due to the multiple river crossings. A lot of shade depending on the time of the day. Nice little waterfall. House at the Trailhead sometimes has a 'dog poop' bucket for you on the way down. 
11,2019-07-25,"['hiking', 'bugs', 'rocky', 'scramble']","We didn’t get to finish because at the boulder part, me and my 12&11 yr old ran into two rattlesnakes... bummer. I’d say I’m in good shape, and this was a lovely challenge. Little much for my kids, but I would like to do it again. Lots of water and bug spray is a good idea."
12,2019-07-24,"['hiking', 'bugs', 'rocky']",This hike was a really fun one.  Not steep really at all but make sure you have water. And be weary of rattlesnakes.  My friends and I saw two on the trail so that made for an interesting rest of the hike.
13,2019-07-23,"['hiking', 'over grown', 'scramble']","From the parking lot, to the waterfall and back was a steep 3.5 miles. We got directions from the parking lot to the trailhead from the Girl on a Hike blog. 
Once we got to the boulder field we had a hard time finding the falls, so I uploaded some photos that should be helpful to figure hikers!
You’ll want bug spray! "
14,2019-07-21,"['hiking', 'bugs', 'rocky', 'scramble']","I was a bit worried for this hike because it was my first in a few years, but I genuinely enjoyed it! The parking is on Wasatch Boulevard, you can navigate to it through google and then it’s up into the neighborhood, a left on Oak Canyon Dr, right on Canyon Winds Ln, and all the way up. You pretty much have to walk through the house at the end’s driveway, but that is in fact the trailhead (it isn’t marked, that I saw). We luckily had a nice mailman making his rounds to help us out.
The trail itself is paved pretty well, though the dirt does get slippery the steeper it gets. The entire hike is pretty much an incline, and as you go further the trail gets more narrow and more steep. I would definitely recommend having a walking stick or trekking pole, both to stabilize yourself toward the end, and to rustle the brush for snakes. We didn’t see any, but I was making a LOT of noise to avoid it thanks to the other reviews.
And if you have a bee allergy, please be cautious and bring your Epi pen! There were several spots where we had to walk through swarms of wasps because there was water on the trail. We didn’t get stung, they minded their own business and let us pass as long as we didn’t linger, but I would still be careful!
And for dogs and small kids, please be aware that to GET to the water, you have to scale across the red rocks that a lot of people have posted pictures of, so I’d be cautious if you can’t carry them and they don’t have sure footing. Bring plenty of water in case you can’t get to the falls because that obstacle is right at the end. We passed a lot of tired dog owners on our way back down who asked us if they were close because their pup was hot.
Once you get across to the lower part of the trail, you go through a tunnel made by the trees and the grotto there is tiny but beautiful and shaded. It was clean and quiet, and really refreshing after the climb.
My only trouble was that we didn’t finish the hike, I assume you had to climb up the rocks instead of across to get to the last .2 miles of the hike but I’m not sure. Either way, if I went back I think I would want to try to complete it and see what else there was to experience."
15,2019-07-20,"['hiking', 'bugs']","It’s hard to get to the actual trail, I recommend reading the site girl on a hike dot com to actually see how to get there. It’s nice, shaded and not crowded. It gets pretty steep and bring bug spray!! I didn’t make it to the waterfall because I had my pup and I was scared of sliding down the gravel "
16,2019-07-17,"['hiking', 'bugs', 'rocky']",
17,2019-07-12,['hiking'],"This trail has a lot of shade and is so pretty. The trail follows a stream that is pretty swift so keep a good eye on your little ones! I only hike up to the big rock pile, sit on a rock and eat a snack or look at the valley. I am not advanced (or adventurous) enough to scale them and go to the waterfall. There is not a lot of parking so I'm not sure where you are allowed to park on a busy day. "
18,2019-07-12,['hiking'],Could never find the entrance to the trail head very disappointing as I was looking forward to this hike with my dog after work if anyone has better directions that would be great I parked where it said trail head parking and water at all it through the neighborhoods and never found a marked or else
19,2019-07-06,['hiking'],"Fantastic option for a steep that is mostly shaded. The stream is really running strong but the main waterfall was covered by the vegetation this year. The trail continues across the rock slide but then it became way too overgrown to continue to the very end, especially with the rattlesnake sightings.  "
20,2019-07-05,['hiking'],Super awesome. Really steep for a good incline most of the hike. But I saw kids and other younger kids doing it. It definitely wasn’t an easy hike. The waterfall is small...but cool I guess. Fun hike! 
21,2019-07-01,['hiking'],Dang that hike did not disappoint. The first half was “eh” then all of a sudden boom there is the river and the waterfall was gorgeous! Wasn’t expecting how pretty it was going to be. Then if you keep going up past the waterfall...the vegetation gets thicker and thicker...and it was gorgeous! Highly recommend....it’s pretty steep at points...so you have to work for it...but it’s worth it! Bugs kind of sucked..so be prepared for that. And WATCH OUT for rattlesnakes. Saw one on the way up and he wouldn’t move off the trail. So be careful! All in all...great hike! 
22,2019-06-30,"['hiking', 'private property', 'rocky', 'scramble']",
23,2019-06-29,"['hiking', 'bugs']","Amazing hike, bumped into a baby rattle on the way up and turned back. Can’t wait to come back!"
24,2019-06-29,"['hiking', 'scramble']","Hike to the lower falls is worth the climb, you get to this about 1.5miles up and there is a rock scramble (as others have said) to actually view the falls.

From there we went all the way to the top (and end of the red all trails line) and it gets steep with a lot of loose rock and I would call fully difficult.  I had a single pole and that was invaluable.  This part of the hike I would recommend two poles.  The view at the top is good for the valley but we couldn't see the waterfall only hear it through the foliage"
25,2019-06-27,"['hiking', 'rocky']",
26,2019-06-27,"['hiking', 'over grown']","It is a short but intense route, the slope increases little by little, the final section has large rocks that cover the path to the waterfall, if you want to go to the waterfall be careful when crossing over the rocks"
27,2019-06-27,['hiking'],"I love this trail. It’s weird because you almost have to walk up someone ms driveway to get to it, but it seems to be legal! It’s fairly steep, but really beautiful. Nice workout and the falls are amazing!"
28,2019-06-22,['hiking'],Great short trail for a good little work out. Beautiful views. Be aware of the Poison Ivy at the bottom. Stay on the trail and you should be fine. 
29,2019-06-21,"['hiking', 'bugs']",Solid uphill hike that is fairly shaded. Careful with dogs as we saw 2 snakes on the trail. 
30,2019-06-21,"['hiking', 'rocky']",Amazing hike! To get to the actual trail head you have to park at the designated parking area and walk up into a residential area and into a drive way. Lots of tree coverage and streams. The trail gets steep towards the end but the view is totally worth it!
31,2019-06-20,"['hiking', 'bugs', 'rocky', 'scramble']","Seems a bit on the hard side of ""moderate"" due to how steep it is, the loose gravel, and the scrambling.  Still, it's a nice and challenging hike."
32,2019-06-16,"['hiking', 'rocky', 'scramble']",Great uphill hike. The landslide of rocks was fun to climb. Found the trail on the other side. There is a lot of green vegetation which made it difficult to see the falls at the end of the trail. 
33,2019-06-15,"['hiking', 'rocky', 'scramble']","Lots of shade, gets steep at times. We weren't able to find the trail to the waterfall, and the last part of the trail was not marked very well. Would recommend not following it all the way up the path that AllTrails gives."
34,2019-06-12,['hiking'],"Good evening hike, lots of vegetation"
35,2019-06-09,['hiking'],Just decided to record above the falls today
36,2019-06-09,['hiking'],this is a slightly steep trail the last part of the ascent is steep with loose gravel which is slippery going down.
37,2019-06-09,"['hiking', 'scramble']","It was an uphill hike the whole way, however, it was beautiful and worth the time! We were warned about poison ivy but never ran into any. "
38,2019-06-08,"['hiking', 'rocky', 'scramble']","The walk from the parking on Wasatch Blvd to the trailhead is pretty characteristic of the average steepness of the trail. We just hiked to the waterfall next to the big scramble/bouldering section. As someone who goes pretty slow, this hike took me about three hours."
39,2019-06-08,"['hiking', 'bugs', 'rocky', 'scramble']","It was amazing, the trail was a little narrow. Lots of flies buzzing around. A steep incline the whole time. Very rocky, hearing the water coming down was amazing to hear."
40,2019-06-06,"['hiking', 'bugs', 'muddy', 'private property', 'scramble']","A nice, steep trail with lots of loose rocks in a quiet neighborhood- the waterfall at the top was our payoff. 

The trailhead is indeed down in the neighborhood as there are several No Parking signs along the street adjacent to the entry into the canyon.  I was surprised at the number of hikers for a Wednesday night.  With with high water year, the stream seemed fast and high but not overly dangerous. The water often spills out onto the trail in a few spots but nothing a tall pair of boots can’t wade through or some creative jumping can’t solve.  We were swarmed with mosquitos at the top at dusk.  I’m guessing there’s standing water areas under the talus field at the top. Great views as you descend too.  Hiking poles for the downhill hike would have been helpful."
41,2019-06-03,"['hiking', 'bugs']",Gets a bit overgrown and much more slippery past the rocky area.
42,2019-06-02,"['rocky', 'scramble']","this is a great hike.  After the second bridge there are two rock scrambles that you have to do.  The first waterfall is visible from the top of the first scramble.  To get to the second you have to go up the second rock scramble and take the trail to the right.  It's not all the way to the top but is easy to see as you go up the right side.  Follow that trail around to include a couple steep climbs and you'll find it at the very end.  The trail literally ends at a large rock wall but the waterfall is visible in the distance.  While not an easy hike it's worth the effort.  bri g trekking poles though, you'll need them.  Also, you see phrase scramble several times but really it's where there was a landslide and you are picking your way through the rocks to get back on the trail.  "
43,2019-06-02,"['hiking', 'muddy', 'rocky']",
44,2019-06-02,['hiking'],Beautiful hike! There is plenty of shade and water next to you throughout the hike. 
45,2019-06-02,['hiking'],Beautiful this time of year. Lots of water in the waterfall and super green in the canyon. 
46,2019-06-01,['hiking'],"The hike is relatively moderate, once cross the second bridge its gets steep for 400 feet or so scramble across the boulders and check out the waterfall. Keep right and hike up the boulders and the trail picks back up . But be warned it gets incredibly steep about a half mile up . Poles will be required "
47,2019-05-31,['hiking'],"beautiful hike! the trail was amazing. my 10, 7, and 5 Year old were able to make it up and back 2 miles. "
48,2019-05-30,"['hiking', 'rocky']",
49,2019-05-27,['hiking'],"Beautiful hike, the waterfall is beautiful"
50,2019-05-25,['hiking'],"I’d rate this hike as hard instead of moderate. The last part was particularly steep on the way up and there were lots of loose rocks on the way down. Very pretty hike, though, and the views of the waterfall and of the valley were great!"
51,2019-05-25,['hiking'],This trail was great! Lots of uphill action. We didn’t see any rattlers to be afraid of. A few rock scrambles. This is a great hike! Definitely recommend!
52,2019-05-25,[''],"Looks like many who left reviews never made it to end of trail, its deceiving when you reach where trail stops at a bunch big rocks, but if you go across and up the trail picks back up, gets steep and difficult when snow/muddy. If you make up there you will find the other waterfall and beautiful views, at right time a day you can almost touch the clouds. Was great!"
53,2019-05-20,['hiking'],Fun trail. Not too steep or far and great views at the end. We did see a rattlesnake right next to the trail about 10 minutes in. 
54,2019-05-20,['hiking'],"Awesome right now, really green everywhere."
55,2019-05-19,['hiking'],"Gorgeous! The trail was fun and by the river the whole time! There is dedicated parking off the trail which is nice but walking up the neighborhood is a bit annoying. I recommend NOT going to the second waterfall. We tried to find it and couldn’t. If anything go up passed the main one and go down a bit off the trail, you’ll see a smaller pretty waterfall. But I didn’t see anything beyond that. It was mostly overgrown "
56,2019-05-19,"['hiking', 'scramble']","Really pretty, moderate hike. Mostly shaded. Nice waterfall. Slight rock scramble at the top for a nice view. "
57,2019-05-18,"['hiking', 'over grown', 'rocky']","Gametrail!!!  We loved it, and were rewarded with great views and waterfalls!!!"
58,2019-05-16,"['hiking', 'muddy', 'off trail', 'rocky', 'scramble']",Amazing but wet and rattled snakes.
59,2019-05-13,['hiking'],This is a shady trail with a creek along side the entire time. It’s a bit steep going up in parts but has great views and worth your time.
60,2019-05-12,['hiking'],"Great hike along the water. The dogs love that for cooling off and I love it for the sound! I thought I would update the directions to the trail head since it’s not intuitive and past instructions were from the old parking area. After parking on Wasatch, head Straight up Canyon Cove (don’t turn right on Hughes Canyon Dr), left at Oak Canyon, right at Canyon Winds lane and walk straight until you head up someone’s driveway and you will see the trailhead."
61,2019-05-11,"['hiking', 'rocky']",
62,2019-05-10,"['hiking', 'rocky', 'scramble']",
63,2019-05-10,['hiking'],Really pretty trail and no snow. It felt a little more difficult than moderate but was still an enjoyable experience
64,2019-05-06,"['hiking', 'no shade', 'rocky', 'scramble']","Slight rock scramble to see view of waterfall and valley, not a lot of shaded areas, remember there is quite a bit of elevation gain in only 1.75 miles making this a slightly more difficult hike. Recommend bug spray and sunscreen always! Please respect neighborhood and park in designated spots out of the neighborhood, it’s not long at all to walk to the actual trailhead."
65,2019-05-06,"['hiking', 'bugs']","Great daytime hike! No snow, plenty of shade, and great photo ops! Somehow we lost the trail about midway, so we ended up at a bunch of walks overlooking the waterfall. That was a well-worn trail too, so maybe this happens to lots of people? Definitely worth an afternoon!"
66,2019-05-06,['hiking'],5/5 awesome trail! Not too busy on a Sunday afternoon. I found the trail that continues upward past the first waterfall. You have to climb further up through the rocks but you will eventually see the trail pick up. The trail gets steeper and unclear at some points but you will know you’ve made it once you start to see the flowers blooming. Beautiful view!
67,2019-05-05,['hiking'],Always a favorite quickie
68,2019-05-05,['hiking'],A great time to hike this trail. Butterflies everywhere. Everything is blooming.
69,2019-04-29,[''],Nice hike. Wasn't too busy earlier in the morning.
70,2019-04-29,['hiking'],"This one was an interesting hike. It starts at the parking lot then a climb through a neighborhood before getting to the trail. The trail is pretty sweet because there is a break off for the BST and then one for Heugh’s canyon. Our map on all trails said it was 3.5 and 1942 in elevation. Once we got to the main lookout (waterfall) we had hit about 2 miles and only 1200 ish feet so we knew there was more. . . So we kept going.. honestly if you do it I wouldn’t suggest going higher (unless you know where to go) the trail kind of gets lost and I didn’t see much of another *feature* of the hike other than more of the beautiful spring nature. Also your feet are most likely to get wet at this time of year, the trail follows the stream most of the way and it’s on the trail some of the way. Overall glad I got out and checked out the sweet waterfall and got to see some of my friends."
71,2019-04-26,"['hiking', 'rocky']","Super fantastic trail! I did not see in the comments that the trail is through a neighborhood. You’ll park before entering the neighborhood. Follow the water by taking a left and the a right. You’ll see a black driveway ahead with the trail. You’re hiking along water the entire time. Also, some parts you’re hiking in the water so wear good shoes. My dogs did incredible as well!"
72,2019-04-24,"['hiking', 'rocky']",4/23/2019 went up the trail in the evening and ended just at dark. What a great trail with flowing water and amazing outdoor views!! Had so much fun
73,2019-04-23,"['hiking', 'off trail', 'rocky', 'scramble']","Seems like not many folks go past the first rock pile/waterfall. A bit after that the trail is not so clear but after some backtracking, an edge-of cliff -walk, and what I would almost call climbing...we made it to the end (and boy was there a view! And a second waterfall) We definitely didn’t get to the end by following the red trail line, but tried to follow that on the way back and there are way too many loose rocks that it was quite dangerous up top. Made the cliff edge walk seem like the better way up/down the last bit. Great hike with lots of water and flowers this time of year. Very Friendly neighbors that we chatted with along the way."
74,2019-04-23,['hiking'],"Great conditions on 4/22. No snow. Some small stream crossings on trail. The waterfall is nice and full! Trout lilies in full bloom. A little tricky to find, no signs after parking lot on Wasatch Blvd. a friendly man in the neighborhood directed us where to go. You do have to cross what seems to be a private drive to start the trail."
75,2019-04-09,"['hiking', 'muddy', 'rocky']","Great hike! A little bit of a pain to get to at the beginning, but once you’re on the trail, it gets good! The creek is running pretty high as of 4/8/19 so there is some water spilling onto the trail at parts. You can only get about a 1/4 mile above the waterfall before you run into thick snow."
76,2019-04-06,"['hiking', 'snow']",This trail is beautiful. You hike along a creek most of the way. You pass two bridges and a boulder field with a waterfall and valley view. The trail today was a little damp with some areas where the creek is flowing over the trail. But overall easy to navigate through. There was some snow that prevented me from getting to the very top but I was close.
77,2019-04-05,['hiking'],"Just writing to say it’s pretty clear. There’s about 50 yds of snow past the first bridge, but then it clears up. About 1.5 mi up today the snow begins to cover most of the lay and ability to visually track the trail. Still beautiful waterfall and river for 90% of hike."
78,2019-03-31,['hiking'],Really beautiful views! Snows starting to melt so watch for water and maybe pack Yaks since the tops still a little slick.
79,2019-03-31,['hiking'],"Great hike. Very little snow, but you walk across a few streams so make sure you can keep your feet dry."
80,2019-03-26,['hiking'],Great little trail. I don’t mind walking through the neighborhood to get to it. Just follow the red line and you’ll be fine. Got about 1/4 mile past the falls but had to turn around cause I was sinking into the snow too much. Definitely coming back.
81,2019-03-21,['hiking'],As of 3/21 definitely still some snow about half way up but I didn’t need (or bring) my spikes. One iffy crossing of the creek but a makeshift bridge (3 small logs) gets you by.
82,2019-02-24,['hiking'],"Fun hike steep at the end, recorded 5.6 miles"
83,2019-02-12,"['hiking', 'private property', 'rocky', 'snow']",
84,2019-02-10,['hiking'],"Awesome little secret side canyon!!! This was such a fun exploration (especially in the winter). 

Just park on Wasatch Blvd just outside of that neighborhood and walk through it. 

You will need to walk on some dude's driveway (not illegal) in order to get there, but don't let that deter you! 

Keep on going past you the trail will soon come into view. 

This trail was beautiful and secluded. 

Got to the waterfall and the busted out the snowshoes to climb up another 1000 feet or so. 

Decided to turn back, but would want to come back this Summer or with a team of others and see how high we could get while being safe and cognizant of avalanches ...."
85,2019-01-21,['hiking'],"The only thing ""hard"" about this trail is finding it: navigating the 1/4 mile from the handful of parking spaces on Wasatch without any signage until you find the unmarked trailhead in a side cul de sac.

From there, it is lovely and moderate at best.  Trees/shade + streams/water are hard to find outside the watershed.  Apparently no one else was able to find the trail while I was up there, and I had it to myself.  It is not as steep or as exposed as Mt. Olympus.

It is frustrating to feel like a neighborhood is trying to keep a public trail from the public.  Once parked, I saw no signs (sorry to the person whose yard I traipsed through....I naively thought ""trailhead parking"" meant the trailhead was actually nearby).  The actual trailhead was up a private-ish road at the end of what totally felt like a private drive (maybe I actually traipsed through 2 people's yards?).  There was a big sign advertising property for sale at the trail, but no sign telling me I had arrived.  Although my dog and I enjoyed the 1/2 mile RT stroll on pavement through the neighborhood just to get to the trail (sarcasm), I can't imagine this is the best way to keep people from (gasp!) parking on the street in your neighborhood to go play in OUR backyard.

To everyone else, please enjoy this lovely trail!"
