,Date,Tags,Comments
105,2019-05-16,"['hiking', 'muddy']","This hike is definitely a favorite of our family, dogs included.  Today the trails were super muddy and we were not able to make it to the falls. Fairly certain it will dry up fast but giving a heads up for those heading there the next several days."
106,2019-05-13,['hiking'],"Completely amazing! To get close to the water falls be sure to turn LEFT about 10 yards from the sign you encounter an hour from the trailhead!
"
107,2019-05-13,"['hiking', 'muddy']","I can't believe I haven't hit this hike before. The whole hike was gorgeous, and the falls were stellar. So beautiful. There was a little mud, but we managed to avoid most of it. Lots of it was shaded which was nice since we went late morning."
108,2019-05-12,['hiking'],this is one of my favorite waterfall hikes in the Wasatch area. this time of year will be free of snow but have a little mud and lots of water at the falls.
109,2019-05-12,['hiking'],Fairly steep hike... last the majority of the trail still a bit of snow and some stream hopping... definitely worth the effort especially at this time of year with the winter run off making the waterfall rage!!!
110,2019-05-12,['hiking'],"Falls are raging at the moment. Trail is good, with some smaller streams to walk through on the way up "
111,2019-05-12,['hiking'],"Now is the perfect time to hike this trail. Mostly shaded and dry. Some mud and water trickling down the trail near the falls, but lots of rocks to step on to stay mostly dry. We slopped right through in our hiking boots, no problem. At 2 miles, turn left at the sign and another sharp left at the drop off. There’s a knotted rope to help you down."
112,2019-05-12,"['hiking', 'muddy', 'rocky']","Loved this!!! Totally lived up to they hype. Great views the whole way up, about 50-60% shade on the way up, and many water crossings. Muddy towards the top, basically snow-free as of May 12. Small parking lot at the trailhead, there were 2 spots open when I arrived at 4:30 p.m. on Sunday. Definitely familiarize yourself with the map beforehand... there are a lot of side trails that are misleading and I missed the turnoff for the falls. I met 4 other folks on the trail who did the same thing. As soon as you see the wooden sign towards the top, turn onto the small side trail to the left.. look for the small black rope tied to a tree trunk that will help you down onto the side trail to the falls. Took me 3 hours rt with lots of stops."
113,2019-05-11,"['hiking', 'muddy']",
114,2019-05-11,['hiking'],Did this yesterday 5/10/19. Awesome spring hike. Waterfall is raging. 
115,2019-05-11,['hiking'],"Super steep trail for casual hikers, but gorgeous payout at the end when you see the falls. Highly recommend."
116,2019-05-11,['hiking'],Good if a little muddy. Fun hike!
117,2019-05-09,"['hiking', 'muddy']","One of my absolute favorite waterfall hikes in Utah county.  Right now the water is roaring and it's a sight to behold.   I ran this trail, but there's definitely some uphill that may challenge some younger hikers, but given extra time, doable.  At about 1.7 miles up, you end up crossing several streams and the trail itself becomes a creek but you can rock hop or walk the side without much trouble.  just make sure to watch for the drop off just beyond the trail side to the left to find the turn off to the waterfall."
118,2019-05-06,['snow'],
119,2019-05-03,"['hiking', 'muddy', 'rocky', 'snow']","Went with Talli! The waterfall was flowing so well, there was SO much water! Had to deal with some slippery snow but not too bad. Stream crossings were easy, and the payoff was incredible."
120,2019-05-02,"['hiking', 'muddy', 'snow']",
121,2019-04-29,"['hiking', 'snow']",Was a great hike yesterday. It is always one of my favorites. Ran into spotty snowpacks about half way up. The fall is spectacular right now.
122,2019-04-28,"['hiking', 'muddy', 'snow']",I hiked on 4/28/19 - the snow and mud started after the fist mile or so. This was a fun trail and the waterfall is woth seeing. I plan to do it again in a few months with my kids
123,2019-04-28,"['hiking', 'muddy', 'snow']","This was a fun trail. There aren't any signs that say Horsetail Falls trail, but it's up there. There is still snow on the trail, but I didn't need to use any spikes. The last part to the waterfall was confusing if you've never been there. There will be a fork at the end, go left. Off to the left of the trail there's a break in the trees/ bushes that takes you down a little ways onto a dense trail. You follow that to the waterfall. It is also really wet right now with the runoff."
124,2019-04-20,['hiking'],"Apr. 20, 2019. Fun, moderate hike to a gorgeous waterfall as well as a pretty great look out back on Lehi into the valley. The upper 2/3rds of this hike currently has a few feet left of packed down snow most of the way. Yaktrax are a nice addition but aren’t absolutely necessary. Not much to see along the way up, but towards the top it opens up for some views."
125,2019-04-20,['hiking'],"the lower third of the trail is dry but then there is a lot of snow and ice patches. If you are going past the meadow, you will want to have spikes."
126,2019-04-15,[''],"great hike mostly covered with snow, but not too slippery. loved the scenery!"
127,2019-04-07,"['walking', 'muddy', 'rocky', 'scramble', 'snow']","Beautiful hike. didn't make it past the meadow, though, as my dog decided to snorkel up snow and make herself ill. going to try again another time without the dog."
128,2019-04-07,['hiking'],Still need spikes but beautiful waterfall!
129,2019-03-09,"['hiking', 'snow']",
130,2019-03-07,"['hiking', 'snow']",
131,2019-02-27,"['hiking', 'snow']",
132,2019-02-24,"['hiking', 'snow']",
133,2019-02-18,[''],"A strenuous hike in places, especially the last 1/8 mi. or so. Beautiful view of falls. Watch for fork and stay left. Rope is tied to limbs on left side of trail shortly after taking fork and was in good condition earlier this season. I like to continue on falls trails (not descending on rope) another 25 + minutes and cross on logs suspended over Dry Cr. and return to trail head using trail on North side of creek."
134,2019-02-17,['hiking'],"The beginning of the trail is a little drab, but once you actually get into the canyon it’s really pretty. The snow is packed and easily accessible with spikes - icy in some areas from all the sledding on the trail. A bit annoying dodging all the sledders coming down while you’re trying to climb some of the steeper parts. Nice quick hike - takes about 45-60 min up at a moderate pace, 20 min down if jogging."
135,2019-01-30,['hiking'],"Hiked this morning with poles and Yaktrax, both were helpful. I think the difficulty level is neither moderate or hard, but somewhere in between. Saw only a few people. It was beautiful and the waterfall is worth the hike. If we had more time it would have been fun to pack lunch and eat at the waterfall."
136,2019-01-23,[''],"Lots of snow fell this week, so we spike hiked up the trail 1.5 miles. then sledded down. ideal conditions. highly recommend!!!"
137,2018-12-27,[''],I loved this hike. I went on a backpacking trip with some of my friends up here and about 10 minutes before getting to the waterfall there’s a little fire pit and a bunch of trees where you can set up a little camp and hang up hammocks. The view is beautiful and yes it was kinda hard carrying a bunch of your gear up the trail (because it’s just straight up) but it was so worth it. There’s little ponds that you can either look at or you can swim in (only if you like freezing cold water) but either than that it’s a great trail. It takes about 1-2 hours (depending on your pace) hiking up but walking back down feels like 10 minutes.
138,2018-12-18,['hiking'],"It was a gorgeous hike. Covered in packed snow for the majority of the way, so it got a little slick in some parts. I had a toddler on my back so that definitely made it tougher in the slick parts, if I were to do it in the snow again I wouldn’t take the kid. I ended up above the falls but I think there was probably some good views I missed out on below. The way to the falls wasn’t marked so that’s why it’s only 4 stars not 5 but I’m going to try again when there isn’t snow and see if it’s better."
139,2018-11-21,['hiking'],"This is rated ""HARD"" but find it to be intermediate; it shares the same trail for the Dry Creek Trail which is rated Intermediate.  Went Mid-November 2018 and it took about 2.5 hours with stops for pictures and taking in the views.  Trail was a mix of compacted dirt and some loose rocks so wear shoes with ankle support.  Trail was clear of snow and there was only one icy spot about 1/4 mile up past the trailcamp meadow.  I was easily able to walk through the brush and avoid it.  The dead horse is still on the left of the trail just past the post for the 046 trail (on the right).  The horse did not smell and was half buried, however my pup's nose had no trouble finding it.  Only docking because the signs for the falls didn't exist."
140,2018-11-10,[''],We went in November and the trail was rocky for a good portion of the trail and icy in a couple of spots but mostly dry. The falls leaves were mostly fallen. There was little to no signage to point us toward Horsetail Falls but we veered right at the first two forks and then went down a path to the Lower falls. Spectacular views and wonderful to see at dusk. It took us 2.5 hrs to go up and back.
141,2018-11-04,[''],"This is a beautiful trail (minus all the horse poop).  The signage to the waterfall could be improved!  It’s a steep climb but take your time, you will be be rewarded with nature beauty"
142,2018-11-01,[''],
143,2018-10-21,['hiking'],awesome hike! packed my 9month old and a bag with food and my tenkara fly rod. my wife had a little rough time but did great. The water shed has fish! wild brown trout. they loved the shop vac nymph.
144,2018-10-11,['hiking'],Love this hike. It’s awesome. The water slide at the end is cool too. Not sure why it’s rated hard though. This is moderate. Don’t be intimidated. It’s pretty trafficked though for sure. One of the best endings in my opinion. :)
145,2018-10-09,['hiking'],About 2 miles up when you approach the sign that points to the waterfall take a sharp left down onto the smaller trail. We thought it was telling us to go straight so we missed the turn off. Took a little over 2 hours round trip
146,2018-09-08,['hiking'],One of my favorite hikes in Utah County. I've probably hiked it 20 times. The Horsetail Falls are spectacular but you need to be very careful on the rock. It's incredibly slippery.
147,2018-09-03,['hiking'],"This is labeled an out and back, but more accurate is an up then down.  2 miles straight up with maybe 2 or 3 very short flat sections. 

Coming down is no picnic with old knees. "
148,2018-08-29,[''],"i love this trail but im currently in the hospital because of my last hike there with a broken femur and pelvis to not get into too much detail. the rock is extremely slippery. do no get close to edge if not secure, do not walk on wet rock if not secure. this is one of the most amazing hikes in my life but i almost died because i underestimated some slippery rock"
149,2018-08-29,[''],Great hike we did in 2016.  Can be strenuous for those not in shape.  Kids ages were from 8 to 13.  Go on the early summer when the waterfall is at its best!
150,2018-08-25,[''],Saturday hike was amazing.  A lot of hikers on the trail. Some of trail had water from recent rain   Falls were beautiful!
151,2018-08-20,[''],Beautiful hike. Hardly saw anyone else on trail. A bit confusing when you get closer to the waterfall but we were able to find a nice shady spot near the water.
152,2018-08-20,[''],"Great hike. Many trails, easy to get off on a different path"
153,2018-08-16,[''],LOVED this hike. Took about 2.5 hours round trip and it was so worth it.
154,2018-08-13,['hiking'],"This is an awesome trail for a quick hike. 

Anyone giving this a bad review probably just has a bad attitude. 

The falls are beautiful, and there are some great views. 

Sunday afternoon was a great time to do this. I only ran into a few people."
155,2018-08-12,[''],did this hike today. very steep in places very beautiful wooded hike with the sound of the river always near and the falls at the end was amazing. well worth the hike.
156,2018-08-02,['hiking'],Fun hike! We went mid-day and we're grateful to have some occasional shade. I would recommend doing this hike in the morning when it is not as hot. The waterfall is definitely worth it when you get there!
157,2018-07-28,[''],"Incredible views! Stunning evening hike, beautiful all around, with the perfect amount of challenge!"
158,2018-07-12,['hiking'],"Pretty steep, but not bad if you hike a lot. Took the turnoff with the black rope, to see the bottom of the falls. Rock climbed, next to the falls, up to the upper falls.

Was an enjoyable few hours with my brother and his 10 year old daughter. She was a champ and handled the hike very well. She also rock climbed up the falls with us.

Packed on the weekends, so if you can do it on a weekday you'll be glad you did.

Scenery is beautiful and it's not a real long hike."
159,2018-07-12,[''],A ton of loose rock on the trail knocks off a star for me - other than that this hike was great. The waterfall is unbelievably cool and it's one of the harder 4-mile hikes around.
160,2018-07-11,[''],If you love Rocky terrain and lots or horse doodoo this is the trail for you. It's a great workout with very little to see when you get to the falls (if you can find it) not much shade and only a couple of trees to sit under. I wouldn't recommend this trail to anyone!
161,2018-07-05,[''],Greats hike and views!
162,2018-07-04,[''],Great trail. As the small trail to the falls can be hard to find. One hint. Around the 1.85 mile point their is a fork in the trail. Stay to the left and look for the trail break off about 20 yards up the trail.
163,2018-07-02,['hiking'],We went with family and it was awesome! The falls and the granite rock were beautiful! It is mostly up hill all the way to the falls. Don’t miss the turn off down to the falls like we did. :) We hiked a bunch more than we needed to.
164,2018-06-30,['hiking'],Loved this hike. We went to the upper and lower falls. Both are easy to miss and not marked. We had someone show us after we missed the turn to both. The waterfall and pools were beautiful and the shade was appreciated. It was steep and hard on the way up but not terribly long. I also agree about the unleashed dogs. PLEASE leash your dog. Not all hikers like to share the trail with pets.
165,2018-06-29,[''],"One of my favorite hikes ever. Lately though there are so many dogs off leash it’s become scary to hike on the trail. Dog owners, THIS IS A LEASHED TRAIL! Your “nice” dog running and barking at me is frightening. Please leash your dogs!"
166,2018-06-24,['hiking'],my dogs favorite hike ❤️
167,2018-06-23,[''],"went this week with kids ages 11-15. took some fellow hikers advice to go up along the river which was gorgeous and shaded and then cut back on the main trail through the meadow. It was a bit tricky finding the meadow amdain trail but definitley worth going along the river as long as you can!

The turn off for the actual waterfall os marked with a black rope around a tree that we would of missed if others hadnt of told us. and it is not an easy path once you get off the main trail to see thw actual falls but totally worth it!! gorgeous and breathtaking. I would say ages 10 and up if your trecking to the actual falls. If you dont go that far up cut over to the river as it is beautiful and shaded."
168,2018-06-23,[''],"Beautiful hike to absolutely beautiful falls! Not too steep, but would be easy to miss black rope turnoff if you didn't know it was there"
169,2018-06-20,['hiking'],I do this trail a few times a year. Nice and shaded areas but pretty steep.
170,2018-06-19,['hiking'],"Hike up in about an hour. The turn off to the falls is easy to miss. Look for the ledge with the black rope.

On the return I kept heading up the mountain where there are two logs to cross the stream. From there don't go up the hill, but take an immediate left, and return on the Lake Hardy trail. The trail is poorly marked, so you'll definitely need a GPS and map."
171,2018-06-18,['hiking'],"Moderate, pretty steep but not too bad. Pretty waterfall at the top"
172,2018-06-16,['hiking'],"We did this as an evening hike. it was great! Luckily it was cloudy, the weather was perfect. I'm glad I didn't take my kids, the trail was steep and rocky. We hiked down to the falls, using the path with the black rope. We also hiked up above which also had great views."
173,2018-06-13,[''],first time hitting this hike and I was pleasantly surprised. Had just the right amount of incline for a really good workout but not kill you. Beautiful pine trees along the way and a gorgeous waterfall the top made it well worth the hike.
174,2018-06-11,[''],Beautiful waterfall at the top! Worth the hike!
175,2018-06-10,[''],"What a workout. All of it is up hill and full of rocks but what a view when you arrive! Took a couple breaks along the way to rest and catch my breath but it was worth it. We missed the left turn to the waterfall and had to back track, so be careful. Look for the black rope."
176,2018-06-10,['hiking'],"Beautiful hike.  Steep and loose dirt makes slipping a hazard.  Walking sticks are helpful especially coming back down.  Well worth the effort.  Took 2 middle aged ladies 3 hours to get there since we were talking the entire way!  One hour to come back down the canyon. The rope seemed challenging but some fellow hikers were encouraging and we made it.  Down was slippery, back up was a piece of cake.  The rope is past the bridge over the stream to the left side.  You won’t know it’s there unless you’re looking for it.  What a spectacular view of the canyon and Utah Valley below."
177,2018-06-07,['hiking'],The falls were amazing! So pretty.  Be careful to not miss the cut off trail to the falls. We kept hiking up a very steep trail before we realized we needed to turn around. You will see a sign and take a hard left after it onto a trail with a black rope tied to a tree. Will definitely come here again.
178,2018-06-06,['rock climbing'],"Awesome trail with a payoff at the end. We climbed down to the falls and scrambled back up. Steep pretty much the whole way and I think our GPS gave us some extra mileage, but it did seem to be longer than 3.9 miles total. Worth every step!"
179,2018-06-06,['hiking'],"Beautiful shorter distance hike. On a Wednesday morning we only saw a couple of other hikers on the trail. Everything is so green right now, and we saw a variety of bird species. Great for a beautiful morning workout."
180,2018-06-04,[''],"I took my daughter on this trail last night. The views from the top are gorgeous and the waterfall is beautiful. It had quite a few shady parts but still hot for starting mid-day in the summer. It is pretty steep and rocky the whole way up, but definitely worth the views at the end."
181,2018-06-04,[''],"Beautiful hike! it was very green and gorgeous when I went up yesterday (June 2, 2018) the trail can be steeper at times, but always planes out, so it doesn't tire one out too quickly, which is very nice. :) 
Also has many beautiful vistas all throughout the hike of towering pine trees, and the valley below, and gorges, to streams and of course, the massive waterfall which looks like it has a horse tail! 
I highly reccomend this hike :)"
182,2018-06-03,[''],"Amazing hike! One of my favorites in all of Utah. Not really that hard though, should be rated a moderate."
183,2018-06-02,['hiking'],"Used this trail today to summit Box Elder Peak. Hang a right just before the falls at a signed intersection to keep ascending on 2043, then keep on trucking for a good while until you get to a spot where you can see down into the Granite Flat Campground. From here, you swing south on 2188 and basically just go up and up and up until you're at the top of Box Elder Peak! 

Saw oodles of wildflowers on this first day of June; oodles more are on the way in the next few weeks I'm sure. There's still snow up high, though nothing terrible as long as you're not the kind of person who likes to test their luck on avoidable cornices. I liked having my waterproof boots and gaiters, but I like fancy/luxurious things like that.

Probably something like 5,500ft of vertical gain all told?"
184,2018-05-30,['hiking'],"Rigorous hike with views of the falls, surrounding peaks, and valley worth every step."
185,2018-05-29,['hiking'],I’ve done this hike many times. 4.4 up and down and it takes me under 2 hours. It is steep and doesn’t let up. The falls at the top are amazing and I like to find a rock to hang out on. It’s pretty shady most of the way which is nice. People miss the falls a lot because the cairn which signals the hard left turn to the falls keeps getting destroyed.
186,2018-05-26,['hiking'],great view halfway up
187,2018-05-22,['hiking'],"I enjoyed every bit of this hike! Seeing the waterfall is way more impressive in person than in pictures! I learned via fellow hikers that the main path to the waterfall is considered the “south  trail” but there is a “north trail” that leads to a different fall (?) will have to check it out the next time I visit! Otherwise sunscreen, a 2L water camel, good pair of waterproof hiking shoes, and bug repellent will be your friend."
188,2018-05-07,['hiking'],Loved the reward of the waterfall! It was strenuous and we stopped frequently. Make sure to bring lots of water and sunscreen. It’s very rocky as well in some areas. Reliable shoes are a must!
189,2018-05-01,['nature trips'],Friday's hike on April 24th was a terrific outing. We passed by the falls headed towards Dry Creek crossing at 2.2 miles from trailhead and eventually returned to trailhead via trail on North side of creek. An ample number of flowers in bloom and encountered 7 Red-breasted Nuthatch as well.
190,2018-04-29,['hiking'],"We enjoyed the hike! It's pretty steep but not too long. It took us about 3 or 3.5 hours at a good pace with some breaks at the top. If you want a shorter hike, you can just go to the overlook, which is on the left at one of the spots where the trail splits. It's pretty from there too. The last part of the trail is quite steep--probably precarious if it was raining, and the trail feels small and almost like you are not going the right way. We think we got to the end, which was a nice spot of the falls, because the trail looked like it ended there. Right now, it's still pretty brown because leaves haven't come out much yet, so it's probably prettier later on. No snow or anything though. Also, we never saw a black rope where the description said it would be... And finally, we found some glasses and put them on the blank sign board at the beginning of the trail if anyone is looking for those..."
191,2018-04-23,[''],Great hike! Difficult but not awful. Worth it to go down to the falls. Just watch for the black rope just a ways up after the turn where the sign is.
192,2018-04-23,['hiking'],"This trail is tough, but the falls and view of the valley are worth it. The entire way up is a good climb, and the trail is pretty rocky."
193,2018-04-15,['hiking'],It was a good hike. Rocky but good. The second half was still covered in snow making it hard to navigate the rocks. The view was spectacle. Our dogs did good on this hike too.
194,2018-04-14,['hiking'],Hike and snowshoed to the falls and beyond. Very nice when the water is running high
195,2018-04-09,[''],We like to hike up on the left side of the river.  It's nice and shady much of the way.  Can't wait to hike it again!
196,2018-04-04,[''],"I usually hike the trail on the north side of the river, but I opted to try out the hike on the South side last night.  It is interesting how different the 2 trails are.  The South side is such a nice wide well maintained trail but is far away from the river that you can only hear it in the distance.  The North side is a narrow trail that hugs the river so there is scenic views all along the trail.  The South side has a nice straight shoot view of the falls, but kept hiking hoping to get closer and I never found an amazing view point of the falls.  I will have to do research but I watched for Kairns to direct me to the great scenic spot and there was a only 2 ok far away spots that were along the trail.  The North trail gets hard to follow up by the falls and if you miss a Kairn you can easily get lost. You are so close to the falls, but most routes to get close to the falls are precarious and a little dangerous to get down to the falls to actually see them.  There have been people who have died here with just a slip and if you end up in the water here you are just done for.   I think I still like the trail on the North side better for the views along the river are so amazingly beautiful, but that is not the official trail they want you to be on. So be careful when you get up to the falls and try to keep in your mind the landmarks of where those Karin's are so you can get back on the trail safely."
197,2018-04-02,['hiking'],"Uphill climb the whole way, but not too bad. Snow is all but gone and there are only few slick spots left. To reach the base of the falls, at the fork with a sign go left. About 30 feet up on the left you’ll see a side trail that’s a short, steep descent to a well traveled path. This brings you to the base of the falls where the magic really is."
