,Date,Tags,Comments
0,2019-09-06,['hiking'],love it during the evening 
1,2019-09-02,['hiking'],"Good quick hitter close to town.  Brought the whole family, 9 yr old, 12 yr old and a dog.  Its a legit 1600 vertical in just under 2.5 miles so prepare for ""are we there yet"".  You are there when you get to a sign for Deer Creek/Dry Creek trail and North Mountain Trail.  Go left, look left and you'll see the trail, there's a rope tied to a tree.  That's the short trail to the falls.  Good water availability for the dog and its September so I assume that's a low point. "
2,2019-09-02,['hiking'],Beautiful hike! The falls really look like a horsetail. Be prepared for a very steep hike. Most of it is shaded.
3,2019-09-02,"['hiking', 'rocky']","I started at 8am so the sun hadn't come up over the mountain yet, making it so much easier to hike, since it was seriously an incline the whole way.  Read others reviews, I am glad that I did or I may not have noticed the turn off just past the sign where the rope down was. This way led to the lower falls, had I gone straight, I think it would have gone up to the top. The falls were very nice! The way down was partially  shaded since the sun had come up by then. A snake crossed over the trail in front of me. Great hike, but I am glad I went alone so that I didn't slow anyone down. "
4,2019-09-02,['hiking'],"Love this hike! So much shade and even though there were quite a number of people, the trail is nice and wide. Saw lots of families and little kids but the ""moderate"" rating felt pretty accurate for non-avid hikers like us. "
5,2019-08-30,['hiking'],"Great trail. The first 10% is hot and exposed, no shade. It gets better after 10 minutes. When you get to the meadow you’re about half way. The 2nd half is the best part of the hike. Keep going for 30 min. When you get to the split and you see the sign, go left, 50-100 feet up on your left a small unmarked trail cuts down to the lower falls. There’s usually a small ribbon on a branch marking that trail. Follow that trail for 5 minutes and you’re at lower falls. "
6,2019-08-30,"['hiking', 'rocky']","Gorgeous hike, super rocky at some spots, never found the falls but still lots of beauty to be seen. Will be going back with a group to find the falls later this week "
7,2019-08-30,"['hiking', 'off trail', 'over grown']",Amazing Hike! Honestly one of my favorites. You can easily get lost. You may want to watch this video before you go... https://youtu.be/5RUI_msMzXE
8,2019-08-29,"['hiking', 'bugs', 'rocky']","Beautiful falls. The trail is not as muddy as the spring. There are some bugs, but not enough to annoy. Horse poop everywhere, and the whole trail smells of it."
9,2019-08-26,['hiking'],Fun hike very beautiful. Hard to find the trail to the falls. You have to take a left at the fork and then you take a left about 10 yards into kind of a drop off trail.
10,2019-08-24,"['hiking', 'bugs', 'rocky']",
11,2019-08-20,"['hiking', 'rocky']","First, don’t think you missed the turn to the falls at two miles. It’s closer to 2.2 miles to the left of the sign in the middle of the trail. Beautiful Falls area!  "
12,2019-08-20,"['hiking', 'no shade', 'rocky']",
13,2019-08-20,"['hiking', 'rocky']","Pretty trail, very rocky. All the water is near the end of the trail. There are many offshoots that may lead down to the creek that you can hear from the trail, but we didn't try. The rocks are very slippery near the falls, even the dry ones so be very careful!"
14,2019-08-18,"['hiking', 'rocky']","The hike is nothing spectacular. Steep. Trail is rocky a lot of places. the waterfall on the other hand is fantastic! hiked up behind it to some cool ponds and small waterfalls.
Only saw a few people; probably because it was 3pm & 98 degrees. would recommend going early. Didn't see any snakes."
15,2019-08-15,['hiking'],Awesome hike. Definitely straight up hill. The falls are gorgeous. Very shaded so it makes for a great hike any time of the day.
16,2019-08-11,['hiking'],"Shaded trail most of the time! Straight uphill for the most part, about 2 miles up. I did encounter a bobcat, so be on the lookout. Really beautiful waterfall!"
17,2019-08-08,['hiking'],Ran out of sun. Had to come down early.
18,2019-08-04,['hiking'],Somewhat steep. I'd say this trail is similar in both time and challenge to the lower falls at bells canyon. Make sure you are somewhat prepared for breathing. 
19,2019-07-30,['hiking'],Beautiful
20,2019-07-29,['hiking'],"This would be a good trail for those under 40 and in reasonable good shape. This is not a moderate hike and not suitable for those 65 and over unless you are in excellent health and decent condition, as it is rather rocky and quite steep in many places. Expect to spend 1 1/2 to 2 hours hiking to the falls. You can reach a meadow in 45 minutes to one hour. If your looking for a moderate hike, try Battle Creek falls in Pleasant Grove. "
21,2019-07-28,['hiking'],I am always looking for dog friendly trails and this one was great! Definitely an incline the whole way up. I thought it was a pretty good workout but kids definitely were rocking the trail and even passed me at one point haha. It was mostly shaded but I definitely recommend hitting this trail earlier in the morning it was pretty hot.
22,2019-07-28,['hiking'],Beautiful views at the end! We got a good workout with the steep climb and rocky trail. 
23,2019-07-27,"['hiking', 'rocky']",
24,2019-07-27,['hiking'],"Beautiful, shaded, and a great pace!"
25,2019-07-26,"['hiking', 'rocky']","Beautiful Ending at the falls.  Definitely worth going all the way to the falls.  Watch closely for the turn off.   I’m a slow hiker, but hike often and would consider this a hard hike with the elevation and rocky path. "
26,2019-07-26,['hiking'],"Beautiful hike, gorgeous falls! Constant incline so be fueled up, and have lots of water. I can see how people would get confused on where to get to the falls, just watch for the drop off on the left with the black rope once you’re around the 2 mile mark. "
27,2019-07-25,['hiking'],Great trail.  Took 3 hours with 5 and 7 year olds.  But they stayed entertained and loved the falls
28,2019-07-24,['hiking'],Great hike.  Hot and fun!!
29,2019-07-23,['hiking'],Beautiful hike but definitely a workout. 
30,2019-07-23,"['hiking', 'rocky']",great hike! the start doesn't have any shade but the rest is well shaded. It's a great workout! 
31,2019-07-22,"['hiking', 'rocky']",Incredible hike. Would definitely recommend. We got a good workout
32,2019-07-21,['hiking'],"Great trail! Uphill most of the way to the falls and you will be crossing some narrow logs and walking through some wet, muddy paths. I went a month ago and the falls was roaring. "
33,2019-07-20,['hiking'],"Great hike, not very difficult at all.  It is up all the way but the falls are beautiful and we saw plenty of young kids hiking the trail!  Plenty of shade along the way and we will definitely take this trail again.  It is a great visitor hike."
34,2019-07-20,['hiking'],One of our favorites! 
35,2019-07-20,['hiking'],"Amazing hike. The waterfall was awesome. First hike of the year for our fam. We are dead tired after. Mom, Dad, and five kids 15, 13, 11, 8, and 3. All made it but the youngest three complained a little at times and the 2 year old we carried up and down. 

This is a beautiful hike. Plenty of shade and things to see."
36,2019-07-15,['hiking'],"The trail is well-maintained and isn’t too steep. I agree with the moderate ranking. The first part of the trail is exposed but the majority is shaded. I went last Friday and part of the trail was covered with water, which was really cool. Be sure to check out the top of the falls!"
37,2019-07-15,['hiking'],"Gorgeous Hike, the waterfalls are breathtaking. Definitely worth the steep 2 Mile hike! "
38,2019-07-14,['hiking'],"This hike is a butt kicker, and the reward is beyond worth it! Beautiful hike up. Loose rock along the way, so be prepared to watch your step a lot. Shaded most of the way. ⭐️⭐️⭐️⭐️⭐️"
39,2019-07-14,"['hiking', 'rocky']","Very nice hike. I went with my daughter on a Sunday.  Minimal traffic, 50% shade.  It was fun and refreshing wading through a little water (to my knees at the highest point). Several great photo opps.  This trail is not well marked along the way. After you see the one wooden sign,  go left and down a little alcove, not up like I did at first.  Overall beautiful and fun hike!"
40,2019-07-14,"['hiking', 'bugs']","Great hike and a little challenging for the little kids. (4,5,10) We didn’t hurry it took about 4-hours up and down. It sure felt like more than 3.9 miles. Be sure to check out the falls at the overlook they are stunning. "
41,2019-07-13,['hiking'],This trail is fantastic! There is a lot of shade after the first part of the hike and the river/falls are raging with water right now. Be sure to check out the top of the falls too!
42,2019-07-12,"['hiking', 'bugs']",
43,2019-07-11,['hiking'],I love the wooded section. and the waterfall is beautiful. 
44,2019-07-10,['hiking'],"Amazing hike! And a good workout! The falls are amazing right now and I love how you can hear the running water alongside the trail the whole way. Trail is mostly shaded so good during most times of the day. Yes it is a little rocky at times, and there were a couple spots you had to jump rocks to cross little streams but I thought that just added to the adventure! *bonus down near the beginning of the hike you can take a short hike down to the river and lots of trees for hammocks! Made for a perfect day! "
45,2019-07-09,"['hiking', 'rocky', 'scramble']",My mom and I loved this trail!! We even saw some people coming down on their horses! It is steep and rocky so be careful and aware. The signs here aren’t the greatest so to get to the water fall you’ll see a sign with a fork in between. On your left you’ll see where it goes down onto a rocky-ish pathway with a black rope. Follow the trail for about 5 minutes and you’re golden! If you keep going straight when you see the sign you’ll go up and around the waterfall which gives you a great view. Steep and rocky but overall amazing. 
46,2019-07-08,['hiking'],Loved this hike. The waterfall was still flowing fast. Just don't miss the little turn off to the left to get to it. Its small and we missed it the first time. went back an found it. Loved it!
47,2019-07-07,"['hiking', 'rocky']","We had a fantastic time on this hike. It is well shaded, but rocky so you need to watch your step especially on the way down. The views of the waterfall are amazing! Well worth the incline/distance. "
48,2019-07-07,['hiking'],"Awesome trail once you get past the first mile. The first mile is pretty steep and not the most fun, but when you get into the trees the trail is well kept and super fun. If you hike a ways past the falls you can head up to boxelder which is an awesome spot to enjoy."
49,2019-07-06,['hiking'],Hiked with the kids this time (9 & 11). It was more of a challenge for them than I expected but they made it and managed to have some fun. Their favorite part was taking pictures of everyone's dogs!
50,2019-07-05,['hiking'],"Great hike!  Stream crossings over logs and even a rope to help with a steep decline to get to the waterfall. Gorgeous and fast water!   I'm 50+ and kids there, but it's Utah moderate... lots of uphill and rocky.   Loved it!"
51,2019-07-04,"['hiking', 'rocky']",A lot of rocky uphill climbing. Challenging and beautiful. The waterfall at the end was definitely worth it. Love hiking through the water at some points. 
52,2019-07-03,['hiking'],Good and challenging hike heading up to the falls. The waterfall was raging. 
53,2019-06-30,['hiking'],"Challenging in areas due to incline coupled with loose rock, but doable. Definitely worth the gorgeous view of the falls. Beautifully forested. You can hear the water below the trail; I wish there was a trail to walk along beside the water. Maybe there is and I am just not familiar. But a great hike nonetheless!"
54,2019-06-30,['hiking'],"I loved this hike, it was just the right amount of difficult with the most amazing view at the end. It took our group of 6 about 2 hours to get up, enjoy the waterfall and come back down. "
55,2019-06-29,['hiking'],Beautiful hike. go early and it's mostly shaded. about 50 yrds of the trail is the stream right now. your feet will get wet. falls are raging with runoff. 
56,2019-06-29,['hiking'],Beautiful waterfall 
57,2019-06-29,['hiking'],beautiful hike with a nice elevation climb!
58,2019-06-29,['hiking'],This was my favorite Utah hike. I couldn't believe how beautiful it is at the top - I wish I had known about this hike sooner. I think we'll add this to our list of hikes we do every year. There are a few stream crossings that are fun. The waterfall is perfect right now - super strong flow. 
59,2019-06-27,['hiking'],"just keep to the left at every ""fork"" and you'll be up there in no time. There is water on the trail up a ways, but nothing you can't get through."
60,2019-06-26,['hiking'],"Went on a hike with my 1-year old daughter on my back. There are three streams you have to cross. To get to the last stream, you a have to walk through some water then cross logs to get to the other side. Difficult but doable. Unfortunately, in order to get to the falls you have to go down a steep hill. Wasn't able to get to the falls with my 1-year old."
61,2019-06-24,['hiking'],"Challenging in places, several sections of the trail are filled with lose rock. The trail and the views are very amazing and the falls at the end are absolutely breathtaking!"
62,2019-06-24,['hiking'],Most Enjoyable!  3 stream crossings..... some of us went right through the water and some stayed dry.  Marked great for our first time we had no issues.  Falls were raging and just beautiful!  
63,2019-06-23,['hiking'],"A couple stream crossings that we weren’t prepared for with my small dog but that’s my bad for not reading a lot of the details. We never made it all the way to the falls, I think the hike outlined here just takes you to a viewpoint since we had already done 2.1 miles at that point and we’re still pretty far. We went 2 weeks ago and it was definitely pretty muddy and the stream was basically running down parts of the trail. Hopefully by now it’s a little more dry. Very beautiful scenery though and great views from the top even without getting right up to the waterfall. Not sure if I’d do again because it was pretty steep and the bugs were out in full force but really pretty and loved being in the mountains. "
64,2019-06-23,"['hiking', 'muddy']",Gorgeous hike and the falls itself is flowing with abundant water. My pup enjoyed it a lot but it’s muddy and around 3 streams of water along the the trail 
65,2019-06-22,"['hiking', 'muddy']","Great little hike! It’s dog-friendly, which is nice. We went last week, and the trail was still pretty muddy. No snow from what I remember, but plan on you (and especially your dog) getting a bit muddy."
66,2019-06-17,['hiking'],beautiful hike! we got off trail and ended up going way past the falls! but we eventually found it. Tons of water to go through! 
67,2019-06-17,['hiking'],Had a hard time determining which path was the right one. We ended up primarily on the north side of the river after taking a clear bridge across but never ran into the other crossings? It was still pretty but we never made it to the top top because we were too out of shape to keep hunting for it 
68,2019-06-16,['hiking'],"Fast flowing falls today on a wet and a little muddy trail.  Having said that, I hike in Nikes and did just fine with no wet feet.  Recommend a walking stick for the water crossings."
69,2019-06-16,['hiking'],Great hike with a great waterfall.  Plan to get shoes wet but worth it.  
70,2019-06-15,"['hiking', 'muddy']","The raging falls make the climb so worth it! Plenty of shade the majority of the time. Lots of walking through water and river crossings. The hardest river crossing was easier today than a week ago thanks to someone dropping more logs across. Make sure to look for the left turn off just after the sign. It’s easy to miss, but takes you right up to the falls!"
71,2019-06-15,"['hiking', 'muddy']","Three river crossings. the last one is knee deep (I'm 6' 3"") and turbulent. Kids probably can't finish it. Very pretty, though"
72,2019-06-13,[''],"beautiful trail! shared with horses and was quite steep, but there was plenty of room for people to rest on the trail while still letting people pass. When we hiked the trail, there were some stream crossings that didn't have bridges, but that could be because the water level has been high recently. "
73,2019-06-12,"['hiking', 'muddy', 'rocky']","I would recommend this trail for anyone looking for a pet friendly trail. It is very beautiful with creeks and streams, hence the muddy comment. I would definitely recommend using the app to know where you are going, I got lost a couple of times. So did the group behind me. "
74,2019-06-12,"['hiking', 'muddy']","We went on the beginning of May, closer to the falls was muddy, hiking shoes are highly recommended. The powerful waterfall on the end is awesome. We meet some wildlife featuring a rattlesnake. The trail is short so, we kept going up to the top of waterfall. Our kids had a good time they are 11 and 14. There were people hiking with kids much younger, our dog is part of our gang so she was with us. Expect many dogs since they are allowed on the trail. "
75,2019-06-10,"['hiking', 'muddy', 'rocky']",
76,2019-06-10,"['hiking', 'rocky']","This is a great little hike. There are several stream crossings with makeshift bridges, so getting wet is optional. Only a few parts of the trail are muddy. Deffinently worth the hike."
77,2019-06-10,"['hiking', 'muddy', 'rocky']","Beautiful hike! Steep hike, muddy and a few areas where you’re walking through water up top. I was in tennis shoes and I was fine but I’d plan on wet feet right now. My pup and I made it to the falls and its absolutely gorgeous right now. Totally worth it!! Plus he doesn’t mind playing in the water along the way. "
78,2019-06-09,"['hiking', 'muddy', 'rocky']","Trail has stretches of mud and stretches of hiking through streams, plus several stream crossings, but most of us kept our feet dry enough in regular shoes if we went slow and careful. We hiked with a few 10-12 yr olds and they did great! The waterfall is spectacular right now. Beautiful woods and beautiful views, too. "
79,2019-06-09,"['hiking', 'muddy']",There is a lot of water! Beautiful hike and well worth the uphill climb! Water crossings are a little swift but plenty of footing take your time. Runoff is coming down a large portion of the trail near the top so be ready for some mud.
80,2019-06-09,['hiking'],"This is a beautiful hike and the falls are RAGING right now. I am always amazed that we have waterfalls like this hidden in our “backyard”. It rivals Bridal Veil in my opinion. The trail is pretty steep, and the stream crossings are a little trickier than normal for this hike, due to the amount of run off. One of favs in the area."
81,2019-06-09,"['hiking', 'muddy', 'scramble']",
82,2019-06-09,[''],"lots of water this week.

"
83,2019-06-09,['muddy'],"Beautiful hike, the water at the river crossings is running high because of all the spring run off so maybe bring shoes that can get wet, all in all a great hike! "
84,2019-06-08,"['hiking', 'muddy', 'rocky']",Crossing the final bridge to get to the waterfall water is going super fast be careful.
85,2019-06-08,['hiking'],Loved it! Well trafficked. Worth the uphill grade all the up. Waterfall was AMAZE BALLS!!! Ran the last 1.2 miles down. Great run! Coming back again.
86,2019-06-03,[''],"Awesome hike with great views, the falls are amazing."
87,2019-06-03,[''],great hike. a little muddy but beautiful. a little more advanced than I expected because it's all uphill. 
88,2019-06-02,[''],"probably the nicest waterfall that I have seen yet and it's raging pretty good right now.  I disagree somewhat about the trail being really muddy.   There is water running down the trail so of course the trail will have some mud, but if you are careful you don't have to hit too much of it.   Have fun....I know I did!!!!"
89,2019-06-02,"['hiking', 'muddy', 'rocky']","We went yesterday and it was still really muddy. You should be prepared to climb over rocks and through a few streams. Proper hiking footwear is advised. 

The roar of the waterfall is amazing. When you see the sign about Dry creek go to the left and then take the first path over to your left (small unmarked footpath) that will take you to the best view point of the falls. 

Side note:  despite this being a leashes dog only area many people let their dogs off leash. This makes it difficult for those dogs that are frightened of approaching dogs. Leash your dogs people!"
90,2019-06-02,"['hiking', 'muddy', 'rocky']","Moderate hike, very muddy in lots of areas right now. A few creek crossings. Steady incline, but not anything crazy steep. Once you’re pretty close to the falls it’s not very clear where exactly to go. Make sure you have access to the app if you don’t want to wander for a bit to find where they are. The waterfall is AMAZING right now. Raging like crazy. The view is spectacular. Seriously an awesome hike. "
91,2019-06-01,"['hiking', 'muddy', 'rocky']",
92,2019-06-01,"['hiking', 'muddy']",
93,2019-06-01,['hiking'],"Great hike. It was fairly muddy/wet for the last leg. We hiked with our 4, 7 and 9 year kids and they did well on it. The waterfall was raging. I imagine the water decreases later in the summer but the trail would be dry... which would make it easier."
94,2019-06-01,[''],"It was so beautiful! The trail was muddy and there are a lot of rocks on the trail. There were lots to walk across higher water areas. The waterfall was amazing!
"
95,2019-05-28,['hiking'],"It’s a consistent gradual incline all the way to the falls. Very muddy in many parts. Beautiful views from the falls. Going a little further up will also put you in view of the pools above the falls which are fantastic. There is flowing water on the upper portion of the trail, worsening the muddiness, definitely should wear hiking shoes/boots, not tennis shoes."
96,2019-05-28,['hiking'],"Weather was beautiful. Trail was muddy in places, but not impassable. Kids did great, but we took it a little slower. With the two kids it took us about 2.5 hours round trip (we stayed for a while at the top). Spotted a moose off the trail. Waterfall is raging and amazing right now."
97,2019-05-27,"['hiking', 'muddy', 'rocky', 'washed out']","Beautiful, and not too difficult! It would be hard w babies or young toddlers, but 6+ would be fine (with of stopping). It rained last night, so it was very muddy on many parts of the trail. "
98,2019-05-27,[''],"Love this hike and exploring the area! spring hiking is ana,big, wild flower and a great fall from winter runoffa"
99,2019-05-27,"['hiking', 'muddy', 'rocky']",Decent trail with a beautiful waterfall view at the top. Hard to notice the turnoff to the bottom view of the waterfall. It's about 30 feet past the sign for deer creek trail on the left and looks like a washout. 
100,2019-05-26,"['hiking', 'muddy', 'rocky']","So we enjoyed this hike. I would not however say this is kid friendly nor would I rank it as “moderate”, it’s a bit strenuous, and I exercise everyday. It’s an incline the entire 2 miles up. I think if we hadn’t done it without our three kids it would have been a lot easier. Totally doable without kids, we actually finished the hike, but we saw at least two families with kids turn around because it was just too hard.  Also, it’s important to note that the 2 miles gets you to a beautiful view of the falls, but not to the actual falls. If you want to go to the falls (put your feet in and be at the foot of them) you have to go about a half hour longer.  Anyway, overall, good hike, but not my favorite and it was tough with kids."
101,2019-05-25,['hiking'],I would recommend this trail to anyone it was awesome and good for dogs and kids
102,2019-05-25,"['hiking', 'muddy']",
103,2019-05-20,"['hiking', 'muddy', 'rocky']","Beautiful trail. Lots of water, some on part of the rocky trail. Little muddy in places. Good traction shoes needed. "
104,2019-05-16,"['hiking', 'muddy', 'rocky', 'scramble', 'snow']",Went on a Sunday mid day and the parking lot was full. Had to park on the side of the road a little bit down from the parking lot. It wasnt far and the car was okay. The trail can get warm the first part there is a lot of sun. But there is also shade patches you can stop in if you need to cool down. The further up you go maybe at the mile and a half or 2 mile marker there is a creek running over the road for any dogs that may need a drink. I highly suggest you keep your dogs leashed on this trail since it is frequented by horses. Also towards the top there are a couple heavy water crossings but there are tree bridges that help you not get wet. once you see the trail sign at the top your turn for the lower falls is on the left hand side not far passed that sign. It looks sketchy and there is a tiny rope to help you up but that is the way to get to the lower falls. The trail also gets narrower and there is lots of water on that little section but you are going the right way. if you pass that trail to go down to the lower falls you keep following the current trail you can get to the top of the falls. I also heard there are Cascades at the top that feed into the falls but I did not see that. The trail is a constant up hill hike. My Garmin registered it at 5.5 miles total. Totally worth the hike. I recommend trekking poles. Almost every hiker I saw had something even if it was a stick they picked up. No need for snowshoes or spikes.
