,Date,Tags,Comments
125,2017-07-25,['hiking'],"If you're looking for a moderate hike with a great destination, this is it! It can be fairly busy, so the earlier you go the better. The spring time can be fairly muddy. Bring plenty of water for the switchbacks. The trail is always clear and trimmed."
126,2017-07-12,['hiking'],Great hike. It was just right for my wife and I. Going in the morning made for perfect temperatures. Love the views!
127,2017-07-09,[''],Love this trail. I was able to complete it while still moderately out of shape and the end was so worth it!!!
128,2017-07-09,[''],"Loved it! Great view, majestic surroundings!"
129,2017-07-07,['hiking'],"Started around 8am and saw very few people on the way up! Got there with the cave to ourselves. Not too steep on the way up, but most of it is in the sun so I'm glad we went earlier. Took some sick pics, explored a bit, then made our way back down."
130,2017-07-07,[''],"This is a moderate hike and doesn't take long to get to the caves. Has some pretty good views at the top, too!"
131,2017-07-04,[''],"We did this hike at about 6:30 PM, and it was perfect! During the middle of the day, it's almost completely exploded and SO hot! I'd suggest doing it in the evening. Beautiful views, though!"
132,2017-07-03,['hiking'],The views on the hike are very pretty.  It is a narrow trail so be prepared to have to scoot to the side to pass around others.  You definitely don't want to do this one on a hot day during the day.  It is mostly exposed and there was no breeze when we went yesterday.  We ended up turning around about 3/4 of the way up because we started to get heat exhaustion and ran out of water.  Will complete this one another (cooler) day.
133,2017-06-30,['hiking'],Great Hike!!! Amazing view! Bring a camera!!
134,2017-06-25,['hiking'],"It's a little closer to 4 miles. Great quick hike, very popular spot and the caves are fun."
135,2017-06-23,['hiking'],"Super easy, pretty uphill so that would explain the moderate rating. Fun to run back down, if you watch out for the few roots over the trail and go when there aren't many people. Definitely the most popular hike in Logan. But I've done it real quick after dinner and made it down before dark. Been several times, seen a harmless snake once."
136,2017-06-19,['hiking'],"Would do this again tomorrow.  Steep but sweet views most of the way & very green.  The ""caves"" at the top are picturesque"
137,2017-06-18,[''],"Wonderful hike! Beautiful views along the way. A lot of the trail is unshaded, so go in the morning to beat the heat."
138,2017-06-12,[''],This was a great trail to go on with little kids. There was 3 adults and 3 children (two four year olds and a seven year old) plus our little dog. They all did amazing. It had beautiful views and the cave was just gorgeous. The kids really enjoyed it. Highly trafficked but well worth it in our view.
139,2017-06-11,[''],"Great hike! However, we took our 7 and 9 year old boys and it was pretty difficult for them. There were a lot of narrow steep trails. There were many hikers that would not move to the side or thank you when you let them pass as we did!Manners are free!"
140,2017-06-05,[''],"Loved this hike. Beautiful scenery, views, not too many people for a Sunday."
141,2017-06-01,['hiking'],"This was a cool but short little hike. There were a couple other people at the caves when we got there but it wasn't too crowded. I could see it getting pretty packed though. Still, it's a nice hike and there are beautiful views in the canyon."
142,2017-05-29,[''],"Fun, fast, and beautiful"
143,2017-05-22,[''],Great hike! Great to do once or twice a year. Highly trafficked!!
144,2017-05-20,['hiking'],Such a fun trail. Moderate hike up with varying grades but always a view take in while you take a break. The caves at the top are so cool to see and a great place to snap a pic. I jogged the trail down back to the trailhead and was not disappointed!
145,2017-05-14,[''],"Great hike! There is a nice view the whole way up & the yellow wildflowers and butterflies are beautiful. There are rattlesnakes near the trail, so be careful. We had to wait while one crossed over the trail. It was scary! The caves at the end are totally worth it though. So beautiful!"
146,2017-05-14,[''],"Although it snows on us today and slightly rained, the views were worth it!"
147,2017-04-27,['hiking'],It was beautiful still a little muddy in some places but you should be fine it gets a little cold at the top so a light jacket will do
148,2017-04-20,[''],"Good hike, trail highly used go early."
149,2017-02-27,['hiking'],A good hike to do with kids and a good hike to do once.
150,2017-02-04,[''],better at night
151,2016-10-23,[''],"Nice hike--up in 40mins, down in 35. Great for beginners with many rewarding views. Caves are cool and the grade can feel rather steep at parts. Only giving this 4 stars because the brevity of the hike attracts a lot of people and the trail is rather narrow in places making bottlenecks and cramped passing."
152,2016-10-10,[''],"This is one of My Favorite hikes , it's a very easy hike up and back with a great end game . 
I enjoy watching the sunset on this hike .. Remember to hydrate .."
153,2016-10-08,[''],Dont do this at night unless youre a more experienced hiker or youre familiar with the trail!!
154,2016-09-25,[''],"It took my sister and I 45 minutes up, 35 down! Amazing view!!"
155,2016-09-25,[''],The trail is moderate and I agree. It has quite the ascent in the 1.8 miles it takes to get up to the cave but was easy enough for my younger daughter to hike without any difficulty. The views were beautiful especially with the leaves starting to change. It was a nice short hike. With children it took up about 1 hour to go up and 40 minutes to go down.
156,2016-09-18,['hiking'],A beautiful hike with the leaves turning. Not too difficult with wonderful views. A good trail for younger children.
157,2016-09-03,['hiking'],"This trail was marked as moderate. I would rate it at least moderate high. This is not a trail for the inexperienced hiker. It is quite an uphill climb for most of the hike. This definitely gets you up in altitude! The terrain is fairly rugged. Easy enough to navigate and kinda fun, but the higher you go and the narrower the trail,the scarier it can be. You are literally enveloped by mountains on every side. Definitely a beautiful climb but the climb is so strenuous that you may tend to miss the beauty around you."
158,2016-08-25,['hiking'],"Got up early and hiked this trail starting at 6am. I used a head lamp for the first 20 minutes or so. I got to the caves in about 45 minutes and was breathing heavy as I live at about sea level. I spent about a half hour at the caves and watched the sun rise, very beautiful! Would definitely do this trail again early in the morning as it got quite busy on my way down."
159,2016-08-23,['hiking'],Beautiful scenery
160,2016-08-14,[''],Great hike. But don't take young children on this hike. The 1.8 miles uphill is difficult and when you get to the caves there is a down slope with loose gravel. Very dangerous for children. But great views and the caves are worth the trek.
161,2016-08-06,[''],Just did this yesterday! Awesome hike. Not too long  and a nice steady incline. Also the canes at the end have some amazing views. Recommend it heavily as Logan canyon is gorgeous and seeing t from the caves is a great experience. Will do again!
162,2016-08-01,['hiking'],"The parking lot was full but I found that there is plenty of parking along side the road . 
The trail was easy to follow and in great condition . 
There were lots of other people on this trail 
So even hiking alone like I do it felt like you were hiking with a friend . Bring plenty of water and snacks .  
This is a great trail for small children to go on .  
Just stay on the trail  follow the signs and you too will arrive at the Wind Caves , truly amazing .
I enjoyed this trail rating it in my top 10 of favorite trails . It is 1.8 miles one way .. I hiked it in 1 hour 38 minutes up & back .. Happy Trails"
163,2016-07-30,[''],We like this trail a lot. We have done it in the spring and fall.  We are doing it again the first week of August.  The wind caves at the end are awesome!!
164,2016-07-25,[''],worth the views in the end!
165,2016-07-20,['hiking'],Wind caves were very pretty and worth the hike in the end. I didn't like how there was so many rocks on the trail but it is nature 
166,2016-07-19,['hiking'],Pretty nice quick and easy hike.
167,2016-07-02,[''],"Not my favorite hike, love the wind caves, but getting there is pretty hot so make sure you go early morning or in the evening."
168,2016-07-01,['hiking'],One of the best hikes here! Always busy so plan on going early in the day if you want some alone time with the mountain!
169,2016-06-27,['hiking'],"Pretty easy hike, with a beautiful view at the end."
170,2016-06-16,['hiking'],I hiked this trail a couple of years ago when my kids were young.  They enjoyed the hike and the cave.  On the way back they ran up ahead a few hundred yards and then came running back saying they saw a snake.  Sure enough a huge rattlesnake was working its way off the trail.  The trail is a great one for kids.  Just keep them close by.
171,2016-06-13,['hiking'],"I do this hike every year. One of my favorites. It's fairly short but a good climb with rewarding views. Bring water! I recommend starting early when it's not too hot, because the trail, being on the north side of canyon, is in the sun all day and gets really hot! Especially as summer goes on. Great view of the China Wall across the canyon (Crimson Trail)."
172,2016-06-10,[''],I love this trail!!!! It's a little bit of a workout but man is it worth the trip! The wind caves are beautiful!!!! I will do it time and time again!
173,2016-06-09,['hiking'],Fairly easy hike with a considerable amount of elevation gain. Can get quite warm / hot as the majority of the trail is exposed to direct sunlight. Lots of switchbacks and should be good even for a fair novice hiker if you take enough water and rest along the way.
174,2016-06-06,[''],"One of our favorites whenever we visit Cache Valley. Kids love it and it is a pretty easy hike with a lot of switch Backs. The views at the top are gorgeous. Better earlier in the day, there is not a lot of shade on the trail."
175,2016-06-03,['hiking'],This hike was fun! Gorgeous view! It was a medium Level hike but a good challenge at the same time. It's a narrow trail so go in the morning or evening.
176,2016-06-02,['hiking'],"Fun, easy to moderate hike with great scenery. We hiked this last night and it was really pretty. Trail is not very wide in most places. I would suggest going in the evening or early in the morning as this hike can get very crowded. I would avoid this hike on Saturday's because it will get crowded and you will have to wait a few times due to the narrow trail. Hike is well worth it."
177,2016-05-30,['hiking'],It's not too long but it's a good incline whole way. 1000ft elevation gain makes it a good challenge
178,2016-05-20,[''],Amazing views!
179,2016-05-18,[''],"Trail is amazing! It's not for beginners, it does have some height to it.. So don't listen to these ""SO CALLED HIKERS"" who says it's easy and ""ANYONE"" could do it..if you are in okay shape you should be fine. BUT! If you don't hike much this probably wouldn't be a hike for you.. 

The view is spectacular! Beware lots of douche bags live in that area so be cautious about them.."
180,2016-05-16,['hiking'],"It's a great workout.  I've lived in Logan most my life and have never done this trail.  I went to ""run"" it and that didn't pan out well.  1000 feet of elevation gain to the caves is intense.  Perhaps if you are in pinnacle shape, but even just hiking gives a killer calf workout.  Some parts of the trail are in bad repair and rutty/rocky, and some parts are very narrow so watch it.  As stated, there isn't much cover, I got cooked pretty good in my 2 hour in-and-out.  I ran back down and it was pretty fun.  Gorgeous view."
181,2016-05-14,['hiking'],Great hike! The cave was nice and cool on a hot day.
182,2016-05-12,[''],"I love this hike for something fairly short, but great views. It does not have much shade so try a cooler day."
183,2016-05-03,[''],"One of my favorites! I love having a destination on my hike! We went on a week day, not many people at all so that was nice. I recommend doing this in the spring or fall when it's cool... Not a lot of shade cover and i read you need lots of water on this trail, but we each had three small bottles this time of the year and it was perfect. Gorgeous views, and the caves AMAZING!!"
184,2016-04-30,[''],"Excellent hike. The first mile and a half is pretty much uphill, but the views from the caves are worth it."
185,2016-04-23,[''],One of my favorites
186,2016-04-14,['hiking'],"This is worth the drive up to Logan Canyon if one is from Salt Lake.
Around the 5740 elevation level there is a side trail that goes up to the ridge.  On the ridge one can continue on over or go up the ridge."
187,2016-04-10,[''],So fun! And so worth it!
188,2016-04-03,['hiking'],Awesome hike!  Broke a little sweat on this cool Sunday morning in early April.  Beautiful views of the valley!
189,2016-03-20,['hiking'],This was a very fun trail! My family and I went in March. There was still some snow on the ground and one part of the path was very narrow and slippery. We also can across a lot of mud and slipped a few times. We would definitely recommend hiking boots. Many part of the trail that get narrow which might make it difficult for smaller children. The view as you walk to trail is beautiful! The cave is very fun but slants down a bit. Overall we loved it! Has a amazing view from the top making the hike worth it. Make sure to bring extra water.
190,2016-03-08,['hiking'],So great.  I love the view from the caves!! Bring water!
191,2015-09-10,['hiking'],"Great hike, highly recommend. Everyone does it around here but the trails aren't usually bombarded with people. Great view- can't wait for the leaves to change!"
192,2015-09-06,[''],Great trail. I was on the trail by 7am and watched the sunrise up over the entire canyon. I wouldn't take small children on this hike as it's pretty steep in some places. The wind caves are awesome and are a perfect place to enjoy a snack before you head back down. Bring plenty of water.
193,2015-09-06,[''],Hike in the evening when there is a full moon! Start about 8:30 pm and watch the moon come up. It lights up the whole trail. Fantastic!
194,2015-08-23,[''],"As someone who seldom hikes, it was a great hike. The distance isn't too far as at its steepest it's not too bad. The smoke from the wild fires didn't allow the views that people rave about, but not much you can do about that!"
195,2015-08-14,[''],Great trail.
196,2015-08-12,['hiking'],Amazing view!  Moderately difficult but has shade along lots of the path.  Trail is clearly marked and the view in the caves are spectacular!
197,2015-07-26,[''],Amazing views!!! Well worth it!!!
198,2015-07-10,['hiking'],Awesome hike and beautiful at the top but should not be rated easy. We took kids and it was very challenging for them. Also I wore my Garmin watch and it was 5 miles round trip.
199,2015-07-05,[''],"It was a pretty joke, but holy cow, don't go during the hot part of the day! It's pretty steep and there are hardly any trees anywhere to stop for shade. The reward (the caves) was not worth the sweat."
200,2015-06-28,[''],Great hike.  A little scary at the top but I'm kind of queezy when it comes to cliffs.
201,2015-06-22,['hiking'],"Great hike with plenty of shade along the trail to take a drink or quick break. The view is spectacular from the cave. Traffic is moderate, but the trail is narrow at some points making passing more difficult. This is one of my favorite hikes around Cache Valley."
202,2015-06-21,['hiking'],"This is the iconic hike in Logan. Pictures at the top on every basic Logan white girl's Instagram.  I let that keep me from checking it out for a long time, thinking it would be full of people all the time. I was happily disappointed! The hike is steep for the first half, but once you get up above the rock cliffs it's a nice stroll with breathtaking views. Not one to try in flip flops. Trail is narrow and the vegetation will brush your legs on the way up."
203,2015-06-02,['hiking'],"Favorite hike in northern Utah!  It's steep and long enough to make you feel like you're getting a good workout, but not enough to make you feel miserable.  The end view is definitely worth the climb!  Would recommend to anyone!"
204,2015-06-01,['hiking'],"This hike has beautiful views of the canyon. It is fairly strenuous as it is uphill most of the way via switch backs but there are plenty of areas to rest in the shade. While I was unable to record the hike due to no cell service, I felt that it was longer than 1.7 miles to the caves. My personal pedometer said about 2.3 miles to the caves so a total of 4.6 miles but that is not the most accurate reading. Regardless, the hike was great and I would recommend it to anyone in the area."
205,2015-05-31,['hiking'],"Decent hike. Great reward at the end. It'll test your endurance if your not in good shape. Not recommended for younger than five year old kids as the first part you need to have semi sure footing. 

I don't understand the description where it says the first part you have to wade through water. I've never had to do that. Don't let that deter you."
206,2015-05-28,['walking'],"This is a fun hike to a popular geological feature. It is moderate, but accessible to many."
207,2015-05-26,['hiking'],Fun hike and kid friendly.
208,2015-04-13,['hiking'],"I have hiked this trail numerous times. It's a classic. There are quite a few switch backs, but they are long enough that it doesn't feel monotonous. I haven't ever had to walk in water like the overview (above) says, but at some times of the year there is still a little snow near the trail towards the top, it's not bad tho. Pretty view, make sure to go down underneath inside the wind caves as well as taking in the view from on top."
209,2015-03-25,[''],"I'm an impatient hiker, prefer off trail hiking so that's exactly what I did on This trail. Beat my friends who took the trail by 30 minutes. But oh man the view and solitude up there is amazing! Took the trial back down and it's pretty steep so make sure you're wearing better than average shoes."
210,2015-02-07,['hiking'],I've been walking this trail since I was a kid. Fun family/group/date activity. Amazing to do at midnight with a full moon!
211,2015-01-20,['hiking'],Moderately steep hike. Great views of the other side of the canyon. Caves are interesting and great place for lunch.
212,2014-10-05,['hiking'],"Completed this Hike in August, had to attempt two days in a row due to getting caught in Thunderstorm. It was a great hike, loved the rock formations up top, although I don't know you can really call them caves."
213,2014-08-12,['hiking'],Went on this hike with troop 108 from honeysuckle. it w as d awesome. great views. we started together but split into 2 groups I es d eith the firdt group took abot 55 mins to get to the caves. we did a bit of jogging up. second group about 20 mins later. The cool thing was mr and 3 scouts jogged all the way down and did it in 30 mins. That was a challenge for them but they made it.  Great hike for the family.
214,2014-08-03,['hiking'],"Steep hike, hot in the summer so bring lots of water."
215,2014-06-16,[''],I am out of shape. The steepness kicked my butt.  I had to stop tp caych my breath several times. It was all worth it!
216,2014-06-08,['hiking'],"Steep uphill, with some shade.  Lovely view at the top.  My 8 yr old climbed it no problem, but my 5 yr old struggled and had to be carried part of the way."
217,2014-05-24,[''],"I love this trail! It's challenging to run, but amazingly fun!!"
218,2014-05-05,['hiking'],"I did this trail in July.... but while I was on the trail, I was caught in a thunderstorm. By the time I was at the top, I was soaking wet, but had a blast. The trail is technically fairly short, but it's almost straight up the mountainside -- very steep -- but worth the view once you get up there. The clouds and rains made the view even more beautiful. While the most popular part of the trail stops at the wind cave. After the cave, if you've got time, about halfway back down, take 'Wind Cave Way"" and head up the ridge to Beirdneau Peak or even over to Green Valley."
219,2013-09-22,['hiking'],"We went as a larger group- 3 adults and 6 children (ranging from 5 - 9 years old). It was quite steep climb at times, but they didn't last long. Lots of sun, with a few small shady areas to rest. It's a quick climb for the relatively short hike. We went a little slower for the kids, but they were troopers. Even had a couple face-plants, but I guess they're tougher for it. The view at the top was amazing and worth it. Be sure when you get to the top that you keep a close eye on your kids, as there is a BIG drop off at the front of the cave (you enter from the back). What a view! Awesome! Bring lots of water and sunscreen! Will definitely like to do this hike again. "
220,2013-07-24,['hiking'],This was a fun hike.  Took my 82 year old father and we took our time.  the views were great and the arches were very cool.  I would rate this as moderate to hard due to the lose terrain.   This is a very good day hike.
221,2013-05-31,['hiking'],"Good trail, a decent hike; can't wait to see the colors in the fall. "
222,2013-04-09,['hiking'],"I had a great time on this trail.  The trail is very used and well maintained.  It was raining on the day I visited and the trail does get extremely slick.  Which isn't too much of a problem until you get closer to the cave area.  This a great trail for all it is a elevation gain of 900' but it is a gradual and plety of areas to stop and take a rest or even grab a bite to eat.  The views of course are amazing, after all this is Logan Canyon.  A favorite for me, this would be a great one for all those trail runners out there.
"
223,2012-08-26,['hiking'],great little hike that everyone in cache valley should do at least once.
224,2012-07-23,['hiking'],"Good trail as long as you start early during the summertime.  The wind caves were very pretty and we actually walked on top of them without realizing it, at first.  Worth the trip! "
225,2012-06-28,['hiking'],"Trail wasn't too hard.  I had blisters when I was done, but it was from poor fitting hiking boots.  Cave isn't really a cave, more a short tunnel or archway.  It was rather steep and had a severe drop off and I wouldn't let my kids play in it when we got there."
226,2012-05-06,['hiking'],"Great shorter hike. No water on trail this year. It's a nice short hike, with a fun cave at the end. "
227,2012-04-02,['hiking'],"Nice hike, not to difficult, great scenery. I would suggest going in the fall when the leaves are changing. Great autumn colors and the temperature is a little cooler. Water and trail mix is not a bad idea."
228,2012-03-19,['hiking'],its not really what i would call a cave but it is worth seeing. not to difficult.
229,2019-09-07,['hiking'],
230,2019-09-03,['hiking'],
231,2019-09-02,['walking'],
232,2019-09-02,['hiking'],
233,2019-09-01,['hiking'],
234,2019-08-30,['hiking'],
235,2019-08-28,['hiking'],
236,2019-08-26,['hiking'],
237,2019-08-25,['hiking'],
238,2019-08-23,['hiking'],
239,2019-08-21,['hiking'],
240,2019-08-21,['hiking'],
241,2019-08-19,['hiking'],
242,2019-08-18,['hiking'],
243,2019-08-07,['hiking'],
244,2019-08-07,['hiking'],
245,2019-08-01,['hiking'],
246,2019-07-30,['hiking'],
247,2019-07-28,['hiking'],
248,2019-07-27,['hiking'],
249,2019-07-26,['hiking'],
250,2019-07-24,['hiking'],
251,2019-07-21,['hiking'],
252,2019-07-20,['hiking'],
253,2019-07-20,['hiking'],
254,2019-07-20,['hiking'],
255,2019-07-13,['hiking'],
256,2019-07-12,['hiking'],
257,2019-07-12,['hiking'],
258,2019-07-09,['hiking'],
259,2019-07-08,['hiking'],
260,2019-07-08,['trail running'],
261,2019-07-08,['hiking'],
262,2019-07-04,['hiking'],
263,2019-07-04,['hiking'],
264,2019-06-30,['hiking'],
265,2019-06-30,['hiking'],
266,2019-06-27,['hiking'],
267,2019-06-26,['hiking'],
268,2019-06-26,['hiking'],
269,2019-06-23,['hiking'],
270,2019-06-23,['hiking'],
271,2019-06-23,['hiking'],
272,2019-06-20,['hiking'],
273,2019-06-16,['hiking'],
274,2019-06-16,['hiking'],
275,2019-06-12,['hiking'],
276,2019-06-12,['hiking'],
277,2019-06-10,['hiking'],
278,2019-06-08,['hiking'],
279,2019-06-07,['hiking'],
280,2019-06-02,['hiking'],
281,2019-06-01,['hiking'],
282,2019-05-28,['hiking'],
283,2019-05-25,['hiking'],
284,2019-05-18,['hiking'],
285,2019-05-18,['hiking'],
286,2019-05-18,['hiking'],
287,2019-05-12,['hiking'],
288,2019-05-12,['hiking'],
289,2019-05-06,['hiking'],
290,2019-05-02,['hiking'],
291,2019-04-25,['hiking'],
292,2019-04-23,['hiking'],
293,2019-04-21,['hiking'],
294,2019-04-20,['hiking'],
295,2019-04-18,['hiking'],
296,2019-04-18,['hiking'],
297,2019-04-08,['hiking'],
298,2019-04-07,['hiking'],
299,2019-03-30,['hiking'],
300,2019-03-19,['hiking'],
301,2019-03-02,['hiking'],
302,2018-11-10,['hiking'],
303,2018-10-28,['hiking'],
304,2018-10-28,['hiking'],
305,2018-10-24,['hiking'],
306,2018-10-18,['hiking'],
307,2018-10-12,['hiking'],
308,2018-10-04,['hiking'],
309,2018-09-08,['hiking'],
310,2018-09-08,['hiking'],
311,2018-09-04,['hiking'],
312,2018-09-03,['hiking'],
313,2018-09-02,[''],
314,2018-09-01,[''],
315,2018-08-31,['hiking'],
316,2018-08-29,['hiking'],
317,2018-08-26,['hiking'],
318,2018-08-24,['hiking'],
319,2018-08-22,['hiking'],
320,2018-08-18,[''],
321,2018-08-04,['hiking'],
322,2018-08-02,['hiking'],
323,2018-07-22,[''],
324,2018-07-19,['hiking'],
325,2018-07-12,[''],
326,2018-07-01,['hiking'],
327,2018-06-29,['hiking'],
328,2018-06-29,['hiking'],
329,2018-06-07,['hiking'],
330,2018-06-05,['hiking'],
