,Date,Tags,Comments
0,2019-09-07,['hiking'],This hike is pretty easy. I would recommend it to those who are just getting in to hiking. It’s a nice mix of steep and flat. Not too bad at all with awesome views of Logan canyon and those caves! They’re so cool!
1,2019-09-05,"['hiking', 'no shade']","Hiked this trail most recently 9/2/19. The trail is very exposed, without much shade, so it’s probably best hiked in the morning or evening. Bring plenty of water. Great hike in the fall, when the maple leaves turn. The view from the caves is spectacular. "
2,2019-09-01,"['hiking', 'no shade']",there are lots of areas without shade so this one is probably better for a morning or evening hike. the cave is really cool but it's not deep so no need for jackets.  I took this trail on with my 5 & 6 year olds and it was probably at the limit of their ability. overall a great hike with loads of fantastic views and a really cool cave/arch at the end.
3,2019-08-28,['hiking'],Great trail for a quick hike. Lots of sun exposure.  Caves are pretty cool.
4,2019-08-25,['hiking'],I found it harder than most folks told us but it was still do-able with breaks. we also haven't fully acclimated to the elevation. The wind caves really are beautiful and truly frame the canyon. very worth the effort!
5,2019-08-23,['hiking'],Worth it. So many different things to see. Absolutely breathtaking with moderate effort.
6,2019-08-17,['hiking'],This hike was definitely worth the view! My little dog was quite the trooper and seemed to enjoy it just as much as I did. I would recommend to go in the morning rather the afternoon. Less traffic and cooler weather! 
7,2019-08-15,['hiking'],"great hike.  beautiful views and caves.
"
8,2019-08-13,['hiking'],Awesome trail for most skill levels. Saw some kids who were able to do it in sandals. Did see a very large rattlesnake so be aware! 
9,2019-08-09,['hiking'],"the hike was awesome! beautiful views and the cave was amazing!
"
10,2019-08-03,['hiking'],"Loved this hike! We hit the trail about 7:30 a.m. as to beat the heat and the crowds. Took us about 50 minutes to reach the caves. There are some steep places, but not too bad. Loved the view of The China Wall once we reached the caves! B-E-A-UTIFUL!!"
11,2019-08-03,['hiking'],The cave formations are awesome! 
12,2019-07-22,['hiking'],Love the wind caves but it’s always busy! Go early!
13,2019-07-20,['hiking'],"Great trail, not too steep but still challenging in hot temperature.

Bring lots of water.  There is only ONE water source within the first mile of the trail.  Although, there are a few shady spots where you can rest on the way.

Very beautiful view on top of the cave!  Great picture spot !"
14,2019-07-18,['hiking'],the view from the caves is gorgeous! Do this early!  The snakes started coming out at 10 am. We saw 4 within five minutes coming back down. 
15,2019-07-13,"['hiking', 'no shade']",Excellent views worth the effort.. 
16,2019-07-12,['hiking'],The hike Took us about 2 hour there and back but we took lots of water breaks! Trail was easy to follow but quite a bit of people for a Friday morning! We started our hike at 7 am and thank god we did because it would have been hot any later. The wind caves were really cool and was worth the hike! 
17,2019-07-09,['hiking'],"If you are visiting with a friend in Logan, Utah you got to hike the Logan Trail Caves! It is a climb and has many switch-backs but when you get to the top the wind caves and views are amazing! I would recommend hiking in the morning or the evening because there isn’t a lot of shade and less people on the trail I would also recommend bringing at least 1.5liters of water and a couple snacks. Have fun and enjoy the view! 
Follow me on Instagram @adventureswithchase to see more of my traveling adventures! "
18,2019-07-08,['hiking'],Loved the view the entire way! and the clean air was a plus. Got it done in 2 hours total up and down. Great place to set personal goals. make sure to take plenty of water and some snacks
19,2019-07-04,['hiking'],"Loved the trail! it was beautiful all the way up and down. The only hard thing is I have a pup who LOVES to say ""hi"" to everyone and the trails are pretty thin. But we loved it overall."
20,2019-07-03,['hiking'],"Hiked this 4mil with kids (6,8,10) and thought it was a pretty moderate hike for them. Most of the trail was in the sun but there were quite a few spots in shade, which was a welcome treat. Arrived at 9 and there were about 8 cars parked, when we reached the caves there was only 2 other families there and they left shortly after.
The views were gorgeous and the caves were neat, especially for Northern Utah. All of the kids really enjoyed climbing and playing in them."
21,2019-07-02,"['hiking', 'bugs']","In town from Seattle and wanted to get in a great workout. We’re used to a big finish with mountains, lakes or rivers in the PNW and figured the caves would be right up there. The hike itself was really hard and I’m pretty fit. The caves were neat I suppose but nothing close to how much effort we put into getting there. "
22,2019-06-30,['hiking'],good trail. not the trail I would recommend if you are looking for your own private trail. lots of people hike here. Still has great scenery and is well maintained.
23,2019-06-29,"['hiking', 'bugs']",
24,2019-06-28,['hiking'],"Very popular hike and it’s an easy one for kids, the view once you reach the wind caves are amazing, highly recommend for families "
25,2019-06-28,"['hiking', 'no shade']","My dad and I hiked this trail at the end of June. The side that’s hiked up is a fairly steep grade and is open to the sun. The caves at the top are kind of cool. The first one is right under the submit and the second is around the corner of the first. Super heavily trafficked. We got there at 9 am, but wish we would’ve gone earlier to beat the crowds. I’d say it’s fairly unique at the top, but other places in Utah have more to offer."
26,2019-06-28,['hiking'],great trail
27,2019-06-17,['hiking'],"It's a great, basic trail for all ages! It's a favorite of ours."
28,2019-06-17,['hiking'],Nice views but the trail is too busy. It’s the most popular destination for local families with children so avoid it if you’re looking for a quiet hike in wilderness!
29,2019-06-17,['hiking'],My kids (3-13) loved it! I did have to carry the 3 year old for about half of it. Two hours of hiking total and 45 minute break for dinner at the top! 
30,2019-06-12,['hiking'],hiked with family. 11 yr olds - this was the extent of their limit. great views. caves are amazing. crowded trail. well marked trail for early June. 
31,2019-06-10,['hiking'],"GORGEOUS hike. You will have incredible, breathtaking views all throughout this hike, especially at the end. The caves and the view is so rewarding. The hike was fairly easy. My husband and I took our two kids ( 10 months and 7) and our dog. I carried my 10 month old. Pretty good amount of shade and sun. Weather was perfect! A bit cool with a nice breeze. Take sunscreen, I'm burnt. One of many of my favorite hikes!"
32,2019-06-07,['hiking'],"Very great trail. Description is accurate. Lots of people for sure, but a beautiful overlook/caves at the top"
33,2019-05-30,['hiking'],Was a great hike with some amazing views both at the top and along the way!
34,2019-05-27,['hiking'],Awesome hike! Great views and cool caves at the end! 
35,2019-05-27,[''],"Beautiful hike. Make sure to stick to the trail, we decided to try an off the path detour (BIG mistake) ended up practically rock climbing down then back up to find the trail again. We were lucky to see some deer which was pretty awesome. Definitely an uphill hike, but well worth it."
36,2019-05-27,['hiking'],Took my two young boys on this hike. They loved it! 
37,2019-05-26,['hiking'],"We loved this trail. Bring water and a hat. The caves at the end are worth it! Plenty of signage, including signs saying to stay on the trail...three groups we ran into must not have understood what that meant. I had two boys who wanted to explore off path so I get it, but had to reign them in and follow the rules. When under the cave, follow the cave wall around to the left, there is another big cliffside cave."
38,2019-05-25,['hiking'],Love it!
39,2019-05-12,['hiking'],"My family went on this trail today for the very first time. We arrived just after ten and the parking area was already full, we lucked out and got a spot. The trail itself just goes up and up and up with switchbacks. There were some shaded areas in the beginning of the hike, but less so as we got higher up the mountain. This trail had tons of activity, mainly college students, and everyone was friendly and courteous. When we reached the Wind cave it was nice and cool inside with a great breeze blowing through. Some spots of the trail had some larger drop offs, so be cautious if hiking with smaller kids, as well as inside the cave with the smaller loose rocks. The entire hike round trip was 4.42 miles according to our Endomondo apps. Highly recommend, just come early, bring sufficient water, and enjoy the amazing views!"
40,2019-05-11,['hiking'],Great place to take puppy and kids. We has a family had a blast. Great view and other hikers were very kind to our slow group. Haha
41,2019-05-06,['hiking'],"Beautiful views. Definitely an early morning hike, starts to get busy after noon."
42,2019-05-05,['hiking'],This trail has been a favorite for over 20 years. I hike it with a weighted pack to train for longer backpacking trips.
43,2019-05-01,[''],great view from the top !
44,2019-04-17,"['hiking', 'muddy', 'snow']","Pretty easy trail, there was a lot of snow and mud but it made it all the more fun! The view from the top was amazing"
45,2019-04-07,"['hiking', 'muddy']","My first Utah trail...I enjoyed it although I was probably expecting more from the Wind caves at the top.  Scenery was great.  The definition of moderate fades in a couple of spots but overall, a casual hike."
46,2019-04-04,"['hiking', 'muddy']",Still a bit muddy/snowy at the top as of April 1st. Totally doable though!
47,2019-04-01,[''],Really muddy still. alot of steep parts but cool caves at the end.
48,2019-03-18,['hiking'],This was a great hike with awesome views of the canyon!  Some of the hike is a little rough but if you take it slow you will be fine.
49,2019-02-17,['hiking'],"Beautiful views of Logan Canyon from step one with the money shot at the top. It was a pleasing hike some steep areas with mud, but they call that hiking! Strongly recommended for a great day hike!"
50,2019-01-28,[''],great trail. wonderful view. hiked it in January with snow and it was a little slick but it wasnt bad. totally doable.
51,2019-01-26,"['hiking', 'muddy', 'snow']",
52,2019-01-25,[''],Great trail with many amazing views of the canyon.  The Wind Caves themselves are pretty awesome and are deserving of a little exploring.
53,2018-12-02,[''],One of the most beautiful trails I have been on. Highly recommend. I wouldn't recommend taking small children.
54,2018-11-22,['hiking'],"Great for a quick mid morning hike. 
Up and back is about a 1.5 hrs.
Love the view from the cave."
55,2018-10-21,['hiking'],"5 stars, this trail was breathtaking.  Fall colors were glorious and getting to the caves at sunset with no other people there, to die for.  Amazing.  Will do again."
56,2018-10-09,['hiking'],"I've wanted to do this one for a while, and finally made it up today with a few friends. The trail is relatively steep, but well marked. I really enjoyed the hike; one of the best in northern Utah in my opinion. A brisk fall day might have contributed to how much I enjoyed it, because we had the cave all to ourselves."
57,2018-10-07,[''],"Fun, easy hike. Took me 45 minutes to reach the cave.  October 6,2018.  Not too difficult,  beautiful weather."
58,2018-10-03,[''],Great quick hike. Beautiful views.
59,2018-10-01,['hiking'],Beautiful hike! Nice breeze and sounds of birds the whole way. The colors of the leafs are so brilliant right now! The cave at the end is a treat! Highly recommend. Not too steep !
60,2018-09-24,[''],"I went with three other friends early in the morning 9am this fall (totally recommend going in the fall). We stopped a lot for pictures and to catch our breath. (One has asthma). But we still made it up to the Caves in an hour and 45 mins. When we got there, the Caves were underneath so we climbed down to them and it was fantastic! We ate lunch there and it was wonderful weather, once in a while a big gust blows at you but not like you’re going to be pushed around. As a group, we went around the cave to find another one next to it. Be careful, even with good shoes it’s very slippery (dry). We decided to go down what looked like a trial and it lead us back to the original trail. Warning, about 2/3 there’s a fork in the trail. Left side is a very steep cliff that’s about a 9ft drop. It’s manageable if you have people around you. The right also has a small drop and it’s manageable for one person. Over all, the whole adventure took about 4 hours. I’d totally do this again(even going through the steep trail). Makes great memories with friends! Also, I’m not an experienced hiker. I’m mediocre at best. Have fun!"
61,2018-09-23,[''],very cool and worth the effort
62,2018-09-17,['hiking'],great views and great experience
63,2018-09-02,['hiking'],"Beautiful hike. Loved the caves, and view of the canyon.  Didn’t love hearing the vehicles on the road for the first half mile up.  Good climb up for sure but Kids did a great job, and so did we. Got started late on the hike so it was very hot with A lot of hikers. Would recommend starting early in the day and going in the fall for sure."
64,2018-08-26,['hiking'],"Fantastic hike to kill a few hours. Gorgeous views of Logan Canyon with a really fun cave at the end. If you are lucky enough to be there in early autumn when the leaves have changed it is truly breathtaking. It's a very popular hike, so if solitude is what you're after this is not the place to find it. Unfortunately, some idiots have graffitied numerous spots on the trail which detracts from the beauty. Please be respectful of nature and other hikers by leaving your ridiculous love declarations and hashtags where they belong. Hint: Not here."
65,2018-08-22,['hiking'],"Fun, quick hike for an afternoon or evening that will get the blood pumping and the sweat dripping! Great hike for the whole fam!"
66,2018-08-17,[''],Definitely a strenuous hike for unconditioned bodies! Well trafficked area with lots of people on the trail. Dogs allowed which is nice. Available parking close to entrance during the week. Lots of kids. Good warm up hike for the newly adventurous.
67,2018-07-29,['hiking'],"Our family has completed this hike three times now, most recently was September 2017. Our 9, 8 and 6 year-olds did well. Our 4-year-old had to be carried quite a bit. We took our time to enjoy the views etc. This hike is best enjoyed in fall, imho. The top does make me a little nervous with the children."
68,2018-07-28,[''],"Hiked this trail again on Wednesday for probably my 25th time.  I’ve lost count.  Had a great time.  It’s dry, bit we saw a few people we knew also out enjoying this trail.  Great for kids 10 and older because the caves at the end have drop offs that little ones might be a little scared of.

You get a great view of the China Wall portion of the Crimson Trail on the other side of Logan Canyon.

Worth it every time and would definitely recommend this trail if you are in the area and want a good hike that will take about 4 total hours from downtown to the top and back to downtown."
69,2018-07-23,[''],beautiful
70,2018-07-20,['hiking'],"A definite uphill battle to get there, but it had its gorgeous spots, especially the caves. My 4 year old had a tough time and had to be carried."
71,2018-07-16,[''],So . . . cave is a understatement more like wind blown hole in the side of a mountain. It is a steep trail. Also this is the only trail I have ever got a tick on. Lower ankle (lucky) stuck in hair.
72,2018-07-12,[''],This is a great hike for the family. Not too difficult and some cool caves at the end.
73,2018-07-10,[''],Great trail but it's pretty difficult! it's totally worth the challenge!
74,2018-07-09,['hiking'],Beautiful views at the top.
75,2018-07-08,[''],Great hike to bring the kids on.  Make sure to bring plenty of water and sunscreen as much of the trail is not shaded.
76,2018-07-05,['hiking'],"This is a fine hike. Not hard, small incline and your at a few formed arches and caves. I can see some marking this as a 5 star, then coming back and making it a 2 or 3 as they experience better hikes. A lot of locals seem to do this as it is easy and popular."
77,2018-07-04,['hiking'],Beautiful views and worth doing in different seasons.
78,2018-06-26,[''],Great hike for the family. My four year old little girl was able to make it to the caves so that might give you an idea of the difficulty.
79,2018-06-16,[''],This hike is pretty steep in a lot of places so it's harder on the knees. There isn't a lot of shade. I feel like there are way better hikes up the Logan Canyon.
80,2018-06-16,['hiking'],Great view for a slightly under moderate hike.
81,2018-06-15,['hiking'],Beautiful trail...great views...enjoyed this nice break from our drive from Montana to Moab.
82,2018-06-13,[''],"It's a hot hike. take water, keep and eye on the kids. Beautiful though"
83,2018-06-10,[''],Great trail and the view is worth the hike. I took my 9year old boys & they had a great time. I was a little nervous at the top because it has a sharp cliff in the caves. Just watch your kids carefully at the top!
84,2018-06-10,['hiking'],It is easy hike if you are hiking every week. No sport shoes please take your hiking shoes or boots. It is hot between 12pm and 5pm during summer months.
85,2018-06-10,['hiking'],Loved this hike! We went in the late afternoon to evening and it was really nice.. not too hot and good shade areas. The cave at the end was awesome so bring cameras.
86,2018-06-06,['hiking'],"Went barefoot, it hurt. But well worth it...I think"
87,2018-06-02,[''],Absolutely beautiful end. Worth every step.
88,2018-05-31,['hiking'],"Beautiful hike. Saw a baby rattlesnake on the trail, so keep watch. Didn't seem too far to the top and the views were excellent from the top and also along the switchbacks during the ascent. Would definitely do this one again."
89,2018-05-27,[''],The views were beautiful the whole way and the cave at the end was fantastic! Watch out for snakes though!
90,2018-05-20,[''],A good hike for most age groups. I frequently see young children on the trail as well as elderly couples. Take your time and enjoy the sights! Beautiful ending with the wind cave.
91,2018-05-16,['hiking'],"This is one of the best Logan hikes.  Although every time I hike it, it doesn't feel worth it until near the end.  Great views.  Should be called wind arch trail.  Can be busy.  Best times to hike are early summer and when the fall colors are prime."
92,2018-04-27,['hiking'],This hike kicked my butt (I’m not an active hiker) but it was well worth it. The view is absolutely beautiful!
93,2018-04-24,[''],"Is very scenic and awesome to climb with friends ...but climb with caution , very steep hill sides"
94,2018-04-21,['hiking'],"Did not have to walk in the water in the first 10 minutes. 
No snow on 4/20/18, a slight breeze, very pleasant weather! I suggest you start at least mid day, that way the wind cave wont be in the shadow of the hill its on. Better lighting for better pictures. This is a unique, natural formation; it is a nice reward for the hike. 
This is very doable, don't let the elevation gain per mile scare you off. We saw parents with kids and a dog, old people trail running, and some parents packing a baby up. This is great for anyone. If I lived in Logan, I would be here quite a bit."
95,2018-04-20,[''],Beautiful hike and the caves are amazing. So cool with great views.
96,2018-04-04,['hiking'],"Written from inside the cave.

Up here in the wind caves, if you sit inside, it's like you’re sitting in a big ear. You sit and listen with more power than normal human hearing because the rock interior gathers a large quantity of sound and funnels it down toward you.You hear the hum of the valley. Mostly the hum of humans. An airplane up overhead, a semi truck on the highway far below. But overall the sound that you hear is the wind... and the water; the forces that created these strange rock formations and this valley. You’re reminded that while humans are a force, nature is a much more powerful force. Out here you feel like just another living thing among the living things. You feel small.Your wants and worries feel insignificant. All you need is food, water, and shelter. You don’t hear people clamoring for an iPhone X or a new pair of Jordans. You don’t hear people moving to an affluent neighborhood or networking. You don't hear the ""ding!"" of a notification on your phone. You don’t hear people stunting on one another. A mountain lion could remove you from this life in the next twenty minutes. You’re listening for his silent footsteps through the brush. There isn’t time to dwell on much of anything. There’s only time to feel the rawness and realness of being just a human."
97,2018-04-02,[''],What a great hike! Beautiful scenery all around.
98,2018-04-02,[''],"Good hike, but not really too pretty. I’m sure in the fall it would be more beautiful."
99,2018-04-01,['hiking'],Good leg burner to start the Spring with.
100,2018-03-12,[''],"Hiked this on the morning of March 3 after a decent snow shower the night before. My husband and I had microspikes but you could probably make it up with just decent hiking shoes.  The sky threatened more snow, but the dry weather held out."
101,2018-02-11,[''],"Very pretty! This hike will get you breathing, but it’s not hard. Mostly dry, but there was a bit of mud towards the top. The cave itself kind of freaked me out with how slanted it was. 

My Strava recording said it was 4.0 miles, 1204 elevation and it took 1 hour 23 mins."
102,2018-02-11,['hiking'],"We hiked this trail the other day. It was beautiful, especially in this unusually warm weather we’ve been having. Very little mud. Definitely worth it. We took our roommates’ pup and he had a blast!"
103,2018-02-04,[''],Very pretty cave. Somewhat steep but not hard.
104,2018-01-21,['hiking'],"I liked the hike and the views... the ""lunch cave"" was warm and had a great view. The trail was busy and full of mud, slush, packed ice and snow. I'm way out of shape and it took me longer than most up and down but I enjoyed it. Thought it was only 3.5 miles round trip... I was fooled! I seemed to be the only one falling. I'd still do it again only in dryer conditions... or more frozen."
105,2018-01-15,['hiking'],"While the elevation is a lot, the grade I felt wasn't as steep as some of the trails we have done near Salt Lake City. It seemed to be more gradual... I enjoyed this hike and would do it again! We went on a Saturday afternoon, Jan 13.. temperatures were in the 40s... the trail was moderately crowded.. we saw about 6 other parties going up and down. The trail was muddy, slushy, icy and slippery in places, so our microspikes did come in handy! We heard there are often rattlesnakes spotted on this trail, though we did not see any. I don't know if they tend to come out more in the summer.... 

Note: our stats were 4.4 miles, 1,280 ft elevation. This is in comparison to the alltrails stats of 3.5 miles, 1,000 ft elevation."
106,2018-01-15,[''],Steep
107,2017-12-19,[''],Hiked it today little bit of snow/ice on trail. No problem with trackes. Nice hike moderately steep.
108,2017-10-12,[''],Did this hike on the drive from Salt Lake to Jackson. Well worth the stop! Pretty cool cave to check out at the top.
109,2017-10-08,[''],Fall colors are awesome right now!
110,2017-09-27,['hiking'],"Awesome spot! Gotta put in the work for that awesome view, by it's totally worth it."
111,2017-09-27,[''],Great view. Very popular lots of college students
112,2017-09-25,[''],
113,2017-09-18,['hiking'],"Definitely a work out in the first 2 miles. I unfortunately had to turn back because my dog got too tired. However, it was a well kept trail with a decent but not over-abundant amount of traffic."
114,2017-09-13,[''],"Did this hike in the winter, an amazing view"
115,2017-09-12,[''],Worth the climb
116,2017-09-05,[''],A lot steeper then our normal hikes.  My 7 yr old only made it with a lot of stops and a lot of encouragement.  Teenagers made the t with no problem.  Great view from the caves.
117,2017-09-05,[''],good trail.
118,2017-08-30,[''],Went for class. It was a blast. But it was steep. That's the hardest part. I took a lot of breaks along the way. It took me two hours to get up there and one hour to go down. But when you get to the caves it's worth it!
119,2017-08-26,[''],I would rate this trail at the low end of moderate. The caves were interesting. If you are looking for a pretty hike with shade this is not for you!
120,2017-08-23,[''],me and my little dog did the trail it took us a while but I am an extremely heavy woman. but we did it it was absolutely breathtaking
121,2017-08-21,[''],Amazing!!! Loved the whole thing! View at the top is spectacular! ❤️
122,2017-08-19,[''],This northeasterner was a bit winded at the high elevation but so worth it.
123,2017-08-16,[''],We did this hike in late spring when there was still some snow on the ground. There were long switchbacks and it was slippery and narrow in a few places. The wind caves were breathtaking.
124,2017-07-28,[''],"Fun summer hike, with some shade. Our active kids 5 and 7 did great."
